dataset,model,winter_season,train_start,train_end,val_start,val_end,train_days,test_days,rmse_train,rmse_val,rmse_average,train_day_count,test_day_count,R1,C1,g
EOH0003_merged_30min.parquet,1C1R1P1S,2021-2022,03/12/2021 00:00,30/01/2022 23:30,14/12/2021 00:00,08/02/2022 23:30,"2021-12-03,2021-12-07,2021-12-18,2021-12-20,2022-01-16,2022-01-19,2022-01-26,2022-01-27,2022-01-28,2022-01-30","2021-12-14,2021-12-17,2021-12-24,2022-01-09,2022-02-08",0.504570743,0.509574863,0.507072803,10,5,0.007548173,40919537.22,13.4398995
EOH0014_merged_30min.parquet,1C1R1P1S,2021-2022,23/12/2021 00:00,19/02/2022 23:30,25/12/2021 00:00,28/02/2022 23:30,"2021-12-23,2021-12-24,2021-12-29,2022-01-01,2022-01-18,2022-01-21,2022-01-24,2022-02-09,2022-02-12,2022-02-19","2021-12-25,2022-01-17,2022-01-20,2022-02-07,2022-02-28",0.709357904,0.935807673,0.822582789,10,5,0.006439442,18186501.93,0.249881313
EOH0018_merged_30min.parquet,1C1R1P1S,2021-2022,04/12/2021 00:00,17/02/2022 23:30,07/12/2021 00:00,06/02/2022 23:30,"2021-12-04,2021-12-05,2021-12-10,2021-12-26,2021-12-29,2022-01-15,2022-01-23,2022-01-31,2022-02-01,2022-02-17","2021-12-07,2021-12-21,2022-01-16,2022-01-27,2022-02-06",0.702985324,0.893721278,0.798353301,10,5,0.005211947,22677365.05,2.288106416
EOH0021_merged_30min.parquet,1C1R1P1S,2021-2022,02/12/2021 00:00,22/02/2022 23:30,20/12/2021 00:00,18/02/2022 23:30,"2021-12-02,2021-12-08,2021-12-13,2022-01-06,2022-01-10,2022-01-12,2022-02-06,2022-02-09,2022-02-14,2022-02-22","2021-12-20,2021-12-26,2022-01-25,2022-02-15,2022-02-18",0.361006367,0.491844247,0.426425307,10,5,0.004268305,91300424.44,1.00E-06
EOH0025_merged_30min.parquet,1C1R1P1S,2021-2022,16/12/2021 00:00,27/02/2022 23:30,12/01/2022 00:00,15/02/2022 23:30,"2021-12-16,2021-12-26,2022-01-15,2022-01-17,2022-01-23,2022-01-24,2022-01-31,2022-02-11,2022-02-12,2022-02-27","2022-01-12,2022-01-22,2022-02-01,2022-02-07,2022-02-15",0.345745758,0.295474104,0.320609931,10,5,0.017065773,34220796.79,1.00E-06
EOH0026_merged_30min.parquet,1C1R1P1S,2021-2022,13/12/2021 00:00,24/02/2022 23:30,20/12/2021 00:00,26/02/2022 23:30,"2021-12-13,2021-12-18,2021-12-21,2021-12-24,2021-12-30,2022-01-22,2022-02-05,2022-02-18,2022-02-23,2022-02-24","2021-12-20,2021-12-22,2021-12-23,2022-01-12,2022-02-26",0.400908838,0.322205771,0.361557305,10,5,0.00507101,47646063,1.00E-06
EOH0027_merged_30min.parquet,1C1R1P1S,2021-2022,02/12/2021 00:00,27/02/2022 23:30,13/12/2021 00:00,22/02/2022 23:30,"2021-12-02,2021-12-19,2021-12-20,2021-12-25,2021-12-31,2022-01-20,2022-02-05,2022-02-13,2022-02-23,2022-02-27","2021-12-13,2022-01-03,2022-02-12,2022-02-20,2022-02-22",0.622174762,0.793277054,0.707725908,10,5,0.006010373,41120466.07,1.00E-06
EOH0031_merged_30min.parquet,1C1R1P1S,2021-2022,07/12/2021 00:00,28/02/2022 23:30,04/12/2021 00:00,06/02/2022 23:30,"2021-12-07,2021-12-11,2021-12-22,2022-01-05,2022-01-18,2022-01-23,2022-02-14,2022-02-15,2022-02-26,2022-02-28","2021-12-04,2021-12-15,2021-12-23,2022-02-01,2022-02-06",0.161769354,0.208386869,0.185078111,10,5,0.004958209,148959168.6,0.520547766
EOH0033_merged_30min.parquet,1C1R1P1S,2021-2022,02/12/2021 00:00,26/02/2022 23:30,06/12/2021 00:00,14/02/2022 23:30,"2021-12-02,2021-12-10,2021-12-14,2021-12-23,2021-12-29,2021-12-30,2022-02-06,2022-02-08,2022-02-19,2022-02-26","2021-12-06,2021-12-11,2022-01-12,2022-02-07,2022-02-14",0.806176188,0.972932695,0.889554442,10,5,0.003825954,32421906.39,11.22335069
EOH0038_merged_30min.parquet,1C1R1P1S,2021-2022,07/12/2021 00:00,22/02/2022 23:30,17/12/2021 00:00,24/02/2022 23:30,"2021-12-07,2021-12-09,2021-12-12,2021-12-22,2021-12-30,2022-01-27,2022-01-30,2022-02-02,2022-02-03,2022-02-22","2021-12-17,2021-12-28,2021-12-31,2022-02-19,2022-02-24",0.430097042,0.59526968,0.512683361,10,5,0.00593432,238594435.1,11.94459868
EOH0043_merged_30min.parquet,1C1R1P1S,2021-2022,03/12/2021 00:00,26/02/2022 23:30,05/12/2021 00:00,18/02/2022 23:30,"2021-12-03,2022-01-03,2022-01-11,2022-01-14,2022-01-15,2022-01-28,2022-01-31,2022-02-13,2022-02-16,2022-02-26","2021-12-05,2022-01-05,2022-01-16,2022-01-20,2022-02-18",0.64822939,0.755528213,0.701878801,10,5,0.004479932,32975228.13,1.00E-06
EOH0047_merged_30min.parquet,1C1R1P1S,2021-2022,07/12/2021 00:00,19/02/2022 23:30,13/12/2021 00:00,13/02/2022 23:30,"2021-12-07,2021-12-20,2021-12-23,2021-12-25,2021-12-26,2022-01-20,2022-01-21,2022-02-02,2022-02-03,2022-02-19","2021-12-13,2021-12-16,2022-01-23,2022-02-05,2022-02-13",0.35857286,0.61919506,0.48888396,10,5,0.003282921,68140307.71,7.556107679
EOH0048_merged_30min.parquet,1C1R1P1S,2021-2022,04/12/2021 00:00,27/02/2022 23:30,02/12/2021 00:00,24/01/2022 23:30,"2021-12-04,2021-12-10,2021-12-12,2021-12-17,2021-12-24,2022-01-02,2022-01-08,2022-01-25,2022-02-24,2022-02-27","2021-12-02,2021-12-11,2021-12-28,2022-01-04,2022-01-24",0.497762234,0.560683479,0.529222856,10,5,0.00584428,38649540.01,6.220221709
EOH0063_merged_30min.parquet,1C1R1P1S,2021-2022,17/12/2021 00:00,20/02/2022 23:30,07/12/2021 00:00,22/02/2022 23:30,"2021-12-17,2021-12-22,2021-12-23,2021-12-24,2022-01-06,2022-01-09,2022-01-14,2022-01-19,2022-01-23,2022-02-20","2021-12-07,2021-12-11,2022-01-28,2022-02-06,2022-02-22",0.61919718,0.693598548,0.656397864,10,5,0.009769971,33475641.67,1.00E-06
EOH0065_merged_30min.parquet,1C1R1P1S,2021-2022,11/12/2021 00:00,17/02/2022 23:30,12/01/2022 00:00,27/02/2022 23:30,"2021-12-11,2021-12-31,2022-01-14,2022-01-21,2022-01-24,2022-01-27,2022-01-31,2022-02-07,2022-02-10,2022-02-17","2022-01-12,2022-01-22,2022-01-26,2022-02-13,2022-02-27",0.749807461,0.8368368,0.79332213,10,5,0.007988376,37025688.31,1.00E-06
EOH0066_merged_30min.parquet,1C1R1P1S,2021-2022,16/12/2021 00:00,25/02/2022 23:30,03/12/2021 00:00,08/02/2022 23:30,"2021-12-16,2021-12-20,2021-12-29,2022-01-08,2022-01-19,2022-01-26,2022-02-03,2022-02-07,2022-02-23,2022-02-25","2021-12-03,2021-12-14,2022-01-13,2022-01-14,2022-02-08",0.345741421,0.392107782,0.368924601,10,5,0.005835398,54005412.04,5.301471678
EOH0067_merged_30min.parquet,1C1R1P1S,2021-2022,15/12/2021 00:00,28/02/2022 23:30,05/12/2021 00:00,20/02/2022 23:30,"2021-12-15,2021-12-28,2022-01-02,2022-01-13,2022-01-17,2022-01-25,2022-02-07,2022-02-09,2022-02-26,2022-02-28","2021-12-05,2021-12-18,2021-12-23,2022-01-10,2022-02-20",0.655779556,0.753303584,0.70454157,10,5,0.010103915,21538954.21,1.00E-06
EOH0069_merged_30min.parquet,1C1R1P1S,2021-2022,05/12/2021 00:00,25/02/2022 23:30,13/12/2021 00:00,27/02/2022 23:30,"2021-12-05,2022-01-06,2022-01-25,2022-01-29,2022-02-05,2022-02-19,2022-02-20,2022-02-21,2022-02-22,2022-02-25","2021-12-13,2021-12-28,2022-01-18,2022-02-04,2022-02-27",0.491678893,0.355223171,0.423451032,10,5,0.004919877,100691010.9,1.198957717
EOH0073_merged_30min.parquet,1C1R1P1S,2021-2022,10/12/2021 00:00,28/02/2022 23:30,01/12/2021 00:00,30/01/2022 23:30,"2021-12-10,2021-12-22,2022-01-01,2022-01-10,2022-01-13,2022-01-20,2022-01-24,2022-01-28,2022-01-31,2022-02-28","2021-12-01,2021-12-07,2021-12-29,2022-01-26,2022-01-30",0.440987029,0.403934119,0.422460574,10,5,0.004312421,42654702.61,5.486024011
EOH0075_merged_30min.parquet,1C1R1P1S,2021-2022,01/12/2021 00:00,24/02/2022 23:30,27/12/2021 00:00,29/01/2022 23:30,"2021-12-01,2021-12-05,2021-12-06,2021-12-15,2022-01-03,2022-01-09,2022-01-11,2022-02-08,2022-02-21,2022-02-24","2021-12-27,2021-12-29,2022-01-04,2022-01-06,2022-01-29",0.448804932,0.585354421,0.517079677,10,5,0.010004092,24035870.17,1.00E-06
EOH0079_merged_30min.parquet,1C1R1P1S,2021-2022,09/12/2021 00:00,26/02/2022 23:30,06/12/2021 00:00,25/02/2022 23:30,"2021-12-09,2021-12-12,2021-12-19,2021-12-26,2021-12-27,2022-01-12,2022-01-13,2022-01-18,2022-02-21,2022-02-26","2021-12-06,2021-12-25,2021-12-31,2022-02-02,2022-02-25",0.365548981,0.437536969,0.401542975,10,5,0.005468088,47013294.6,0.158131697
EOH0082_merged_30min.parquet,1C1R1P1S,2021-2022,05/12/2021 00:00,13/01/2022 23:30,01/12/2021 00:00,12/01/2022 23:30,"2021-12-05,2021-12-09,2021-12-13,2021-12-19,2021-12-20,2021-12-25,2021-12-26,2021-12-31,2022-01-01,2022-01-13","2021-12-01,2021-12-02,2022-01-03,2022-01-09,2022-01-12",0.951738898,0.994475527,0.973107213,10,5,0.003839297,15071675.47,8.215712288
EOH0091_merged_30min.parquet,1C1R1P1S,2021-2022,05/12/2021 00:00,04/02/2022 23:30,23/12/2021 00:00,24/02/2022 23:30,"2021-12-05,2021-12-17,2021-12-19,2021-12-20,2022-01-01,2022-01-08,2022-01-15,2022-01-16,2022-01-30,2022-02-04","2021-12-23,2021-12-27,2022-02-14,2022-02-23,2022-02-24",0.250636695,0.185387959,0.218012327,10,5,0.004764288,299999999.9,30
EOH0094_merged_30min.parquet,1C1R1P1S,2021-2022,01/12/2021 00:00,21/02/2022 23:30,06/12/2021 00:00,24/02/2022 23:30,"2021-12-01,2021-12-24,2021-12-25,2021-12-30,2022-01-13,2022-01-16,2022-02-04,2022-02-12,2022-02-15,2022-02-21","2021-12-06,2021-12-10,2021-12-16,2022-01-01,2022-02-24",0.559433013,0.546833508,0.553133261,10,5,0.003725395,47484135.72,3.579722737
EOH0102_merged_30min.parquet,1C1R1P1S,2021-2022,22/12/2021 00:00,24/02/2022 23:30,09/12/2021 00:00,09/02/2022 23:30,"2021-12-22,2021-12-28,2022-01-23,2022-01-27,2022-01-31,2022-02-08,2022-02-11,2022-02-14,2022-02-18,2022-02-24","2021-12-09,2021-12-13,2022-01-30,2022-02-05,2022-02-09",0.53547908,0.510901092,0.523190086,10,5,0.005404495,43664636.35,1.00E-06
EOH0105_merged_30min.parquet,1C1R1P1S,2021-2022,06/12/2021 00:00,08/02/2022 23:30,03/12/2021 00:00,07/02/2022 23:30,"2021-12-06,2021-12-12,2021-12-23,2021-12-24,2021-12-27,2022-01-12,2022-01-18,2022-01-22,2022-01-25,2022-02-08","2021-12-03,2022-01-09,2022-01-28,2022-02-01,2022-02-07",0.356340283,0.360331864,0.358336074,10,5,0.005089663,52562942.79,1.524165218
EOH0107_merged_30min.parquet,1C1R1P1S,2021-2022,03/12/2021 00:00,14/02/2022 23:30,02/12/2021 00:00,30/01/2022 23:30,"2021-12-03,2022-01-25,2022-01-26,2022-01-29,2022-02-02,2022-02-03,2022-02-07,2022-02-10,2022-02-13,2022-02-14","2021-12-02,2021-12-04,2021-12-08,2022-01-21,2022-01-30",0.764919219,0.59216655,0.678542885,10,5,0.00645386,44071428.91,1.00E-06
EOH0121_merged_30min.parquet,1C1R1P1S,2021-2022,08/12/2021 00:00,24/02/2022 23:30,16/12/2021 00:00,25/02/2022 23:30,"2021-12-08,2021-12-24,2021-12-25,2022-01-01,2022-01-07,2022-01-08,2022-01-09,2022-01-17,2022-02-20,2022-02-24","2021-12-16,2022-01-25,2022-02-06,2022-02-09,2022-02-25",0.465011258,0.5757864,0.520398829,10,5,0.00642388,38605643.71,9.729621935
EOH0126_merged_30min.parquet,1C1R1P1S,2021-2022,08/12/2021 00:00,09/02/2022 23:30,02/12/2021 00:00,05/02/2022 23:30,"2021-12-08,2021-12-27,2022-01-02,2022-01-06,2022-01-11,2022-01-12,2022-01-23,2022-01-24,2022-01-29,2022-02-09","2021-12-02,2021-12-06,2022-01-15,2022-01-22,2022-02-05",0.682585647,0.60474623,0.643665938,10,5,0.006663244,20650169.81,6.776990289
EOH0132_merged_30min.parquet,1C1R1P1S,2021-2022,14/12/2021 00:00,23/02/2022 23:30,26/12/2021 00:00,17/02/2022 23:30,"2021-12-14,2021-12-20,2021-12-23,2021-12-25,2021-12-29,2022-01-04,2022-01-27,2022-02-11,2022-02-21,2022-02-23","2021-12-26,2021-12-28,2022-01-21,2022-01-30,2022-02-17",0.388797223,0.551260539,0.470028881,10,5,0.005592956,50543489.64,1.566154349
EOH0144_merged_30min.parquet,1C1R1P1S,2021-2022,27/12/2021 00:00,22/02/2022 23:30,06/01/2022 00:00,29/01/2022 23:30,"2021-12-27,2021-12-28,2021-12-29,2022-01-12,2022-01-16,2022-01-18,2022-02-07,2022-02-15,2022-02-16,2022-02-22","2022-01-06,2022-01-07,2022-01-09,2022-01-21,2022-01-29",0.58058517,0.571002765,0.575793968,10,5,0.011609578,14076799.14,1.988119871
EOH0159_merged_30min.parquet,1C1R1P1S,2021-2022,28/12/2021 00:00,13/02/2022 23:30,06/12/2021 00:00,28/02/2022 23:30,"2021-12-28,2021-12-29,2021-12-30,2022-01-06,2022-01-13,2022-01-17,2022-01-20,2022-01-26,2022-01-27,2022-02-13","2021-12-06,2021-12-26,2022-02-14,2022-02-15,2022-02-28",0.429580248,0.515404265,0.472492256,10,5,0.005804498,69993423.8,7.2795986
EOH0166_merged_30min.parquet,1C1R1P1S,2021-2022,01/12/2021 00:00,27/02/2022 23:30,03/01/2022 00:00,10/02/2022 23:30,"2021-12-01,2021-12-15,2021-12-23,2022-01-27,2022-02-02,2022-02-04,2022-02-09,2022-02-18,2022-02-24,2022-02-27","2022-01-03,2022-02-01,2022-02-05,2022-02-06,2022-02-10",0.490759888,0.407649417,0.449204653,10,5,0.006328776,71002036.44,1.00E-06
EOH0174_merged_30min.parquet,1C1R1P1S,2021-2022,07/12/2021 00:00,06/02/2022 23:30,05/12/2021 00:00,14/02/2022 23:30,"2021-12-07,2021-12-12,2022-01-01,2022-01-03,2022-01-19,2022-01-23,2022-01-25,2022-01-29,2022-02-05,2022-02-06","2021-12-05,2021-12-17,2022-01-26,2022-02-13,2022-02-14",0.205253681,0.320117381,0.262685531,10,5,0.004477607,67184395.8,5.150489176
EOH0177_merged_30min.parquet,1C1R1P1S,2021-2022,12/12/2021 00:00,15/02/2022 23:30,07/12/2021 00:00,01/02/2022 23:30,"2021-12-12,2021-12-14,2021-12-15,2022-01-06,2022-01-09,2022-01-13,2022-01-15,2022-01-25,2022-02-10,2022-02-15","2021-12-07,2021-12-10,2021-12-11,2022-01-21,2022-02-01",0.52508683,0.419115308,0.472101069,10,5,0.00502862,168942384.2,1.01E-06
EOH0184_merged_30min.parquet,1C1R1P1S,2020-2021,18/12/2020 00:00,06/02/2021 23:30,05/12/2020 00:00,05/02/2021 23:30,"2020-12-18,2020-12-20,2020-12-21,2021-01-01,2021-01-04,2021-01-25,2021-01-26,2021-01-27,2021-02-01,2021-02-06","2020-12-05,2020-12-12,2021-01-20,2021-02-02,2021-02-05",0.508581191,0.614634048,0.561607619,10,5,0.01011676,73551700.94,12.89618321
EOH0185_merged_30min.parquet,1C1R1P1S,2021-2022,02/12/2021 00:00,20/02/2022 23:30,17/01/2022 00:00,22/02/2022 23:30,"2021-12-02,2021-12-03,2021-12-07,2022-01-03,2022-01-08,2022-01-27,2022-01-31,2022-02-11,2022-02-13,2022-02-20","2022-01-17,2022-01-28,2022-01-30,2022-02-15,2022-02-22",0.535257212,0.441604199,0.488430706,10,5,0.008402999,27205725.61,1.00E-06
EOH0200_merged_30min.parquet,1C1R1P1S,2021-2022,09/12/2021 00:00,04/02/2022 23:30,11/12/2021 00:00,23/02/2022 23:30,"2021-12-09,2021-12-18,2021-12-28,2021-12-31,2022-01-02,2022-01-04,2022-01-10,2022-01-18,2022-01-19,2022-02-04","2021-12-11,2022-01-07,2022-02-05,2022-02-13,2022-02-23",0.341759544,0.411159431,0.376459488,10,5,0.007243208,39407554.3,3.255967467
EOH0201_merged_30min.parquet,1C1R1P1S,2021-2022,18/12/2021 00:00,27/02/2022 23:30,02/12/2021 00:00,26/02/2022 23:30,"2021-12-18,2021-12-19,2022-01-08,2022-01-13,2022-01-23,2022-01-26,2022-01-30,2022-02-09,2022-02-10,2022-02-27","2021-12-02,2021-12-10,2021-12-17,2022-01-17,2022-02-26",0.947088749,0.743261532,0.84517514,10,5,0.007404831,17798594.14,3.542686698
EOH0204_merged_30min.parquet,1C1R1P1S,2021-2022,23/12/2021 00:00,24/02/2022 23:30,12/01/2022 00:00,26/01/2022 23:30,"2021-12-23,2021-12-25,2021-12-26,2022-01-01,2022-01-11,2022-01-13,2022-01-17,2022-01-31,2022-02-17,2022-02-24","2022-01-12,2022-01-15,2022-01-16,2022-01-20,2022-01-26",0.540624794,0.844845253,0.692735023,10,5,0.004912303,46237590.11,11.65249024
EOH0218_merged_30min.parquet,1C1R1P1S,2021-2022,01/12/2021 00:00,20/02/2022 23:30,03/12/2021 00:00,07/02/2022 23:30,"2021-12-01,2021-12-05,2021-12-08,2022-01-06,2022-01-13,2022-01-21,2022-01-24,2022-01-30,2022-02-10,2022-02-20","2021-12-03,2021-12-15,2021-12-26,2022-02-02,2022-02-07",0.471435291,0.372796099,0.422115695,10,5,0.005698034,55416863.05,1.01E-06
EOH0222_merged_30min.parquet,1C1R1P1S,2021-2022,11/12/2021 00:00,25/02/2022 23:30,16/12/2021 00:00,25/01/2022 23:30,"2021-12-11,2021-12-26,2022-01-08,2022-01-19,2022-01-22,2022-01-23,2022-02-05,2022-02-18,2022-02-19,2022-02-25","2021-12-16,2021-12-18,2022-01-09,2022-01-14,2022-01-25",0.659107423,0.544809168,0.601958296,10,5,0.007215735,15174554.53,3.016396618
EOH0226_merged_30min.parquet,1C1R1P1S,2021-2022,09/12/2021 00:00,26/02/2022 23:30,06/12/2021 00:00,12/02/2022 23:30,"2021-12-09,2021-12-15,2021-12-27,2022-01-28,2022-01-29,2022-02-04,2022-02-14,2022-02-15,2022-02-21,2022-02-26","2021-12-06,2022-01-13,2022-01-19,2022-02-11,2022-02-12",0.912373042,0.655963512,0.784168277,10,5,0.006788365,35985950.76,3.41527953
EOH0227_merged_30min.parquet,1C1R1P1S,2021-2022,07/12/2021 00:00,18/02/2022 23:30,09/12/2021 00:00,16/02/2022 23:30,"2021-12-07,2021-12-27,2022-01-14,2022-01-25,2022-01-26,2022-01-29,2022-02-06,2022-02-13,2022-02-17,2022-02-18","2021-12-09,2021-12-31,2022-01-18,2022-02-07,2022-02-16",0.773045072,0.929658466,0.851351769,10,5,0.004312283,25981134.67,2.541394984
EOH0231_merged_30min.parquet,1C1R1P1S,2021-2022,02/12/2021 00:00,28/02/2022 23:30,07/12/2021 00:00,23/01/2022 23:30,"2021-12-02,2021-12-12,2021-12-15,2021-12-31,2022-01-02,2022-01-08,2022-01-15,2022-01-25,2022-01-26,2022-02-28","2021-12-07,2021-12-30,2022-01-19,2022-01-22,2022-01-23",0.181707939,0.154803744,0.168255842,10,5,0.005865075,163921009.8,6.192789359
EOH0233_merged_30min.parquet,1C1R1P1S,2021-2022,02/12/2021 00:00,09/02/2022 23:30,08/12/2021 00:00,13/02/2022 23:30,"2021-12-02,2021-12-06,2021-12-09,2021-12-20,2022-01-03,2022-01-10,2022-01-19,2022-01-27,2022-02-04,2022-02-09","2021-12-08,2021-12-11,2021-12-21,2022-01-23,2022-02-13",0.612675367,0.709881673,0.66127852,10,5,0.004700065,28143780.87,1.00E-06
EOH0238_merged_30min.parquet,1C1R1P1S,2021-2022,01/12/2021 00:00,17/02/2022 23:30,07/01/2022 00:00,16/02/2022 23:30,"2021-12-01,2021-12-05,2021-12-06,2021-12-15,2022-01-11,2022-01-25,2022-01-26,2022-02-03,2022-02-06,2022-02-17","2022-01-07,2022-01-27,2022-01-31,2022-02-15,2022-02-16",0.618761457,0.58427541,0.601518433,10,5,0.005051446,122949765.7,29.99999999
EOH0240_merged_30min.parquet,1C1R1P1S,2021-2022,01/12/2021 00:00,17/02/2022 23:30,15/12/2021 00:00,28/01/2022 23:30,"2021-12-01,2021-12-18,2021-12-29,2022-01-01,2022-01-02,2022-01-11,2022-01-21,2022-01-23,2022-02-06,2022-02-17","2021-12-15,2022-01-07,2022-01-14,2022-01-24,2022-01-28",0.743054945,0.64967738,0.696366162,10,5,0.004556724,61829606.68,1.01E-06
EOH0244_merged_30min.parquet,1C1R1P1S,2021-2022,02/12/2021 00:00,26/02/2022 23:30,24/12/2021 00:00,19/02/2022 23:30,"2021-12-02,2021-12-10,2021-12-12,2021-12-22,2021-12-28,2022-01-10,2022-01-19,2022-01-26,2022-02-14,2022-02-26","2021-12-24,2021-12-30,2022-01-16,2022-01-17,2022-02-19",0.439852036,0.660974085,0.55041306,10,5,0.004970394,46212493.25,1.049106612
EOH0245_merged_30min.parquet,1C1R1P1S,2021-2022,19/12/2021 00:00,17/02/2022 23:30,01/01/2022 00:00,28/02/2022 23:30,"2021-12-19,2021-12-24,2021-12-28,2021-12-31,2022-01-07,2022-01-21,2022-01-27,2022-02-11,2022-02-14,2022-02-17","2022-01-01,2022-01-25,2022-02-05,2022-02-16,2022-02-28",0.417243714,0.567826021,0.492534868,10,5,0.007385775,21826327.2,5.227947736
EOH0248_merged_30min.parquet,1C1R1P1S,2021-2022,04/12/2021 00:00,27/02/2022 23:30,25/12/2021 00:00,08/02/2022 23:30,"2021-12-04,2021-12-06,2021-12-09,2021-12-18,2021-12-24,2021-12-27,2022-01-01,2022-01-12,2022-02-09,2022-02-27","2021-12-25,2022-01-06,2022-01-13,2022-01-18,2022-02-08",0.432589663,0.428687262,0.430638462,10,5,0.005949276,56037794.3,1.376343437
EOH0254_merged_30min.parquet,1C1R1P1S,2021-2022,08/12/2021 00:00,27/02/2022 23:30,22/12/2021 00:00,28/02/2022 23:30,"2021-12-08,2021-12-09,2021-12-14,2022-01-16,2022-01-20,2022-01-30,2022-02-11,2022-02-13,2022-02-15,2022-02-27","2021-12-22,2021-12-23,2021-12-29,2022-02-08,2022-02-28",0.633965046,0.730638297,0.682301672,10,5,0.010778866,23944697.87,2.946203485
EOH0256_merged_30min.parquet,1C1R1P1S,2021-2022,01/12/2021 00:00,17/02/2022 23:30,22/01/2022 00:00,24/02/2022 23:30,"2021-12-01,2021-12-02,2021-12-07,2021-12-17,2021-12-20,2022-01-20,2022-02-03,2022-02-05,2022-02-16,2022-02-17","2022-01-22,2022-01-29,2022-02-04,2022-02-23,2022-02-24",0.313781642,0.366812554,0.340297098,10,5,0.010124349,100278546.3,5.154624778
EOH0258_merged_30min.parquet,1C1R1P1S,2021-2022,01/12/2021 00:00,14/02/2022 23:30,17/12/2021 00:00,28/02/2022 23:30,"2021-12-01,2021-12-09,2021-12-26,2022-01-01,2022-01-04,2022-01-23,2022-01-27,2022-02-09,2022-02-11,2022-02-14","2021-12-17,2021-12-19,2022-01-25,2022-02-18,2022-02-28",0.948758673,0.74264576,0.845702217,10,5,0.006516654,20784709.68,5.576051229
EOH0276_merged_30min.parquet,1C1R1P1S,2021-2022,14/12/2021 00:00,27/02/2022 23:30,01/12/2021 00:00,20/02/2022 23:30,"2021-12-14,2021-12-30,2022-01-01,2022-01-10,2022-01-13,2022-01-17,2022-01-25,2022-02-05,2022-02-16,2022-02-27","2021-12-01,2021-12-18,2022-01-03,2022-02-19,2022-02-20",0.525356637,0.844647804,0.685002221,10,5,0.00703339,39443740.2,3.141362381
EOH0277_merged_30min.parquet,1C1R1P1S,2021-2022,20/12/2021 00:00,22/02/2022 23:30,01/12/2021 00:00,11/02/2022 23:30,"2021-12-20,2022-01-01,2022-01-08,2022-01-13,2022-01-16,2022-01-29,2022-02-03,2022-02-04,2022-02-20,2022-02-22","2021-12-01,2021-12-11,2022-01-04,2022-01-30,2022-02-11",0.50720427,0.557970324,0.532587297,10,5,0.002255029,176450895.7,16.25501119
EOH0279_merged_30min.parquet,1C1R1P1S,2021-2022,01/12/2021 00:00,11/02/2022 23:30,01/01/2022 00:00,22/02/2022 23:30,"2021-12-01,2021-12-05,2022-01-08,2022-01-12,2022-01-20,2022-01-23,2022-01-24,2022-01-30,2022-02-01,2022-02-11","2022-01-01,2022-01-06,2022-01-11,2022-01-16,2022-02-22",0.459496015,0.464116623,0.461806319,10,5,0.004658671,46364824.66,6.066492898
EOH0283_merged_30min.parquet,1C1R1P1S,2021-2022,03/12/2021 00:00,24/02/2022 23:30,13/12/2021 00:00,30/01/2022 23:30,"2021-12-03,2021-12-11,2021-12-18,2022-01-08,2022-02-01,2022-02-02,2022-02-03,2022-02-12,2022-02-20,2022-02-24","2021-12-13,2021-12-20,2022-01-18,2022-01-20,2022-01-30",0.304004472,0.191737249,0.247870861,10,5,0.004105557,171917743.7,1.00E-06
EOH0286_merged_30min.parquet,1C1R1P1S,2021-2022,09/12/2021 00:00,24/02/2022 23:30,04/12/2021 00:00,03/02/2022 23:30,"2021-12-09,2021-12-11,2021-12-24,2021-12-29,2022-01-16,2022-01-23,2022-01-25,2022-02-06,2022-02-14,2022-02-24","2021-12-04,2021-12-08,2021-12-12,2021-12-30,2022-02-03",0.53288547,0.587802451,0.560343961,10,5,0.004840557,26881694.5,1.00E-06
EOH0290_merged_30min.parquet,1C1R1P1S,2021-2022,16/12/2021 00:00,23/02/2022 23:30,09/01/2022 00:00,15/02/2022 23:30,"2021-12-16,2021-12-17,2021-12-18,2022-01-05,2022-01-06,2022-01-20,2022-01-29,2022-02-13,2022-02-18,2022-02-23","2022-01-09,2022-01-13,2022-01-26,2022-02-14,2022-02-15",0.34108483,0.350130489,0.345607659,10,5,0.005040419,26932753.94,7.214508544
EOH0295_merged_30min.parquet,1C1R1P1S,2021-2022,05/12/2021 00:00,27/02/2022 23:30,27/12/2021 00:00,10/02/2022 23:30,"2021-12-05,2021-12-09,2021-12-10,2021-12-12,2021-12-18,2022-01-19,2022-02-06,2022-02-09,2022-02-16,2022-02-27","2021-12-27,2022-01-15,2022-02-04,2022-02-07,2022-02-10",0.870513539,0.767142345,0.818827942,10,5,0.010156682,13039035.06,4.961109817
EOH0310_merged_30min.parquet,1C1R1P1S,2021-2022,01/12/2021 00:00,22/02/2022 23:30,23/02/2022 00:00,23/02/2022 23:30,"2021-12-01,2022-02-16,2022-02-17,2022-02-18,2022-02-19,2022-02-20,2022-02-21,2022-02-22",23/02/2022,0.341557879,0.316836565,0.329197222,8,1,0.007592206,67961458.41,1.00E-06
EOH0311_merged_30min.parquet,1C1R1P1S,2021-2022,04/12/2021 00:00,17/02/2022 23:30,03/12/2021 00:00,23/02/2022 23:30,"2021-12-04,2021-12-08,2021-12-09,2021-12-13,2021-12-23,2021-12-30,2022-01-09,2022-01-16,2022-02-14,2022-02-17","2021-12-03,2022-01-19,2022-02-05,2022-02-12,2022-02-23",0.464745806,0.804024178,0.634384992,10,5,0.004907054,24218450.46,1.00E-06
EOH0315_merged_30min.parquet,1C1R1P1S,2021-2022,10/12/2021 00:00,16/02/2022 23:30,17/12/2021 00:00,06/02/2022 23:30,"2021-12-10,2021-12-20,2021-12-25,2021-12-26,2022-01-09,2022-01-16,2022-01-29,2022-01-30,2022-02-09,2022-02-16","2021-12-17,2021-12-21,2022-01-03,2022-01-23,2022-02-06",0.600512888,0.591769706,0.596141297,10,5,0.010707888,17917374.47,1.060906379
EOH0322_merged_30min.parquet,1C1R1P1S,2021-2022,09/12/2021 00:00,14/02/2022 23:30,04/12/2021 00:00,03/01/2022 23:30,"2021-12-09,2021-12-21,2022-01-01,2022-01-02,2022-01-08,2022-01-13,2022-01-23,2022-01-24,2022-02-11,2022-02-14","2021-12-04,2021-12-05,2021-12-18,2021-12-19,2022-01-03",0.218604717,0.711034384,0.464819551,10,5,0.006561839,28775548.4,2.760031507
EOH0324_merged_30min.parquet,1C1R1P1S,2021-2022,05/12/2021 00:00,24/02/2022 23:30,02/01/2022 00:00,20/02/2022 23:30,"2021-12-05,2021-12-10,2021-12-12,2021-12-16,2021-12-26,2022-01-07,2022-01-10,2022-01-22,2022-01-29,2022-02-24","2022-01-02,2022-01-13,2022-02-13,2022-02-18,2022-02-20",0.275073236,0.427281427,0.351177331,10,5,0.008251624,69132089.04,1.00E-06
EOH0332_merged_30min.parquet,1C1R1P1S,2021-2022,16/12/2021 00:00,25/02/2022 23:30,09/12/2021 00:00,25/01/2022 23:30,"2021-12-16,2022-01-03,2022-01-09,2022-01-17,2022-02-11,2022-02-12,2022-02-14,2022-02-15,2022-02-22,2022-02-25","2021-12-09,2021-12-23,2021-12-25,2022-01-06,2022-01-25",0.796081128,0.612324937,0.704203032,10,5,0.013983147,9812892.272,2.112624956
EOH0335_merged_30min.parquet,1C1R1P1S,2021-2022,07/12/2021 00:00,25/02/2022 23:30,05/12/2021 00:00,24/02/2022 23:30,"2021-12-07,2021-12-14,2021-12-30,2022-01-05,2022-01-06,2022-01-19,2022-01-27,2022-02-18,2022-02-21,2022-02-25","2021-12-05,2021-12-16,2021-12-26,2022-02-09,2022-02-24",0.593863664,0.887986312,0.740924988,10,5,0.005257232,79664541.8,10.51902267
EOH0351_merged_30min.parquet,1C1R1P1S,2021-2022,05/12/2021 00:00,25/02/2022 23:30,06/12/2021 00:00,14/02/2022 23:30,"2021-12-05,2021-12-10,2021-12-16,2021-12-17,2022-01-10,2022-01-18,2022-01-31,2022-02-10,2022-02-13,2022-02-25","2021-12-06,2022-01-13,2022-01-21,2022-02-08,2022-02-14",0.164414929,0.16391681,0.164165869,10,5,0.003109057,117127576.5,6.339490538
EOH0354_merged_30min.parquet,1C1R1P1S,2021-2022,17/12/2021 00:00,23/02/2022 23:30,03/12/2021 00:00,21/02/2022 23:30,"2021-12-17,2021-12-24,2021-12-26,2021-12-28,2022-01-03,2022-01-08,2022-01-13,2022-01-16,2022-02-08,2022-02-23","2021-12-03,2021-12-04,2021-12-25,2022-01-26,2022-02-21",0.475173049,0.777061997,0.626117523,10,5,0.007640619,38587258.81,6.596331681
EOH0355_merged_30min.parquet,1C1R1P1S,2021-2022,29/12/2021 00:00,28/02/2022 23:30,07/02/2022 00:00,27/02/2022 23:30,"2021-12-29,2021-12-30,2021-12-31,2022-01-02,2022-02-01,2022-02-05,2022-02-06,2022-02-11,2022-02-26,2022-02-28","2022-02-07,2022-02-16,2022-02-21,2022-02-24,2022-02-27",0.863220065,0.688718223,0.775969144,10,5,0.00490252,21679451.73,1.00E-06
EOH0358_merged_30min.parquet,1C1R1P1S,2021-2022,01/12/2021 00:00,27/02/2022 23:30,02/01/2022 00:00,26/02/2022 23:30,"2021-12-01,2021-12-03,2021-12-05,2022-01-01,2022-01-07,2022-01-08,2022-01-24,2022-02-13,2022-02-22,2022-02-27","2022-01-02,2022-02-04,2022-02-14,2022-02-20,2022-02-26",0.503554279,0.35677915,0.430166715,10,5,0.008349304,101579891.2,1.00E-06
EOH0368_merged_30min.parquet,1C1R1P1S,2020-2021,16/12/2020 00:00,11/02/2021 23:30,27/12/2020 00:00,04/02/2021 23:30,"2020-12-16,2020-12-17,2020-12-21,2020-12-24,2021-01-04,2021-01-13,2021-01-31,2021-02-07,2021-02-08,2021-02-11","2020-12-27,2021-01-14,2021-01-24,2021-01-28,2021-02-04",0.408710391,0.334471665,0.371591028,10,5,0.009142325,87885347.7,1.00E-06
EOH0379_merged_30min.parquet,1C1R1P1S,2021-2022,03/12/2021 00:00,22/02/2022 23:30,11/12/2021 00:00,23/01/2022 23:30,"2021-12-03,2021-12-10,2021-12-19,2021-12-30,2022-01-15,2022-01-17,2022-01-22,2022-01-27,2022-02-16,2022-02-22","2021-12-11,2022-01-05,2022-01-19,2022-01-20,2022-01-23",0.408734762,0.701023948,0.554879355,10,5,0.004897682,31467155.48,3.285782679
EOH0380_merged_30min.parquet,1C1R1P1S,2021-2022,01/12/2021 00:00,28/02/2022 23:30,29/12/2021 00:00,21/02/2022 23:30,"2021-12-01,2021-12-19,2022-01-08,2022-01-10,2022-01-15,2022-01-24,2022-01-27,2022-02-09,2022-02-25,2022-02-28","2021-12-29,2022-01-20,2022-01-23,2022-02-11,2022-02-21",0.689182404,0.689688818,0.689435611,10,5,0.00402461,26762095.64,8.346272967
EOH0388_merged_30min.parquet,1C1R1P1S,2021-2022,01/12/2021 00:00,16/02/2022 23:30,02/01/2022 00:00,25/02/2022 23:30,"2021-12-01,2022-01-11,2022-01-13,2022-01-14,2022-01-25,2022-01-31,2022-02-04,2022-02-08,2022-02-12,2022-02-16","2022-01-02,2022-01-22,2022-01-24,2022-02-15,2022-02-25",0.659643435,0.986958586,0.82330101,10,5,0.007800751,89090725.47,1.00E-06
EOH0391_merged_30min.parquet,1C1R1P1S,2021-2022,02/12/2021 00:00,22/02/2022 23:30,30/12/2021 00:00,28/02/2022 23:30,"2021-12-02,2021-12-03,2021-12-04,2021-12-06,2021-12-14,2021-12-18,2022-01-14,2022-02-19,2022-02-20,2022-02-22","2021-12-30,2022-01-18,2022-02-04,2022-02-25,2022-02-28",0.446536384,0.444420256,0.44547832,10,5,0.008094168,12627092.33,0.848268932
EOH0443_merged_30min.parquet,1C1R1P1S,2021-2022,10/02/2022 00:00,27/02/2022 23:30,09/02/2022 00:00,25/02/2022 23:30,"2022-02-10,2022-02-13,2022-02-15,2022-02-16,2022-02-20,2022-02-21,2022-02-22,2022-02-24,2022-02-26,2022-02-27","2022-02-09,2022-02-12,2022-02-17,2022-02-19,2022-02-25",0.962605261,0.877393763,0.919999512,10,5,0.015246878,16473912.11,2.802954277
EOH0447_merged_30min.parquet,1C1R1P1S,2021-2022,04/12/2021 00:00,23/02/2022 23:30,12/12/2021 00:00,19/01/2022 23:30,"2021-12-04,2021-12-16,2021-12-27,2021-12-30,2022-01-09,2022-01-13,2022-01-31,2022-02-11,2022-02-21,2022-02-23","2021-12-12,2021-12-25,2022-01-16,2022-01-18,2022-01-19",0.400240738,0.349432631,0.374836685,10,5,0.054272954,19669773.59,1.915350364
EOH0450_merged_30min.parquet,1C1R1P1S,2020-2021,06/02/2021 00:00,25/02/2021 23:30,07/02/2021 00:00,28/02/2021 23:30,"2021-02-06,2021-02-08,2021-02-09,2021-02-10,2021-02-11,2021-02-16,2021-02-18,2021-02-20,2021-02-21,2021-02-25","2021-02-07,2021-02-13,2021-02-23,2021-02-27,2021-02-28",0.820133393,0.904150651,0.862142022,10,5,0.006479572,38316895.88,1.00E-06
EOH0464_merged_30min.parquet,1C1R1P1S,2021-2022,18/12/2021 00:00,23/02/2022 23:30,20/12/2021 00:00,09/02/2022 23:30,"2021-12-18,2021-12-24,2022-01-03,2022-01-09,2022-01-10,2022-01-19,2022-01-20,2022-01-21,2022-02-16,2022-02-23","2021-12-20,2022-01-02,2022-01-12,2022-02-01,2022-02-09",0.425455496,0.503290565,0.46437303,10,5,0.005476729,69225133.78,5.676991606
EOH0465_merged_30min.parquet,1C1R1P1S,2021-2022,01/12/2021 00:00,01/02/2022 23:30,21/12/2021 00:00,17/01/2022 23:30,"2021-12-01,2021-12-07,2021-12-26,2022-01-03,2022-01-04,2022-01-05,2022-01-20,2022-01-21,2022-01-25,2022-02-01","2021-12-21,2021-12-22,2021-12-27,2021-12-28,2022-01-17",0.523024393,0.429967115,0.476495754,10,5,0.004484322,31124117.03,1.00E-06
EOH0467_merged_30min.parquet,1C1R1P1S,2021-2022,03/12/2021 00:00,28/02/2022 23:30,04/12/2021 00:00,14/01/2022 23:30,"2021-12-03,2021-12-13,2021-12-27,2021-12-31,2022-01-13,2022-01-29,2022-02-11,2022-02-13,2022-02-20,2022-02-28","2021-12-04,2021-12-30,2022-01-09,2022-01-11,2022-01-14",0.730481329,0.735468795,0.732975062,10,5,0.016047824,9229476.352,1.00E-06
EOH0470_merged_30min.parquet,1C1R1P1S,2021-2022,10/12/2021 00:00,25/02/2022 23:30,01/12/2021 00:00,17/02/2022 23:30,"2021-12-10,2021-12-15,2021-12-17,2021-12-22,2021-12-25,2022-01-04,2022-01-25,2022-02-03,2022-02-08,2022-02-25","2021-12-01,2021-12-16,2022-01-17,2022-02-07,2022-02-17",0.674692489,0.886794251,0.78074337,10,5,0.004376109,207138033.4,22.1501047
EOH0471_merged_30min.parquet,1C1R1P1S,2021-2022,27/12/2021 00:00,27/02/2022 23:30,01/12/2021 00:00,24/02/2022 23:30,"2021-12-27,2021-12-30,2022-01-02,2022-01-15,2022-01-24,2022-01-31,2022-02-03,2022-02-17,2022-02-26,2022-02-27","2021-12-01,2022-01-30,2022-02-06,2022-02-18,2022-02-24",0.472509423,0.574509526,0.523509474,10,5,0.08959308,10606520.82,0.921544261
EOH0487_merged_30min.parquet,1C1R1P1S,2021-2022,02/12/2021 00:00,22/02/2022 23:30,05/12/2021 00:00,26/02/2022 23:30,"2021-12-02,2021-12-04,2021-12-08,2022-01-23,2022-01-25,2022-01-26,2022-01-31,2022-02-04,2022-02-11,2022-02-22","2021-12-05,2021-12-06,2022-02-06,2022-02-18,2022-02-26",0.604270452,0.54501711,0.574643781,10,5,0.005000522,117180363.8,30
EOH0490_merged_30min.parquet,1C1R1P1S,2021-2022,02/12/2021 00:00,04/01/2022 23:30,05/12/2021 00:00,01/01/2022 23:30,"2021-12-02,2021-12-06,2021-12-09,2021-12-10,2021-12-14,2021-12-21,2021-12-25,2021-12-26,2022-01-02,2022-01-04","2021-12-05,2021-12-13,2021-12-17,2021-12-20,2022-01-01",0.401700624,0.569681606,0.485691115,10,5,0.002529429,62505143.39,27.45369159
EOH0494_merged_30min.parquet,1C1R1P1S,2021-2022,03/12/2021 00:00,28/02/2022 23:30,25/12/2021 00:00,25/02/2022 23:30,"2021-12-03,2021-12-20,2022-01-10,2022-01-15,2022-01-28,2022-01-30,2022-02-10,2022-02-11,2022-02-23,2022-02-28","2021-12-25,2022-01-21,2022-02-17,2022-02-19,2022-02-25",0.659601326,0.681061104,0.670331215,10,5,0.016267506,62675028.93,4.607384164
EOH0495_merged_30min.parquet,1C1R1P1S,2021-2022,12/12/2021 00:00,26/02/2022 23:30,07/12/2021 00:00,28/02/2022 23:30,"2021-12-12,2021-12-15,2021-12-21,2022-01-19,2022-01-21,2022-02-01,2022-02-13,2022-02-15,2022-02-17,2022-02-26","2021-12-07,2021-12-13,2021-12-28,2022-02-05,2022-02-28",0.407611323,0.424057463,0.415834393,10,5,0.003059806,104601840,9.099062414
EOH0505_merged_30min.parquet,1C1R1P1S,2021-2022,13/12/2021 00:00,07/02/2022 23:30,17/12/2021 00:00,06/02/2022 23:30,"2021-12-13,2022-01-07,2022-01-08,2022-01-14,2022-01-16,2022-01-21,2022-01-22,2022-01-27,2022-02-04,2022-02-07","2021-12-17,2021-12-20,2022-01-06,2022-02-05,2022-02-06",0.593690692,0.511050015,0.552370354,10,5,0.005355571,42194035.05,11.35142461
EOH0516_merged_30min.parquet,1C1R1P1S,2021-2022,08/12/2021 00:00,02/02/2022 23:30,22/12/2021 00:00,20/02/2022 23:30,"2021-12-08,2021-12-28,2022-01-05,2022-01-06,2022-01-10,2022-01-21,2022-01-28,2022-01-29,2022-02-01,2022-02-02","2021-12-22,2021-12-31,2022-01-11,2022-02-17,2022-02-20",0.530658326,0.605813936,0.568236131,10,5,0.004860931,68312155.27,1.00E-06
EOH0517_merged_30min.parquet,1C1R1P1S,2021-2022,01/12/2021 00:00,27/02/2022 23:30,29/12/2021 00:00,22/01/2022 23:30,"2021-12-01,2021-12-08,2021-12-10,2021-12-19,2022-01-26,2022-02-03,2022-02-07,2022-02-09,2022-02-21,2022-02-27","2021-12-29,2022-01-06,2022-01-08,2022-01-14,2022-01-22",0.332708349,0.291129014,0.311918681,10,5,0.010798581,80888438.53,3.727746865
EOH0524_merged_30min.parquet,1C1R1P1S,2021-2022,05/12/2021 00:00,16/02/2022 23:30,01/12/2021 00:00,28/02/2022 23:30,"2021-12-05,2021-12-12,2021-12-14,2022-01-11,2022-01-18,2022-01-25,2022-01-30,2022-02-09,2022-02-11,2022-02-16","2021-12-01,2022-01-14,2022-02-06,2022-02-07,2022-02-28",0.611162724,0.58155089,0.596356807,10,5,0.009457687,28691497.98,0.781121974
EOH0525_merged_30min.parquet,1C1R1P1S,2021-2022,03/12/2021 00:00,27/02/2022 23:30,02/12/2021 00:00,24/02/2022 23:30,"2021-12-03,2021-12-10,2021-12-26,2022-01-05,2022-01-22,2022-01-29,2022-01-30,2022-02-03,2022-02-07,2022-02-27","2021-12-02,2021-12-12,2021-12-17,2022-02-06,2022-02-24",0.684323757,0.581171379,0.632747568,10,5,0.006104365,24113760.15,1.820890127
EOH0530_merged_30min.parquet,1C1R1P1S,2020-2021,14/12/2020 00:00,19/02/2021 23:30,02/12/2020 00:00,27/01/2021 23:30,"2020-12-14,2020-12-30,2021-01-05,2021-01-07,2021-01-19,2021-01-25,2021-01-31,2021-02-03,2021-02-04,2021-02-19","2020-12-02,2020-12-22,2020-12-28,2021-01-23,2021-01-27",0.422538214,0.551917752,0.487227983,10,5,0.003725877,73375300,14.15574356
EOH0534_merged_30min.parquet,1C1R1P1S,2021-2022,09/12/2021 00:00,19/02/2022 23:30,11/12/2021 00:00,20/01/2022 23:30,"2021-12-09,2021-12-18,2021-12-29,2022-01-08,2022-01-11,2022-01-12,2022-01-18,2022-01-24,2022-02-04,2022-02-19","2021-12-11,2021-12-28,2022-01-04,2022-01-17,2022-01-20",0.322442762,0.329462859,0.32595281,10,5,0.002875946,194929896.6,16.63992079
EOH0539_merged_30min.parquet,1C1R1P1S,2021-2022,03/12/2021 00:00,07/02/2022 23:30,17/12/2021 00:00,18/02/2022 23:30,"2021-12-03,2021-12-09,2021-12-10,2021-12-18,2021-12-20,2021-12-26,2022-01-02,2022-01-05,2022-01-17,2022-02-07","2021-12-17,2021-12-23,2022-02-11,2022-02-12,2022-02-18",0.529581643,0.489683448,0.509632545,10,5,0.00803207,69272814.15,6.989622243
EOH0546_merged_30min.parquet,1C1R1P1S,2020-2021,02/12/2020 00:00,28/02/2021 23:30,07/12/2020 00:00,23/02/2021 23:30,"2020-12-02,2020-12-16,2020-12-20,2021-01-27,2021-02-03,2021-02-08,2021-02-14,2021-02-20,2021-02-26,2021-02-28","2020-12-07,2020-12-29,2021-01-01,2021-01-23,2021-02-23",0.325353616,0.38040251,0.352878063,10,5,0.005196288,122249108.6,12.67843805
EOH0559_merged_30min.parquet,1C1R1P1S,2021-2022,08/12/2021 00:00,24/02/2022 23:30,05/12/2021 00:00,22/02/2022 23:30,"2021-12-08,2021-12-10,2021-12-15,2021-12-20,2021-12-26,2021-12-28,2022-01-12,2022-02-21,2022-02-23,2022-02-24","2021-12-05,2021-12-14,2022-01-09,2022-02-10,2022-02-22",0.944639079,0.713008724,0.828823902,10,5,0.016238561,15682760.46,0.532097673
EOH0562_merged_30min.parquet,1C1R1P1S,2021-2022,07/12/2021 00:00,17/02/2022 23:30,03/12/2021 00:00,23/01/2022 23:30,"2021-12-07,2021-12-29,2022-01-02,2022-01-13,2022-01-14,2022-01-26,2022-01-27,2022-01-31,2022-02-09,2022-02-17","2021-12-03,2022-01-04,2022-01-19,2022-01-21,2022-01-23",0.364273777,0.539887644,0.45208071,10,5,0.002388218,300000000,29.23376387
EOH0565_merged_30min.parquet,1C1R1P1S,2021-2022,20/12/2021 00:00,21/02/2022 23:30,22/12/2021 00:00,10/02/2022 23:30,"2021-12-20,2022-01-01,2022-01-19,2022-01-21,2022-02-01,2022-02-09,2022-02-13,2022-02-14,2022-02-18,2022-02-21","2021-12-22,2022-01-02,2022-01-04,2022-01-12,2022-02-10",0.496166497,0.687946082,0.592056289,10,5,0.003992922,81609442.84,3.045903515
EOH0567_merged_30min.parquet,1C1R1P1S,2021-2022,08/12/2021 00:00,23/02/2022 23:30,03/12/2021 00:00,08/02/2022 23:30,"2021-12-08,2021-12-16,2022-01-03,2022-01-11,2022-01-31,2022-02-03,2022-02-04,2022-02-06,2022-02-19,2022-02-23","2021-12-03,2021-12-05,2021-12-21,2022-01-25,2022-02-08",0.267043537,0.321156913,0.294100225,10,5,0.004946027,94753235.1,2.86622606
EOH0570_merged_30min.parquet,1C1R1P1S,2021-2022,19/12/2021 00:00,17/02/2022 23:30,03/12/2021 00:00,24/02/2022 23:30,"2021-12-19,2021-12-27,2022-01-05,2022-01-15,2022-01-17,2022-02-04,2022-02-08,2022-02-10,2022-02-13,2022-02-17","2021-12-03,2022-02-01,2022-02-12,2022-02-23,2022-02-24",0.686451161,0.754776982,0.720614071,10,5,0.008926667,32169475.68,1.00E-06
EOH0571_merged_30min.parquet,1C1R1P1S,2021-2022,05/12/2021 00:00,24/02/2022 23:30,09/12/2021 00:00,10/02/2022 23:30,"2021-12-05,2021-12-22,2021-12-30,2022-01-01,2022-01-04,2022-01-07,2022-01-21,2022-01-22,2022-02-15,2022-02-24","2021-12-09,2021-12-10,2022-01-20,2022-01-23,2022-02-10",0.278354615,0.217699838,0.248027227,10,5,0.004639732,204031406.4,19.50834559
EOH0574_merged_30min.parquet,1C1R1P1S,2021-2022,05/12/2021 00:00,22/02/2022 23:30,06/12/2021 00:00,13/02/2022 23:30,"2021-12-05,2021-12-08,2021-12-13,2021-12-21,2021-12-28,2021-12-30,2022-01-26,2022-02-11,2022-02-15,2022-02-22","2021-12-06,2022-01-12,2022-01-20,2022-02-09,2022-02-13",0.521617081,0.413563996,0.467590539,10,5,0.003274967,299999999.9,2.930378258
EOH0575_merged_30min.parquet,1C1R1P1S,2021-2022,11/12/2021 00:00,17/02/2022 23:30,12/12/2021 00:00,01/02/2022 23:30,"2021-12-11,2022-01-02,2022-01-20,2022-01-25,2022-01-28,2022-02-02,2022-02-07,2022-02-09,2022-02-10,2022-02-17","2021-12-12,2021-12-15,2021-12-21,2021-12-23,2022-02-01",0.342363861,0.348154035,0.345258948,10,5,0.00570437,52373660.78,3.307103308
EOH0576_merged_30min.parquet,1C1R1P1S,2021-2022,06/12/2021 00:00,28/02/2022 23:30,24/12/2021 00:00,04/02/2022 23:30,"2021-12-06,2021-12-16,2021-12-17,2021-12-19,2021-12-28,2022-01-21,2022-02-03,2022-02-10,2022-02-19,2022-02-28","2021-12-24,2022-01-23,2022-01-25,2022-01-27,2022-02-04",0.709018001,0.527835986,0.618426993,10,5,0.016631085,24166372.09,3.322298965
EOH0577_merged_30min.parquet,1C1R1P1S,2021-2022,02/12/2021 00:00,15/02/2022 23:30,18/12/2021 00:00,23/02/2022 23:30,"2021-12-02,2021-12-10,2021-12-14,2021-12-25,2021-12-27,2022-01-11,2022-01-21,2022-02-09,2022-02-11,2022-02-15","2021-12-18,2022-01-02,2022-02-14,2022-02-17,2022-02-23",0.568811269,0.805258959,0.687035114,10,5,0.005811449,30885297.34,9.635982154
EOH0578_merged_30min.parquet,1C1R1P1S,2021-2022,01/12/2021 00:00,16/02/2022 23:30,03/12/2021 00:00,10/02/2022 23:30,"2021-12-01,2021-12-10,2021-12-15,2021-12-29,2022-01-05,2022-01-06,2022-01-07,2022-01-29,2022-02-08,2022-02-16","2021-12-03,2021-12-21,2021-12-24,2022-02-09,2022-02-10",0.561188158,0.655199904,0.608194031,10,5,0.007743347,38038058.05,1.00E-06
EOH0581_merged_30min.parquet,1C1R1P1S,2021-2022,02/12/2021 00:00,29/01/2022 23:30,27/12/2021 00:00,25/02/2022 23:30,"2021-12-02,2021-12-03,2021-12-07,2021-12-10,2021-12-15,2022-01-04,2022-01-05,2022-01-13,2022-01-16,2022-01-29","2021-12-27,2022-01-01,2022-01-15,2022-01-31,2022-02-25",0.88987459,0.582399464,0.736137027,10,5,0.002177815,300000000,29.99999999
EOH0582_merged_30min.parquet,1C1R1P1S,2021-2022,04/12/2021 00:00,26/02/2022 23:30,07/12/2021 00:00,25/01/2022 23:30,"2021-12-04,2021-12-31,2022-01-06,2022-01-13,2022-01-15,2022-01-17,2022-02-04,2022-02-18,2022-02-25,2022-02-26","2021-12-07,2022-01-02,2022-01-20,2022-01-23,2022-01-25",0.66860457,0.751483203,0.710043886,10,5,0.006830044,24779531.71,3.244564098
EOH0603_merged_30min.parquet,1C1R1P1S,2021-2022,05/12/2021 00:00,27/02/2022 23:30,17/12/2021 00:00,26/02/2022 23:30,"2021-12-05,2021-12-15,2021-12-18,2021-12-29,2022-01-14,2022-01-20,2022-02-01,2022-02-19,2022-02-24,2022-02-27","2021-12-17,2021-12-20,2022-01-23,2022-02-16,2022-02-26",0.592663958,0.732829911,0.662746934,10,5,0.00435359,85407234.76,1.00E-06
EOH0616_merged_30min.parquet,1C1R1P1S,2020-2021,26/12/2020 00:00,20/02/2021 23:30,11/01/2021 00:00,26/02/2021 23:30,"2020-12-26,2020-12-28,2021-01-05,2021-01-09,2021-01-13,2021-01-18,2021-01-27,2021-01-30,2021-02-18,2021-02-20","2021-01-11,2021-01-23,2021-02-05,2021-02-25,2021-02-26",0.269859899,0.295664859,0.282762379,10,5,0.002238261,136395203.8,1.00E-06
EOH0618_merged_30min.parquet,1C1R1P1S,2021-2022,02/12/2021 00:00,21/02/2022 23:30,05/01/2022 00:00,19/02/2022 23:30,"2021-12-02,2021-12-24,2022-01-15,2022-01-16,2022-01-18,2022-01-30,2022-01-31,2022-02-02,2022-02-16,2022-02-21","2022-01-05,2022-01-13,2022-02-08,2022-02-11,2022-02-19",0.891450631,0.747024526,0.819237578,10,5,0.004379636,56963795.63,1.00E-06
EOH0630_merged_30min.parquet,1C1R1P1S,2021-2022,17/12/2021 00:00,19/02/2022 23:30,24/12/2021 00:00,21/02/2022 23:30,"2021-12-17,2021-12-20,2021-12-22,2022-01-04,2022-01-07,2022-01-13,2022-01-25,2022-02-01,2022-02-05,2022-02-19","2021-12-24,2022-01-03,2022-01-11,2022-01-14,2022-02-21",0.546356854,0.669100713,0.607728784,10,5,0.007681695,35994913.08,1.00E-06
EOH0632_merged_30min.parquet,1C1R1P1S,2021-2022,15/12/2021 00:00,08/01/2022 23:30,07/12/2021 00:00,03/01/2022 23:30,"2021-12-15,2021-12-18,2021-12-19,2021-12-23,2021-12-25,2021-12-26,2021-12-28,2021-12-31,2022-01-04,2022-01-08","2021-12-07,2021-12-09,2021-12-21,2021-12-30,2022-01-03",0.718259225,0.947944504,0.833101864,10,5,0.00095746,41900900.96,29.99999999
EOH0643_merged_30min.parquet,1C1R1P1S,2021-2022,10/12/2021 00:00,19/02/2022 23:30,12/12/2021 00:00,22/02/2022 23:30,"2021-12-10,2021-12-19,2021-12-31,2022-01-02,2022-01-03,2022-02-02,2022-02-09,2022-02-12,2022-02-18,2022-02-19","2021-12-12,2022-01-08,2022-01-21,2022-02-11,2022-02-22",0.516506576,0.763679419,0.640092997,10,5,0.006308493,18315061.07,3.180604688
EOH0645_merged_30min.parquet,1C1R1P1S,2021-2022,17/12/2021 00:00,28/02/2022 23:30,08/12/2021 00:00,30/01/2022 23:30,"2021-12-17,2022-01-03,2022-01-05,2022-01-21,2022-01-22,2022-01-26,2022-02-16,2022-02-18,2022-02-27,2022-02-28","2021-12-08,2021-12-11,2021-12-15,2022-01-24,2022-01-30",0.470270801,0.418526906,0.444398853,10,5,0.005992646,68410730.57,9.932297155
EOH0648_merged_30min.parquet,1C1R1P1S,2021-2022,26/01/2022 00:00,23/02/2022 23:30,28/01/2022 00:00,24/02/2022 23:30,"2022-01-26,2022-01-29,2022-01-30,2022-02-07,2022-02-08,2022-02-12,2022-02-17,2022-02-19,2022-02-22,2022-02-23","2022-01-28,2022-01-31,2022-02-04,2022-02-16,2022-02-24",0.455034786,0.578491311,0.516763048,10,5,0.003580442,73943949.34,10.28270669
EOH0651_merged_30min.parquet,1C1R1P1S,2021-2022,07/12/2021 00:00,14/01/2022 23:30,08/12/2021 00:00,17/12/2021 23:30,"2021-12-07,2021-12-12,2021-12-16,2021-12-19,2021-12-20,2022-01-09,2022-01-10,2022-01-12,2022-01-13,2022-01-14","2021-12-08,2021-12-09,2021-12-10,2021-12-11,2021-12-17",0.603157434,0.748407053,0.675782244,10,5,0.003797673,53631532.49,29.9999999
EOH0652_merged_30min.parquet,1C1R1P1S,2021-2022,03/12/2021 00:00,15/02/2022 23:30,01/12/2021 00:00,12/02/2022 23:30,"2021-12-03,2021-12-13,2021-12-14,2021-12-21,2022-01-01,2022-01-11,2022-01-15,2022-01-17,2022-02-02,2022-02-15","2021-12-01,2021-12-08,2022-01-16,2022-01-27,2022-02-12",0.407841884,0.374390189,0.391116036,10,5,0.004565721,112771038.6,3.506045798
EOH0653_merged_30min.parquet,1C1R1P1S,2021-2022,07/01/2022 00:00,18/02/2022 23:30,06/01/2022 00:00,26/02/2022 23:30,"2022-01-07,2022-01-09,2022-01-15,2022-01-25,2022-01-30,2022-02-01,2022-02-08,2022-02-15,2022-02-16,2022-02-18","2022-01-06,2022-01-13,2022-01-24,2022-02-05,2022-02-26",0.867440383,0.764356965,0.815898674,10,5,0.01536069,27228835.03,1.00E-06
EOH0655_merged_30min.parquet,1C1R1P1S,2020-2021,04/12/2020 00:00,27/02/2021 23:30,09/12/2020 00:00,14/01/2021 23:30,"2020-12-04,2020-12-20,2020-12-21,2020-12-24,2020-12-30,2021-01-08,2021-01-10,2021-02-01,2021-02-25,2021-02-27","2020-12-09,2020-12-22,2021-01-05,2021-01-13,2021-01-14",0.329219951,0.277802289,0.30351112,10,5,0.005486044,139945643.5,12.83854205
EOH0663_merged_30min.parquet,1C1R1P1S,2021-2022,09/12/2021 00:00,28/02/2022 23:30,03/12/2021 00:00,03/02/2022 23:30,"2021-12-09,2021-12-10,2022-01-07,2022-01-09,2022-01-11,2022-01-15,2022-01-23,2022-01-29,2022-02-21,2022-02-28","2021-12-03,2021-12-06,2022-01-08,2022-01-21,2022-02-03",0.804934429,0.702260344,0.753597386,10,5,0.007670021,16932493.46,1.00E-06
EOH0667_merged_30min.parquet,1C1R1P1S,2021-2022,02/12/2021 00:00,20/02/2022 23:30,01/12/2021 00:00,25/02/2022 23:30,"2021-12-02,2021-12-03,2021-12-13,2021-12-24,2022-01-08,2022-01-13,2022-01-26,2022-01-27,2022-01-30,2022-02-20","2021-12-01,2021-12-16,2022-01-19,2022-02-09,2022-02-25",0.453328962,0.741058785,0.597193873,10,5,0.001355334,77914590.39,30
EOH0668_merged_30min.parquet,1C1R1P1S,2021-2022,10/12/2021 00:00,26/02/2022 23:30,11/12/2021 00:00,27/02/2022 23:30,"2021-12-10,2021-12-13,2022-01-10,2022-01-14,2022-01-22,2022-01-30,2022-02-02,2022-02-13,2022-02-20,2022-02-26","2021-12-11,2021-12-19,2022-01-07,2022-02-21,2022-02-27",0.3763787,0.466578256,0.421478478,10,5,0.004374349,52931126.21,1.00E-06
EOH0669_merged_30min.parquet,1C1R1P1S,2021-2022,02/12/2021 00:00,15/12/2021 23:30,01/12/2021 00:00,11/12/2021 23:30,"2021-12-02,2021-12-03,2021-12-05,2021-12-07,2021-12-09,2021-12-10,2021-12-12,2021-12-13,2021-12-14,2021-12-15","2021-12-01,2021-12-04,2021-12-06,2021-12-08,2021-12-11",0.813513287,0.847930474,0.83072188,10,5,0.005017169,28192342.59,0.289527634
EOH0683_merged_30min.parquet,1C1R1P1S,2021-2022,24/12/2021 00:00,24/02/2022 23:30,06/12/2021 00:00,27/02/2022 23:30,"2021-12-24,2021-12-31,2022-01-03,2022-01-08,2022-01-18,2022-01-20,2022-02-14,2022-02-17,2022-02-22,2022-02-24","2021-12-06,2022-01-12,2022-01-19,2022-02-19,2022-02-27",0.606671637,0.735901302,0.67128647,10,5,0.002885378,50425877.51,8.895736469
EOH0687_merged_30min.parquet,1C1R1P1S,2021-2022,22/01/2022 00:00,23/02/2022 23:30,23/01/2022 00:00,21/02/2022 23:30,"2022-01-22,2022-01-25,2022-01-26,2022-01-28,2022-02-01,2022-02-06,2022-02-12,2022-02-13,2022-02-14,2022-02-23","2022-01-23,2022-02-15,2022-02-18,2022-02-20,2022-02-21",0.467429799,0.62765492,0.54754236,10,5,0.005956805,27185522.04,1.00E-06
EOH0690_merged_30min.parquet,1C1R1P1S,2021-2022,06/12/2021 00:00,25/02/2022 23:30,02/12/2021 00:00,15/01/2022 23:30,"2021-12-06,2021-12-08,2021-12-22,2022-01-02,2022-01-09,2022-01-12,2022-01-13,2022-02-15,2022-02-22,2022-02-25","2021-12-02,2021-12-13,2021-12-14,2021-12-21,2022-01-15",0.425616983,0.381560096,0.40358854,10,5,0.004156952,70617531.16,15.06229165
EOH0697_merged_30min.parquet,1C1R1P1S,2021-2022,03/12/2021 00:00,20/02/2022 23:30,04/01/2022 00:00,13/02/2022 23:30,"2021-12-03,2021-12-05,2021-12-08,2021-12-14,2021-12-21,2021-12-28,2021-12-29,2021-12-30,2022-02-19,2022-02-20","2022-01-04,2022-01-18,2022-01-21,2022-01-24,2022-02-13",0.447849091,0.525436034,0.486642562,10,5,0.006981554,117559946.7,1.00E-06
EOH0699_merged_30min.parquet,1C1R1P1S,2021-2022,04/12/2021 00:00,24/02/2022 23:30,06/12/2021 00:00,22/02/2022 23:30,"2021-12-04,2021-12-05,2021-12-18,2021-12-21,2021-12-27,2022-01-14,2022-01-15,2022-01-16,2022-01-22,2022-02-24","2021-12-06,2021-12-31,2022-01-13,2022-01-25,2022-02-22",0.665044453,0.859234169,0.762139311,10,5,0.00670118,11627786.19,2.783307333
EOH0702_merged_30min.parquet,1C1R1P1S,2021-2022,05/12/2021 00:00,26/02/2022 23:30,06/12/2021 00:00,18/02/2022 23:30,"2021-12-05,2021-12-16,2021-12-31,2022-01-01,2022-01-15,2022-01-16,2022-01-17,2022-01-25,2022-02-25,2022-02-26","2021-12-06,2021-12-30,2022-01-20,2022-02-10,2022-02-18",0.383605211,0.406590823,0.395098017,10,5,0.007119799,88357225.66,1.632009019
EOH0728_merged_30min.parquet,1C1R1P1S,2021-2022,03/12/2021 00:00,27/02/2022 23:30,05/12/2021 00:00,12/02/2022 23:30,"2021-12-03,2021-12-20,2021-12-29,2022-01-06,2022-01-14,2022-01-29,2022-01-30,2022-02-02,2022-02-14,2022-02-27","2021-12-05,2022-01-07,2022-01-15,2022-01-25,2022-02-12",0.518271562,0.763177804,0.640724683,10,5,0.003403321,101577322.4,30
EOH0732_merged_30min.parquet,1C1R1P1S,2021-2022,01/12/2021 00:00,20/02/2022 23:30,06/12/2021 00:00,22/02/2022 23:30,"2021-12-01,2021-12-03,2021-12-16,2021-12-22,2021-12-26,2022-01-07,2022-01-28,2022-02-11,2022-02-18,2022-02-20","2021-12-06,2022-02-05,2022-02-12,2022-02-17,2022-02-22",0.619979266,0.59905042,0.609514843,10,5,0.004480582,55266732.26,11.54818534
EOH0735_merged_30min.parquet,1C1R1P1S,2021-2022,09/12/2021 00:00,19/02/2022 23:30,01/12/2021 00:00,24/02/2022 23:30,"2021-12-09,2021-12-13,2021-12-29,2022-01-02,2022-01-08,2022-01-10,2022-01-18,2022-01-23,2022-02-02,2022-02-19","2021-12-01,2021-12-02,2021-12-06,2022-01-12,2022-02-24",0.415366139,0.261248589,0.338307364,10,5,0.00396449,299999999.6,1.00E-06
EOH0737_merged_30min.parquet,1C1R1P1S,2021-2022,03/12/2021 00:00,26/02/2022 23:30,06/12/2021 00:00,12/02/2022 23:30,"2021-12-03,2021-12-04,2021-12-11,2021-12-15,2021-12-16,2021-12-26,2022-01-14,2022-01-24,2022-02-16,2022-02-26","2021-12-06,2021-12-13,2022-01-02,2022-02-04,2022-02-12",0.533959016,0.770368266,0.652163641,10,5,0.005174406,39380951.62,4.927220035
EOH0745_merged_30min.parquet,1C1R1P1S,2020-2021,02/12/2020 00:00,13/02/2021 23:30,28/12/2020 00:00,10/02/2021 23:30,"2020-12-02,2020-12-03,2020-12-06,2020-12-07,2020-12-08,2020-12-11,2020-12-21,2020-12-25,2021-02-01,2021-02-13","2020-12-28,2020-12-29,2021-01-29,2021-01-31,2021-02-10",0.736594241,0.935126365,0.835860303,10,5,0.005159197,15165364.7,1.902276857
EOH0746_merged_30min.parquet,1C1R1P1S,2021-2022,02/12/2021 00:00,27/01/2022 23:30,12/12/2021 00:00,14/01/2022 23:30,"2021-12-02,2021-12-14,2021-12-17,2021-12-26,2021-12-28,2022-01-03,2022-01-07,2022-01-10,2022-01-26,2022-01-27","2021-12-12,2021-12-19,2022-01-04,2022-01-09,2022-01-14",0.313149413,0.832892558,0.573020985,10,5,0.01319038,19843600.52,3.542057505
EOH0749_merged_30min.parquet,1C1R1P1S,2021-2022,11/12/2021 00:00,24/02/2022 23:30,09/12/2021 00:00,14/01/2022 23:30,"2021-12-11,2021-12-14,2021-12-20,2021-12-26,2022-01-03,2022-02-02,2022-02-07,2022-02-10,2022-02-16,2022-02-24","2021-12-09,2021-12-10,2021-12-12,2021-12-22,2022-01-14",0.257839716,0.362605717,0.310222716,10,5,0.004432221,203988700.1,1.00E-06
EOH0764_merged_30min.parquet,1C1R1P1S,2021-2022,01/12/2021 00:00,18/02/2022 23:30,05/12/2021 00:00,08/02/2022 23:30,"2021-12-01,2021-12-21,2022-01-05,2022-01-14,2022-01-24,2022-02-01,2022-02-04,2022-02-12,2022-02-17,2022-02-18","2021-12-05,2021-12-10,2021-12-28,2022-01-28,2022-02-08",0.480160627,0.302232228,0.391196427,10,5,0.006528624,88977450.81,0.403384133
EOH0766_merged_30min.parquet,1C1R1P1S,2021-2022,06/12/2021 00:00,21/02/2022 23:30,15/12/2021 00:00,10/02/2022 23:30,"2021-12-06,2021-12-19,2021-12-24,2021-12-28,2021-12-30,2022-02-04,2022-02-11,2022-02-14,2022-02-18,2022-02-21","2021-12-15,2021-12-25,2022-01-19,2022-01-21,2022-02-10",0.612476947,0.564131458,0.588304203,10,5,0.007721072,24730231.83,1.02E-06
EOH0769_merged_30min.parquet,1C1R1P1S,2021-2022,12/12/2021 00:00,06/02/2022 23:30,09/01/2022 00:00,28/02/2022 23:30,"2021-12-12,2021-12-13,2021-12-14,2021-12-18,2021-12-19,2021-12-24,2022-01-18,2022-01-27,2022-02-01,2022-02-06","2022-01-09,2022-01-29,2022-02-02,2022-02-23,2022-02-28",0.553398038,0.498552948,0.525975493,10,5,0.004373038,36794328.02,0.463251101
EOH0788_merged_30min.parquet,1C1R1P1S,2021-2022,07/12/2021 00:00,17/02/2022 23:30,10/01/2022 00:00,26/02/2022 23:30,"2021-12-07,2021-12-11,2021-12-14,2021-12-19,2022-01-14,2022-01-31,2022-02-05,2022-02-12,2022-02-15,2022-02-17","2022-01-10,2022-02-18,2022-02-19,2022-02-24,2022-02-26",0.544120452,0.520961053,0.532540752,10,5,0.006804609,59142876.51,4.647488448
EOH0789_merged_30min.parquet,1C1R1P1S,2021-2022,16/12/2021 00:00,24/02/2022 23:30,04/12/2021 00:00,17/02/2022 23:30,"2021-12-16,2021-12-19,2021-12-23,2022-01-05,2022-01-08,2022-01-21,2022-02-02,2022-02-07,2022-02-13,2022-02-24","2021-12-04,2021-12-08,2022-01-10,2022-01-16,2022-02-17",0.340781808,0.391865323,0.366323565,10,5,0.003020319,123723448.2,1.00E-06
EOH0791_merged_30min.parquet,1C1R1P1S,2021-2022,25/02/2022 00:00,27/02/2022 23:30,28/02/2022 00:00,28/02/2022 23:30,"2022-02-25,2022-02-26,2022-02-27",28/02/2022,0.729903902,0.529490301,0.629697102,3,1,0.005061952,127684049.2,0.107396983
EOH0793_merged_30min.parquet,1C1R1P1S,2021-2022,04/12/2021 00:00,20/02/2022 23:30,08/12/2021 00:00,19/02/2022 23:30,"2021-12-04,2021-12-09,2021-12-14,2021-12-16,2021-12-19,2021-12-26,2022-02-08,2022-02-14,2022-02-16,2022-02-20","2021-12-08,2021-12-25,2021-12-29,2022-02-11,2022-02-19",0.922123137,0.699326097,0.810724617,10,5,0.006690626,43127849.25,0.348779248
EOH0808_merged_30min.parquet,1C1R1P1S,2021-2022,08/12/2021 00:00,30/01/2022 23:30,01/12/2021 00:00,22/02/2022 23:30,"2021-12-08,2021-12-10,2021-12-11,2021-12-17,2021-12-23,2022-01-07,2022-01-22,2022-01-25,2022-01-28,2022-01-30","2021-12-01,2022-01-24,2022-02-04,2022-02-11,2022-02-22",0.614604809,0.667450451,0.64102763,10,5,0.008215189,14959720.31,4.536721996
EOH0810_merged_30min.parquet,1C1R1P1S,2021-2022,08/12/2021 00:00,27/02/2022 23:30,03/12/2021 00:00,19/02/2022 23:30,"2021-12-08,2022-01-09,2022-01-17,2022-01-19,2022-01-22,2022-02-12,2022-02-16,2022-02-18,2022-02-25,2022-02-27","2021-12-03,2021-12-09,2022-01-04,2022-02-01,2022-02-19",0.256923152,0.435520984,0.346222068,10,5,0.003909374,41442735.93,11.38632076
EOH0813_merged_30min.parquet,1C1R1P1S,2021-2022,17/12/2021 00:00,23/02/2022 23:30,03/12/2021 00:00,12/02/2022 23:30,"2021-12-17,2021-12-21,2021-12-22,2022-01-15,2022-01-19,2022-01-21,2022-01-23,2022-01-24,2022-02-16,2022-02-23","2021-12-03,2021-12-29,2022-01-11,2022-02-05,2022-02-12",0.401161689,0.850319654,0.625740671,10,5,0.004677078,174757328.6,25.5738624
EOH0818_merged_30min.parquet,1C1R1P1S,2021-2022,15/12/2021 00:00,15/02/2022 23:30,04/12/2021 00:00,26/02/2022 23:30,"2021-12-15,2021-12-23,2021-12-29,2022-01-02,2022-01-13,2022-01-25,2022-01-26,2022-02-02,2022-02-09,2022-02-15","2021-12-04,2021-12-12,2022-02-05,2022-02-12,2022-02-26",0.297781716,0.580566937,0.439174326,10,5,0.009635879,18847554.03,2.770916914
EOH0822_merged_30min.parquet,1C1R1P1S,2021-2022,13/12/2021 00:00,28/02/2022 23:30,09/12/2021 00:00,24/02/2022 23:30,"2021-12-13,2021-12-23,2022-01-04,2022-01-06,2022-02-11,2022-02-12,2022-02-21,2022-02-22,2022-02-25,2022-02-28","2021-12-09,2021-12-19,2021-12-26,2022-02-08,2022-02-24",0.488557746,0.721455713,0.60500673,10,5,0.006750474,42776656.73,3.392596212
EOH0830_merged_30min.parquet,1C1R1P1S,2021-2022,12/12/2021 00:00,27/02/2022 23:30,01/12/2021 00:00,04/02/2022 23:30,"2021-12-12,2021-12-18,2022-01-09,2022-01-10,2022-01-15,2022-01-24,2022-02-11,2022-02-14,2022-02-24,2022-02-27","2021-12-01,2022-01-05,2022-01-13,2022-02-02,2022-02-04",0.776416276,0.72282955,0.749622913,10,5,0.004884508,35056034.46,1.00E-06
EOH0836_merged_30min.parquet,1C1R1P1S,2021-2022,01/12/2021 00:00,24/02/2022 23:30,13/12/2021 00:00,27/02/2022 23:30,"2021-12-01,2021-12-10,2021-12-18,2021-12-21,2021-12-31,2022-01-04,2022-01-29,2022-02-05,2022-02-15,2022-02-24","2021-12-13,2021-12-28,2022-01-30,2022-02-25,2022-02-27",0.707401913,0.734741614,0.721071764,10,5,0.008162903,41801310.46,4.389984845
EOH0837_merged_30min.parquet,1C1R1P1S,2021-2022,02/12/2021 00:00,24/02/2022 23:30,07/01/2022 00:00,27/02/2022 23:30,"2021-12-02,2021-12-13,2021-12-19,2022-01-17,2022-01-25,2022-01-26,2022-01-29,2022-02-16,2022-02-21,2022-02-24","2022-01-07,2022-02-01,2022-02-13,2022-02-25,2022-02-27",0.338189249,0.348510195,0.343349722,10,5,0.00501444,66290287.52,5.302315853
EOH0851_merged_30min.parquet,1C1R1P1S,2021-2022,01/12/2021 00:00,28/02/2022 23:30,21/12/2021 00:00,14/02/2022 23:30,"2021-12-01,2021-12-11,2021-12-16,2021-12-30,2022-01-22,2022-01-31,2022-02-03,2022-02-17,2022-02-18,2022-02-28","2021-12-21,2021-12-24,2022-01-16,2022-01-25,2022-02-14",0.432496754,0.569896036,0.501196395,10,5,0.008754296,23689828.02,0.381336517
EOH0857_merged_30min.parquet,1C1R1P1S,2021-2022,10/12/2021 00:00,14/02/2022 23:30,12/12/2021 00:00,26/01/2022 23:30,"2021-12-10,2021-12-15,2021-12-17,2021-12-21,2021-12-24,2022-01-14,2022-01-29,2022-02-03,2022-02-07,2022-02-14","2021-12-12,2021-12-13,2021-12-29,2022-01-10,2022-01-26",0.733546741,0.707592614,0.720569678,10,5,0.006635659,41163843.53,1.01E-06
EOH0876_merged_30min.parquet,1C1R1P1S,2021-2022,04/12/2021 00:00,21/02/2022 23:30,01/12/2021 00:00,25/02/2022 23:30,"2021-12-04,2021-12-16,2021-12-31,2022-01-04,2022-01-13,2022-01-18,2022-01-27,2022-02-01,2022-02-05,2022-02-21","2021-12-01,2021-12-02,2021-12-27,2022-01-03,2022-02-25",0.200664051,0.229859196,0.215261623,10,5,0.006532553,106434294.5,6.209419328
EOH0889_merged_30min.parquet,1C1R1P1S,2021-2022,10/12/2021 00:00,16/02/2022 23:30,23/12/2021 00:00,23/02/2022 23:30,"2021-12-10,2021-12-25,2021-12-28,2022-01-02,2022-01-03,2022-01-29,2022-02-02,2022-02-04,2022-02-11,2022-02-16","2021-12-23,2022-01-04,2022-01-16,2022-02-14,2022-02-23",0.438069856,0.539187992,0.488628924,10,5,0.012116097,21703171.19,1.406135046
EOH0894_merged_30min.parquet,1C1R1P1S,2021-2022,26/12/2021 00:00,25/02/2022 23:30,15/01/2022 00:00,23/02/2022 23:30,"2021-12-26,2021-12-31,2022-01-02,2022-01-05,2022-01-17,2022-01-20,2022-01-21,2022-01-31,2022-02-03,2022-02-25","2022-01-15,2022-01-24,2022-02-01,2022-02-05,2022-02-23",0.579261635,0.749271376,0.664266506,10,5,0.004723714,43034539.07,8.46535533
EOH0896_merged_30min.parquet,1C1R1P1S,2021-2022,06/12/2021 00:00,16/02/2022 23:30,03/01/2022 00:00,25/02/2022 23:30,"2021-12-06,2021-12-15,2021-12-17,2021-12-26,2022-01-20,2022-01-24,2022-01-31,2022-02-04,2022-02-09,2022-02-16","2022-01-03,2022-01-04,2022-02-03,2022-02-21,2022-02-25",0.220963659,0.320170393,0.270567026,10,5,0.004829605,83843993.56,2.019244334
EOH0901_merged_30min.parquet,1C1R1P1S,2021-2022,15/12/2021 00:00,24/02/2022 23:30,26/12/2021 00:00,08/02/2022 23:30,"2021-12-15,2021-12-23,2021-12-27,2022-01-04,2022-01-05,2022-01-09,2022-01-25,2022-02-14,2022-02-20,2022-02-24","2021-12-26,2021-12-31,2022-01-22,2022-02-04,2022-02-08",0.54446414,0.963187312,0.753825726,10,5,0.005871677,36935148.32,1.00E-06
EOH0904_merged_30min.parquet,1C1R1P1S,2021-2022,04/12/2021 00:00,01/02/2022 23:30,16/12/2021 00:00,17/02/2022 23:30,"2021-12-04,2021-12-14,2021-12-21,2021-12-23,2021-12-25,2021-12-26,2021-12-30,2022-01-05,2022-01-08,2022-02-01","2021-12-16,2021-12-28,2022-01-29,2022-02-12,2022-02-17",0.370327002,0.401007255,0.385667128,10,5,0.01405116,26010810.41,1.00E-06
EOH0918_merged_30min.parquet,1C1R1P1S,2021-2022,22/12/2021 00:00,22/02/2022 23:30,15/12/2021 00:00,04/02/2022 23:30,"2021-12-22,2022-01-02,2022-01-14,2022-01-23,2022-01-29,2022-02-06,2022-02-09,2022-02-14,2022-02-15,2022-02-22","2021-12-15,2021-12-25,2021-12-30,2022-01-06,2022-02-04",0.502699873,0.660570692,0.581635283,10,5,0.00674387,37102663.77,0.151840174
EOH0922_merged_30min.parquet,1C1R1P1S,2021-2022,03/12/2021 00:00,27/02/2022 23:30,02/12/2021 00:00,22/02/2022 23:30,"2021-12-03,2021-12-04,2021-12-14,2021-12-15,2021-12-16,2021-12-26,2022-01-09,2022-01-26,2022-02-25,2022-02-27","2021-12-02,2022-01-06,2022-01-07,2022-01-17,2022-02-22",0.378816058,0.491820524,0.435318291,10,5,0.004653758,36823057.48,1.044361687
EOH0923_merged_30min.parquet,1C1R1P1S,2021-2022,19/01/2022 00:00,27/02/2022 23:30,07/12/2021 00:00,04/02/2022 23:30,"2022-01-19,2022-01-22,2022-01-26,2022-01-27,2022-01-30,2022-02-07,2022-02-18,2022-02-20,2022-02-23,2022-02-27","2021-12-07,2021-12-17,2021-12-21,2022-01-18,2022-02-04",0.44329612,0.762915635,0.603105878,10,5,0.00239896,93180511.56,5.623572913
EOH0930_merged_30min.parquet,1C1R1P1S,2021-2022,24/12/2021 00:00,26/02/2022 23:30,23/12/2021 00:00,19/02/2022 23:30,"2021-12-24,2021-12-28,2021-12-31,2022-01-02,2022-01-14,2022-02-01,2022-02-02,2022-02-20,2022-02-21,2022-02-26","2021-12-23,2022-01-05,2022-01-30,2022-02-08,2022-02-19",0.361295879,0.3787093,0.37000259,10,5,0.004541346,42399505.71,1.00E-06
EOH0934_merged_30min.parquet,1C1R1P1S,2021-2022,27/12/2021 00:00,22/02/2022 23:30,09/12/2021 00:00,24/02/2022 23:30,"2021-12-27,2022-01-02,2022-01-04,2022-01-08,2022-01-12,2022-01-15,2022-01-17,2022-01-25,2022-02-02,2022-02-22","2021-12-09,2021-12-19,2022-01-16,2022-02-08,2022-02-24",0.273191773,0.433129965,0.353160869,10,5,0.003543756,97728592.3,7.345274306
EOH0937_merged_30min.parquet,1C1R1P1S,2021-2022,24/12/2021 00:00,26/02/2022 23:30,03/12/2021 00:00,25/02/2022 23:30,"2021-12-24,2021-12-27,2022-01-05,2022-01-10,2022-01-14,2022-01-23,2022-01-28,2022-01-29,2022-02-10,2022-02-26","2021-12-03,2022-01-07,2022-02-17,2022-02-18,2022-02-25",0.799342976,0.953348456,0.876345716,10,5,0.004353069,33233098.88,0.659562319
EOH0943_merged_30min.parquet,1C1R1P1S,2021-2022,04/12/2021 00:00,03/02/2022 23:30,06/12/2021 00:00,27/02/2022 23:30,"2021-12-04,2021-12-16,2021-12-23,2021-12-27,2022-01-03,2022-01-09,2022-01-12,2022-01-23,2022-01-25,2022-02-03","2021-12-06,2022-01-02,2022-01-21,2022-02-21,2022-02-27",0.578818846,0.72345614,0.651137493,10,5,0.005304488,94943737.24,29.99999999
EOH0953_merged_30min.parquet,1C1R1P1S,2021-2022,02/12/2021 00:00,22/02/2022 23:30,12/12/2021 00:00,26/02/2022 23:30,"2021-12-02,2021-12-03,2021-12-27,2022-01-07,2022-01-20,2022-01-30,2022-02-04,2022-02-05,2022-02-07,2022-02-22","2021-12-12,2021-12-24,2022-01-06,2022-01-22,2022-02-26",0.481572684,0.585499412,0.533536048,10,5,0.005756915,46055693.84,1.960533488
EOH0957_merged_30min.parquet,1C1R1P1S,2021-2022,17/12/2021 00:00,28/02/2022 23:30,08/12/2021 00:00,11/01/2022 23:30,"2021-12-17,2022-01-02,2022-01-03,2022-01-04,2022-01-19,2022-01-24,2022-01-28,2022-01-30,2022-02-06,2022-02-28","2021-12-08,2021-12-19,2021-12-26,2021-12-31,2022-01-11",0.581043123,0.448782147,0.514912635,10,5,0.002692747,74343604.93,1.00E-06
EOH0958_merged_30min.parquet,1C1R1P1S,2021-2022,08/12/2021 00:00,11/01/2022 23:30,02/12/2021 00:00,24/12/2021 23:30,"2021-12-08,2021-12-11,2021-12-12,2021-12-17,2021-12-18,2022-01-03,2022-01-04,2022-01-06,2022-01-08,2022-01-11","2021-12-02,2021-12-05,2021-12-06,2021-12-10,2021-12-24",0.484937915,0.548419649,0.516678782,10,5,0.004585262,27083003.37,13.66957249
EOH0975_merged_30min.parquet,1C1R1P1S,2021-2022,03/12/2021 00:00,23/02/2022 23:30,20/12/2021 00:00,16/02/2022 23:30,"2021-12-03,2021-12-12,2021-12-18,2021-12-26,2022-01-10,2022-01-16,2022-01-21,2022-01-24,2022-02-14,2022-02-23","2021-12-20,2022-01-02,2022-01-11,2022-02-11,2022-02-16",0.500069923,0.921332158,0.710701041,10,5,0.005902785,23521544.19,1.00E-06
EOH0979_merged_30min.parquet,1C1R1P1S,2021-2022,01/12/2021 00:00,26/02/2022 23:30,20/12/2021 00:00,20/02/2022 23:30,"2021-12-01,2021-12-05,2021-12-24,2022-01-03,2022-01-08,2022-01-11,2022-01-18,2022-02-15,2022-02-22,2022-02-26","2021-12-20,2022-01-24,2022-02-05,2022-02-13,2022-02-20",0.465967479,0.742990382,0.60447893,10,5,0.005770304,76812356.54,15.52465491
EOH0988_merged_30min.parquet,1C1R1P1S,2021-2022,01/12/2021 00:00,19/02/2022 23:30,06/12/2021 00:00,21/02/2022 23:30,"2021-12-01,2021-12-03,2021-12-12,2021-12-14,2021-12-21,2021-12-26,2022-01-03,2022-01-08,2022-01-17,2022-02-19","2021-12-06,2021-12-15,2022-01-04,2022-01-27,2022-02-21",0.534213701,0.403879991,0.469046846,10,5,0.010944196,18016842.14,3.060628477
EOH0991_merged_30min.parquet,1C1R1P1S,2021-2022,12/12/2021 00:00,18/02/2022 23:30,02/12/2021 00:00,10/01/2022 23:30,"2021-12-12,2021-12-20,2021-12-26,2022-01-01,2022-01-04,2022-01-13,2022-01-16,2022-01-31,2022-02-01,2022-02-18","2021-12-02,2021-12-06,2021-12-18,2022-01-08,2022-01-10",0.621769503,0.609015904,0.615392704,10,5,0.004735174,29927971.19,2.905811286
EOH0999_merged_30min.parquet,1C1R1P1S,2021-2022,02/12/2021 00:00,15/02/2022 23:30,17/12/2021 00:00,25/02/2022 23:30,"2021-12-02,2021-12-10,2021-12-12,2022-01-07,2022-01-16,2022-01-18,2022-01-22,2022-01-26,2022-02-09,2022-02-15","2021-12-17,2022-01-01,2022-01-09,2022-02-13,2022-02-25",0.400309344,0.441174056,0.4207417,10,5,0.007987371,41482013.75,2.256792693
EOH1000_merged_30min.parquet,1C1R1P1S,2021-2022,02/12/2021 00:00,21/02/2022 23:30,07/12/2021 00:00,08/02/2022 23:30,"2021-12-02,2021-12-03,2021-12-04,2021-12-14,2021-12-19,2021-12-27,2022-01-07,2022-02-13,2022-02-14,2022-02-21","2021-12-07,2021-12-15,2021-12-20,2022-01-02,2022-02-08",0.784895349,0.673669544,0.729282447,10,5,0.007932866,19563210.59,3.260310004
EOH1003_merged_30min.parquet,1C1R1P1S,2021-2022,11/12/2021 00:00,16/02/2022 23:30,14/12/2021 00:00,20/02/2022 23:30,"2021-12-11,2021-12-16,2021-12-24,2022-01-04,2022-01-18,2022-01-19,2022-01-21,2022-01-22,2022-02-07,2022-02-16","2021-12-14,2022-01-24,2022-01-25,2022-02-11,2022-02-20",0.439677022,0.46623273,0.452954876,10,5,0.003932914,176784494.4,23.81413093
EOH1018_merged_30min.parquet,1C1R1P1S,2021-2022,03/12/2021 00:00,11/02/2022 23:30,06/12/2021 00:00,16/02/2022 23:30,"2021-12-03,2021-12-10,2021-12-11,2021-12-16,2021-12-18,2021-12-24,2022-01-01,2022-01-18,2022-01-24,2022-02-11","2021-12-06,2021-12-13,2021-12-23,2022-01-28,2022-02-16",0.954491648,0.799941308,0.877216478,10,5,0.005419383,24548851.02,7.918345114
EOH1019_merged_30min.parquet,1C1R1P1S,2021-2022,01/12/2021 00:00,24/02/2022 23:30,23/12/2021 00:00,09/01/2022 23:30,"2021-12-01,2021-12-08,2021-12-28,2022-01-13,2022-01-31,2022-02-01,2022-02-11,2022-02-18,2022-02-19,2022-02-24","2021-12-23,2021-12-25,2021-12-29,2022-01-05,2022-01-09",0.445316967,0.478883741,0.462100354,10,5,0.006619488,39651079.19,1.01E-06
EOH1041_merged_30min.parquet,1C1R1P1S,2021-2022,06/12/2021 00:00,20/02/2022 23:30,30/12/2021 00:00,24/02/2022 23:30,"2021-12-06,2021-12-12,2021-12-16,2021-12-22,2022-01-07,2022-01-08,2022-01-19,2022-01-21,2022-02-19,2022-02-20","2021-12-30,2022-01-05,2022-01-12,2022-02-04,2022-02-24",0.467375349,0.668355841,0.567865595,10,5,0.006069537,25305111.49,7.233564752
EOH1042_merged_30min.parquet,1C1R1P1S,2021-2022,18/12/2021 00:00,24/02/2022 23:30,27/12/2021 00:00,25/02/2022 23:30,"2021-12-18,2021-12-28,2022-01-07,2022-01-17,2022-01-29,2022-02-06,2022-02-12,2022-02-15,2022-02-22,2022-02-24","2021-12-27,2022-01-06,2022-01-11,2022-02-14,2022-02-25",0.71069905,0.708327493,0.709513272,10,5,0.00308625,138135644.5,16.63840396
EOH1045_merged_30min.parquet,1C1R1P1S,2021-2022,01/12/2021 00:00,03/02/2022 23:30,04/01/2022 00:00,02/02/2022 23:30,"2021-12-01,2021-12-02,2021-12-29,2022-01-07,2022-01-14,2022-01-17,2022-01-18,2022-01-19,2022-01-22,2022-02-03","2022-01-04,2022-01-10,2022-01-20,2022-02-01,2022-02-02",0.325915165,0.56761484,0.446765002,10,5,0.00608863,111906715.9,29.99999999
EOH1046_merged_30min.parquet,1C1R1P1S,2021-2022,03/12/2021 00:00,28/01/2022 23:30,01/12/2021 00:00,27/12/2021 23:30,"2021-12-03,2021-12-07,2021-12-15,2021-12-18,2021-12-26,2021-12-30,2021-12-31,2022-01-03,2022-01-11,2022-01-28","2021-12-01,2021-12-11,2021-12-13,2021-12-19,2021-12-27",0.646263916,0.568250089,0.607257002,10,5,0.004499309,20382617.69,1.00E-06
EOH1048_merged_30min.parquet,1C1R1P1S,2021-2022,11/12/2021 00:00,18/02/2022 23:30,08/01/2022 00:00,26/02/2022 23:30,"2021-12-11,2021-12-19,2022-01-11,2022-01-15,2022-01-17,2022-01-20,2022-01-26,2022-02-06,2022-02-12,2022-02-18","2022-01-08,2022-01-13,2022-02-02,2022-02-08,2022-02-26",0.578145391,0.63088989,0.60451764,10,5,0.005909047,59065285.14,6.845077095
EOH1053_merged_30min.parquet,1C1R1P1S,2021-2022,12/12/2021 00:00,27/02/2022 23:30,13/12/2021 00:00,28/02/2022 23:30,"2021-12-12,2021-12-23,2022-01-15,2022-01-18,2022-01-24,2022-01-26,2022-01-27,2022-02-22,2022-02-23,2022-02-27","2021-12-13,2022-01-12,2022-01-22,2022-01-31,2022-02-28",0.338117521,0.318420426,0.328268973,10,5,0.002544339,68157491.72,11.92738961
EOH1062_merged_30min.parquet,1C1R1P1S,2021-2022,08/12/2021 00:00,21/02/2022 23:30,10/12/2021 00:00,22/02/2022 23:30,"2021-12-08,2021-12-13,2021-12-30,2022-01-24,2022-01-27,2022-01-30,2022-02-03,2022-02-12,2022-02-19,2022-02-21","2021-12-10,2022-01-12,2022-02-06,2022-02-14,2022-02-22",0.553832961,0.61501749,0.584425225,10,5,0.007302986,17349409.35,1.00E-06
EOH1070_merged_30min.parquet,1C1R1P1S,2021-2022,13/12/2021 00:00,25/01/2022 23:30,25/12/2021 00:00,23/02/2022 23:30,"2021-12-13,2021-12-18,2021-12-23,2021-12-30,2021-12-31,2022-01-02,2022-01-03,2022-01-11,2022-01-23,2022-01-25","2021-12-25,2022-01-22,2022-02-19,2022-02-21,2022-02-23",0.429970718,0.595929591,0.512950154,10,5,0.009440334,26996250.53,1.219149779
EOH1085_merged_30min.parquet,1C1R1P1S,2021-2022,13/12/2021 00:00,13/02/2022 23:30,11/12/2021 00:00,15/02/2022 23:30,"2021-12-13,2021-12-21,2022-01-08,2022-01-09,2022-01-16,2022-01-23,2022-02-05,2022-02-07,2022-02-09,2022-02-13","2021-12-11,2022-01-22,2022-01-25,2022-02-03,2022-02-15",0.571582033,0.50448611,0.538034072,10,5,0.003488266,46408939.17,4.846204124
EOH1092_merged_30min.parquet,1C1R1P1S,2021-2022,17/12/2021 00:00,31/01/2022 23:30,02/12/2021 00:00,13/01/2022 23:30,"2021-12-17,2021-12-23,2021-12-29,2021-12-30,2022-01-05,2022-01-14,2022-01-22,2022-01-26,2022-01-27,2022-01-31","2021-12-02,2021-12-04,2021-12-13,2021-12-25,2022-01-13",0.417612182,0.431384927,0.424498554,10,5,0.006089374,61954949.73,2.485182016
EOH1097_merged_30min.parquet,1C1R1P1S,2021-2022,21/12/2021 00:00,14/02/2022 23:30,08/12/2021 00:00,27/02/2022 23:30,"2021-12-21,2021-12-22,2022-01-06,2022-01-18,2022-01-23,2022-01-24,2022-02-02,2022-02-03,2022-02-13,2022-02-14","2021-12-08,2022-01-07,2022-02-11,2022-02-17,2022-02-27",0.505430003,0.712066679,0.608748341,10,5,0.006865295,17338430.04,1.00E-06
EOH1098_merged_30min.parquet,1C1R1P1S,2021-2022,04/12/2021 00:00,25/02/2022 23:30,10/12/2021 00:00,26/02/2022 23:30,"2021-12-04,2021-12-21,2021-12-29,2022-01-09,2022-01-11,2022-01-16,2022-01-20,2022-02-03,2022-02-19,2022-02-25","2021-12-10,2022-01-21,2022-01-22,2022-01-26,2022-02-26",0.822357929,0.92926038,0.875809155,10,5,0.011229337,7163541.835,0.505539192
EOH1103_merged_30min.parquet,1C1R1P1S,2021-2022,07/12/2021 00:00,22/02/2022 23:30,11/12/2021 00:00,24/02/2022 23:30,"2021-12-07,2021-12-16,2021-12-25,2021-12-30,2022-01-01,2022-01-06,2022-01-12,2022-01-31,2022-02-15,2022-02-22","2021-12-11,2021-12-22,2022-01-27,2022-02-21,2022-02-24",0.293971513,0.391358209,0.342664861,10,5,0.003763963,72892878.71,14.05404038
EOH1109_merged_30min.parquet,1C1R1P1S,2021-2022,01/12/2021 00:00,18/02/2022 23:30,14/12/2021 00:00,28/02/2022 23:30,"2021-12-01,2021-12-06,2021-12-19,2021-12-29,2022-01-02,2022-01-07,2022-01-09,2022-01-19,2022-02-02,2022-02-18","2021-12-14,2022-01-05,2022-01-26,2022-02-03,2022-02-28",0.687409516,0.650756239,0.669082877,10,5,0.004609541,32231380.76,1.00E-06
EOH1114_merged_30min.parquet,1C1R1P1S,2021-2022,02/12/2021 00:00,25/02/2022 23:30,13/12/2021 00:00,21/02/2022 23:30,"2021-12-02,2021-12-07,2021-12-16,2021-12-23,2022-01-03,2022-01-06,2022-01-27,2022-01-30,2022-02-11,2022-02-25","2021-12-13,2021-12-25,2022-01-08,2022-01-22,2022-02-21",0.315839505,0.417527821,0.366683663,10,5,0.004131674,45974293.98,1.00E-06
EOH1135_merged_30min.parquet,1C1R1P1S,2020-2021,17/12/2020 00:00,18/02/2021 23:30,21/12/2020 00:00,21/02/2021 23:30,"2020-12-17,2020-12-18,2020-12-30,2021-01-01,2021-01-09,2021-01-26,2021-01-27,2021-02-02,2021-02-06,2021-02-18","2020-12-21,2021-01-07,2021-01-30,2021-02-10,2021-02-21",0.675257518,0.632632939,0.653945228,10,5,0.004806512,26870106.29,1.014082829
EOH1147_merged_30min.parquet,1C1R1P1S,2021-2022,02/12/2021 00:00,21/02/2022 23:30,30/12/2021 00:00,30/01/2022 23:30,"2021-12-02,2021-12-11,2021-12-14,2021-12-16,2022-01-02,2022-01-05,2022-01-08,2022-01-23,2022-01-31,2022-02-21","2021-12-30,2021-12-31,2022-01-07,2022-01-29,2022-01-30",0.513061459,0.550661758,0.531861609,10,5,0.004153464,30069189.28,2.030914104
EOH1154_merged_30min.parquet,1C1R1P1S,2021-2022,10/12/2021 00:00,22/02/2022 23:30,09/12/2021 00:00,26/02/2022 23:30,"2021-12-10,2021-12-21,2021-12-30,2022-01-01,2022-01-14,2022-02-06,2022-02-13,2022-02-18,2022-02-20,2022-02-22","2021-12-09,2021-12-12,2021-12-17,2022-02-15,2022-02-26",0.55026769,0.37943299,0.46485034,10,5,0.003761343,84726414.9,7.622534206
EOH1166_merged_30min.parquet,1C1R1P1S,2021-2022,15/12/2021 00:00,17/02/2022 23:30,12/12/2021 00:00,27/02/2022 23:30,"2021-12-15,2022-01-05,2022-01-17,2022-01-23,2022-01-26,2022-02-01,2022-02-07,2022-02-13,2022-02-14,2022-02-17","2021-12-12,2021-12-20,2022-01-07,2022-01-21,2022-02-27",0.370440981,0.315549313,0.342995147,10,5,0.0102955,51205418.9,4.122767301
EOH1171_merged_30min.parquet,1C1R1P1S,2021-2022,29/12/2021 00:00,25/02/2022 23:30,12/12/2021 00:00,18/02/2022 23:30,"2021-12-29,2022-01-05,2022-01-22,2022-01-26,2022-02-03,2022-02-09,2022-02-12,2022-02-14,2022-02-20,2022-02-25","2021-12-12,2022-01-01,2022-01-31,2022-02-05,2022-02-18",0.608762627,0.717776354,0.66326949,10,5,0.007035375,22398859.91,8.647032272
EOH1175_merged_30min.parquet,1C1R1P1S,2021-2022,02/12/2021 00:00,27/02/2022 23:30,07/12/2021 00:00,24/01/2022 23:30,"2021-12-02,2021-12-19,2021-12-21,2021-12-26,2021-12-31,2022-01-17,2022-02-04,2022-02-23,2022-02-26,2022-02-27","2021-12-07,2021-12-08,2021-12-24,2022-01-15,2022-01-24",0.353468219,0.482291987,0.417880103,10,5,0.003502184,77400420.13,5.665875252
EOH1186_merged_30min.parquet,1C1R1P1S,2021-2022,03/12/2021 00:00,16/02/2022 23:30,02/02/2022 00:00,25/02/2022 23:30,"2021-12-03,2021-12-10,2022-01-04,2022-01-12,2022-01-17,2022-01-28,2022-02-01,2022-02-09,2022-02-12,2022-02-16","2022-02-02,2022-02-03,2022-02-22,2022-02-24,2022-02-25",0.725939191,0.564754741,0.645346966,10,5,0.004154296,48237687.28,2.895972396
EOH1190_merged_30min.parquet,1C1R1P1S,2021-2022,08/12/2021 00:00,18/02/2022 23:30,12/12/2021 00:00,27/02/2022 23:30,"2021-12-08,2021-12-10,2021-12-18,2022-01-03,2022-01-11,2022-01-17,2022-01-24,2022-02-02,2022-02-04,2022-02-18","2021-12-12,2021-12-14,2022-02-07,2022-02-24,2022-02-27",0.162023656,0.086748054,0.124385855,10,5,0.00384576,300000000,6.137621654
EOH1191_merged_30min.parquet,1C1R1P1S,2021-2022,11/12/2021 00:00,03/02/2022 23:30,10/12/2021 00:00,23/01/2022 23:30,"2021-12-11,2021-12-19,2021-12-22,2021-12-25,2021-12-26,2022-01-08,2022-01-10,2022-01-14,2022-02-02,2022-02-03","2021-12-10,2021-12-30,2022-01-06,2022-01-21,2022-01-23",0.535470476,0.406058903,0.47076469,10,5,0.007976033,33453684.51,12.50535977
EOH1207_merged_30min.parquet,1C1R1P1S,2021-2022,13/12/2021 00:00,22/02/2022 23:30,09/12/2021 00:00,07/02/2022 23:30,"2021-12-13,2021-12-17,2021-12-24,2022-01-02,2022-01-05,2022-01-10,2022-01-25,2022-01-29,2022-02-12,2022-02-22","2021-12-09,2021-12-11,2021-12-27,2022-02-04,2022-02-07",0.267668723,0.462665587,0.365167155,10,5,0.004111331,75549465.86,8.886487426
EOH1233_merged_30min.parquet,1C1R1P1S,2021-2022,02/12/2021 00:00,23/12/2021 23:30,01/12/2021 00:00,24/12/2021 23:30,"2021-12-02,2021-12-03,2021-12-04,2021-12-08,2021-12-12,2021-12-14,2021-12-15,2021-12-16,2021-12-21,2021-12-23","2021-12-01,2021-12-06,2021-12-09,2021-12-10,2021-12-24",0.223401919,0.232914972,0.228158446,10,5,0.004332427,300000000,8.201675421
EOH1239_merged_30min.parquet,1C1R1P1S,2021-2022,14/12/2021 00:00,20/02/2022 23:30,08/12/2021 00:00,22/02/2022 23:30,"2021-12-14,2021-12-21,2021-12-24,2022-01-09,2022-02-10,2022-02-12,2022-02-15,2022-02-17,2022-02-18,2022-02-20","2021-12-08,2021-12-16,2022-01-31,2022-02-16,2022-02-22",0.934849295,0.757777135,0.846313215,10,5,0.004660004,37830889.47,1.0247041
EOH1242_merged_30min.parquet,1C1R1P1S,2021-2022,09/12/2021 00:00,09/02/2022 23:30,03/12/2021 00:00,21/02/2022 23:30,"2021-12-09,2021-12-10,2021-12-30,2022-01-17,2022-01-23,2022-01-26,2022-01-28,2022-01-29,2022-02-03,2022-02-09","2021-12-03,2022-01-07,2022-01-08,2022-01-16,2022-02-21",0.399481385,0.385286738,0.392384062,10,5,0.006999505,35597001.52,3.055622787
EOH1249_merged_30min.parquet,1C1R1P1S,2021-2022,01/12/2021 00:00,20/02/2022 23:30,14/01/2022 00:00,17/02/2022 23:30,"2021-12-01,2021-12-15,2021-12-21,2021-12-28,2022-01-24,2022-02-03,2022-02-09,2022-02-11,2022-02-14,2022-02-20","2022-01-14,2022-01-27,2022-02-12,2022-02-15,2022-02-17",0.383164736,0.556240048,0.469702392,10,5,0.010713037,110564457.2,4.244938735
EOH1251_merged_30min.parquet,1C1R1P1S,2021-2022,28/12/2021 00:00,28/02/2022 23:30,11/12/2021 00:00,21/02/2022 23:30,"2021-12-28,2021-12-30,2022-01-04,2022-01-05,2022-01-10,2022-01-19,2022-01-22,2022-02-24,2022-02-26,2022-02-28","2021-12-11,2021-12-12,2022-01-07,2022-01-18,2022-02-21",0.862472992,0.607023149,0.734748071,10,5,0.004539409,25260974.02,1.00E-06
EOH1254_merged_30min.parquet,1C1R1P1S,2021-2022,01/12/2021 00:00,26/02/2022 23:30,03/12/2021 00:00,15/02/2022 23:30,"2021-12-01,2021-12-04,2021-12-27,2022-01-03,2022-01-06,2022-01-22,2022-02-11,2022-02-13,2022-02-18,2022-02-26","2021-12-03,2021-12-19,2021-12-22,2022-01-24,2022-02-15",0.893039905,0.809583842,0.851311874,10,5,0.008028372,20505845.92,0.27501035
EOH1255_merged_30min.parquet,1C1R1P1S,2021-2022,09/12/2021 00:00,27/02/2022 23:30,22/12/2021 00:00,24/02/2022 23:30,"2021-12-09,2021-12-14,2021-12-15,2021-12-27,2022-01-06,2022-01-23,2022-02-05,2022-02-06,2022-02-09,2022-02-27","2021-12-22,2022-01-01,2022-01-09,2022-01-29,2022-02-24",0.684935369,0.797873355,0.741404362,10,5,0.004421571,95660863.93,11.08982508
EOH1260_merged_30min.parquet,1C1R1P1S,2021-2022,04/12/2021 00:00,28/02/2022 23:30,03/12/2021 00:00,14/02/2022 23:30,"2021-12-04,2021-12-06,2021-12-15,2021-12-20,2021-12-21,2022-01-05,2022-01-08,2022-02-19,2022-02-20,2022-02-28","2021-12-03,2021-12-11,2021-12-31,2022-01-28,2022-02-14",0.891804727,0.848081463,0.869943095,10,5,0.006273819,202409088,29.99999999
EOH1281_merged_30min.parquet,1C1R1P1S,2020-2021,22/12/2020 00:00,22/02/2021 23:30,16/01/2021 00:00,23/02/2021 23:30,"2020-12-22,2021-01-05,2021-01-10,2021-02-05,2021-02-06,2021-02-15,2021-02-16,2021-02-19,2021-02-21,2021-02-22","2021-01-16,2021-01-31,2021-02-01,2021-02-08,2021-02-23",0.91336099,0.896618462,0.904989726,10,5,0.020911935,14683999.18,0.559758373
EOH1286_merged_30min.parquet,1C1R1P1S,2021-2022,03/12/2021 00:00,18/02/2022 23:30,01/12/2021 00:00,12/02/2022 23:30,"2021-12-03,2021-12-10,2021-12-12,2021-12-21,2021-12-23,2021-12-25,2021-12-27,2022-02-01,2022-02-06,2022-02-18","2021-12-01,2021-12-11,2022-01-23,2022-01-28,2022-02-12",0.506430338,0.742541946,0.624486142,10,5,0.006160688,29443713.02,1.400109719
EOH1302_merged_30min.parquet,1C1R1P1S,2021-2022,27/12/2021 00:00,28/02/2022 23:30,09/12/2021 00:00,20/02/2022 23:30,"2021-12-27,2022-01-07,2022-01-12,2022-01-15,2022-01-20,2022-01-23,2022-01-28,2022-02-09,2022-02-24,2022-02-28","2021-12-09,2021-12-26,2022-01-01,2022-02-17,2022-02-20",0.795841875,0.829414738,0.812628306,10,5,0.00812922,59249899.09,1.02E-06
EOH1304_merged_30min.parquet,1C1R1P1S,2021-2022,09/12/2021 00:00,28/02/2022 23:30,17/12/2021 00:00,26/02/2022 23:30,"2021-12-09,2021-12-20,2021-12-25,2022-01-04,2022-01-28,2022-01-31,2022-02-06,2022-02-10,2022-02-24,2022-02-28","2021-12-17,2022-02-11,2022-02-21,2022-02-22,2022-02-26",0.702971897,0.632017228,0.667494563,10,5,0.007049143,23665571.99,1.00E-06
EOH1306_merged_30min.parquet,1C1R1P1S,2021-2022,01/12/2021 00:00,09/02/2022 23:30,02/12/2021 00:00,27/02/2022 23:30,"2021-12-01,2021-12-11,2021-12-15,2021-12-19,2021-12-20,2021-12-22,2022-01-02,2022-01-06,2022-01-09,2022-02-09","2021-12-02,2021-12-05,2022-01-10,2022-02-24,2022-02-27",0.392847631,0.449980245,0.421413938,10,5,0.006912059,80641301.5,8.906306726
EOH1311_merged_30min.parquet,1C1R1P1S,2021-2022,01/12/2021 00:00,25/02/2022 23:30,05/12/2021 00:00,18/02/2022 23:30,"2021-12-01,2022-01-01,2022-01-03,2022-01-08,2022-01-21,2022-01-23,2022-01-25,2022-02-02,2022-02-09,2022-02-25","2021-12-05,2022-01-04,2022-01-16,2022-01-22,2022-02-18",0.433897144,0.508485803,0.471191473,10,5,0.003748013,69416468.1,1.16772364
EOH1327_merged_30min.parquet,1C1R1P1S,2021-2022,12/12/2021 00:00,26/02/2022 23:30,03/12/2021 00:00,24/02/2022 23:30,"2021-12-12,2021-12-29,2022-01-07,2022-01-08,2022-01-12,2022-01-15,2022-01-23,2022-02-09,2022-02-12,2022-02-26","2021-12-03,2021-12-18,2021-12-30,2022-02-18,2022-02-24",0.722228629,0.729735738,0.725982183,10,5,0.00739584,18940635.62,1.00E-06
EOH1328_merged_30min.parquet,1C1R1P1S,2021-2022,16/12/2021 00:00,14/02/2022 23:30,05/12/2021 00:00,10/02/2022 23:30,"2021-12-16,2021-12-18,2021-12-22,2021-12-29,2022-01-02,2022-01-09,2022-01-24,2022-01-30,2022-02-12,2022-02-14","2021-12-05,2021-12-13,2022-01-20,2022-01-25,2022-02-10",0.773225224,0.713185365,0.743205294,10,5,0.005106347,70735812.31,1.09E-06
EOH1330_merged_30min.parquet,1C1R1P1S,2021-2022,14/12/2021 00:00,25/02/2022 23:30,12/12/2021 00:00,27/01/2022 23:30,"2021-12-14,2021-12-27,2021-12-28,2022-01-14,2022-01-17,2022-01-26,2022-02-03,2022-02-08,2022-02-19,2022-02-25","2021-12-12,2021-12-30,2022-01-05,2022-01-11,2022-01-27",0.806554122,0.858782812,0.832668467,10,5,0.010203934,16641515.22,5.839530391
EOH1336_merged_30min.parquet,1C1R1P1S,2021-2022,08/12/2021 00:00,27/02/2022 23:30,07/12/2021 00:00,21/02/2022 23:30,"2021-12-08,2021-12-27,2022-01-04,2022-01-13,2022-01-24,2022-02-04,2022-02-14,2022-02-18,2022-02-26,2022-02-27","2021-12-07,2021-12-25,2022-01-23,2022-02-20,2022-02-21",0.266859528,0.46777927,0.367319399,10,5,0.00568864,48879578.65,2.371824073
EOH1346_merged_30min.parquet,1C1R1P1S,2021-2022,18/12/2021 00:00,18/02/2022 23:30,03/12/2021 00:00,27/02/2022 23:30,"2021-12-18,2021-12-21,2021-12-24,2021-12-26,2022-01-11,2022-01-16,2022-01-22,2022-01-23,2022-02-16,2022-02-18","2021-12-03,2021-12-10,2022-01-24,2022-02-11,2022-02-27",0.407695003,0.607661653,0.507678328,10,5,0.004113496,230147002.1,1.00E-06
EOH1349_merged_30min.parquet,1C1R1P1S,2021-2022,04/12/2021 00:00,25/02/2022 23:30,09/01/2022 00:00,26/02/2022 23:30,"2021-12-04,2021-12-05,2021-12-07,2021-12-12,2021-12-25,2021-12-29,2022-01-03,2022-01-16,2022-01-23,2022-02-25","2022-01-09,2022-01-11,2022-02-06,2022-02-15,2022-02-26",0.899166793,0.882512862,0.890839827,10,5,0.007061267,72961140.29,1.00E-06
EOH1358_merged_30min.parquet,1C1R1P1S,2021-2022,03/12/2021 00:00,07/02/2022 23:30,15/12/2021 00:00,09/02/2022 23:30,"2021-12-03,2021-12-04,2021-12-05,2021-12-06,2021-12-08,2021-12-09,2021-12-12,2021-12-14,2022-02-03,2022-02-07","2021-12-15,2022-01-31,2022-02-05,2022-02-06,2022-02-09",0.352403682,0.40392804,0.378165861,10,5,0.007058185,48827091.9,13.11112813
EOH1360_merged_30min.parquet,1C1R1P1S,2021-2022,02/12/2021 00:00,12/01/2022 23:30,09/12/2021 00:00,21/12/2021 23:30,"2021-12-02,2021-12-06,2021-12-12,2021-12-14,2021-12-28,2021-12-30,2022-01-02,2022-01-03,2022-01-09,2022-01-12","2021-12-09,2021-12-16,2021-12-18,2021-12-20,2021-12-21",0.991766371,0.936529092,0.964147731,10,5,0.003377437,32534980.39,13.46103912
EOH1363_merged_30min.parquet,1C1R1P1S,2021-2022,16/12/2021 00:00,26/02/2022 23:30,05/01/2022 00:00,23/01/2022 23:30,"2021-12-16,2022-01-18,2022-01-22,2022-02-04,2022-02-06,2022-02-09,2022-02-15,2022-02-18,2022-02-20,2022-02-26","2022-01-05,2022-01-12,2022-01-14,2022-01-16,2022-01-23",0.30133316,0.231521007,0.266427083,10,5,0.004218539,300000000,1.00E-06
EOH1365_merged_30min.parquet,1C1R1P1S,2021-2022,07/12/2021 00:00,28/02/2022 23:30,17/12/2021 00:00,12/02/2022 23:30,"2021-12-07,2021-12-09,2022-01-05,2022-01-20,2022-01-26,2022-01-28,2022-01-31,2022-02-15,2022-02-20,2022-02-28","2021-12-17,2021-12-29,2022-01-03,2022-02-01,2022-02-12",0.260641691,0.201820527,0.231231109,10,5,0.004469065,300000000,26.75310085
EOH1366_merged_30min.parquet,1C1R1P1S,2021-2022,07/12/2021 00:00,13/02/2022 23:30,04/12/2021 00:00,19/01/2022 23:30,"2021-12-07,2021-12-12,2021-12-17,2021-12-24,2021-12-27,2022-01-07,2022-01-16,2022-02-04,2022-02-05,2022-02-13","2021-12-04,2021-12-09,2021-12-28,2022-01-02,2022-01-19",0.458681578,0.407851184,0.433266381,10,5,0.003835862,92626434.83,1.01E-06
EOH1390_merged_30min.parquet,1C1R1P1S,2021-2022,03/01/2022 00:00,26/02/2022 23:30,04/12/2021 00:00,21/02/2022 23:30,"2022-01-03,2022-01-07,2022-01-11,2022-01-29,2022-02-01,2022-02-09,2022-02-17,2022-02-20,2022-02-24,2022-02-26","2021-12-04,2021-12-07,2022-01-01,2022-01-15,2022-02-21",0.586378656,0.590761103,0.58856988,10,5,0.003483742,33592897.65,1.00E-06
EOH1392_merged_30min.parquet,1C1R1P1S,2021-2022,15/12/2021 00:00,27/02/2022 23:30,01/12/2021 00:00,09/02/2022 23:30,"2021-12-15,2021-12-19,2021-12-27,2022-01-12,2022-01-21,2022-01-22,2022-02-14,2022-02-22,2022-02-25,2022-02-27","2021-12-01,2021-12-05,2021-12-08,2022-01-14,2022-02-09",0.873050126,0.655157156,0.764103641,10,5,0.005976222,65512682.77,18.41418831
EOH1399_merged_30min.parquet,1C1R1P1S,2021-2022,13/01/2022 00:00,27/02/2022 23:30,21/01/2022 00:00,21/02/2022 23:30,"2022-01-13,2022-01-15,2022-01-23,2022-01-24,2022-01-25,2022-01-29,2022-02-06,2022-02-23,2022-02-26,2022-02-27","2022-01-21,2022-02-07,2022-02-12,2022-02-18,2022-02-21",0.465037521,0.394271503,0.429654512,10,5,0.000973764,299999999.9,22.47852803
EOH1401_merged_30min.parquet,1C1R1P1S,2021-2022,01/01/2022 00:00,17/02/2022 23:30,30/12/2021 00:00,16/02/2022 23:30,"2022-01-01,2022-01-02,2022-01-09,2022-01-22,2022-02-04,2022-02-05,2022-02-06,2022-02-08,2022-02-10,2022-02-17","2021-12-30,2022-01-11,2022-01-21,2022-01-27,2022-02-16",0.433387862,0.59314932,0.513268591,10,5,0.007266414,35082873.99,5.325644004
EOH1404_merged_30min.parquet,1C1R1P1S,2021-2022,02/12/2021 00:00,26/02/2022 23:30,13/12/2021 00:00,12/01/2022 23:30,"2021-12-02,2021-12-07,2021-12-17,2022-01-02,2022-01-10,2022-01-31,2022-02-08,2022-02-21,2022-02-25,2022-02-26","2021-12-13,2021-12-19,2021-12-27,2022-01-01,2022-01-12",0.498792984,0.619224949,0.559008967,10,5,0.004935659,29188816.55,3.303619917
EOH1406_merged_30min.parquet,1C1R1P1S,2021-2022,03/12/2021 00:00,27/01/2022 23:30,09/12/2021 00:00,22/01/2022 23:30,"2021-12-03,2021-12-18,2021-12-30,2021-12-31,2022-01-02,2022-01-12,2022-01-19,2022-01-25,2022-01-26,2022-01-27","2021-12-09,2021-12-20,2022-01-09,2022-01-18,2022-01-22",0.295943554,0.319377813,0.307660683,10,5,0.007070288,49706833.98,1.00E-06
EOH1409_merged_30min.parquet,1C1R1P1S,2021-2022,03/12/2021 00:00,27/02/2022 23:30,24/01/2022 00:00,22/02/2022 23:30,"2021-12-03,2021-12-04,2021-12-05,2022-01-13,2022-01-20,2022-01-28,2022-01-31,2022-02-02,2022-02-03,2022-02-27","2022-01-24,2022-01-25,2022-02-01,2022-02-07,2022-02-22",0.487351964,0.522414818,0.504883391,10,5,0.004830332,42042555.59,3.714706193
EOH1412_merged_30min.parquet,1C1R1P1S,2021-2022,08/12/2021 00:00,18/02/2022 23:30,17/12/2021 00:00,20/02/2022 23:30,"2021-12-08,2021-12-10,2021-12-15,2021-12-21,2021-12-23,2022-01-11,2022-01-19,2022-01-20,2022-01-28,2022-02-18","2021-12-17,2021-12-18,2021-12-22,2022-01-26,2022-02-20",0.426033002,0.506367322,0.466200162,10,5,0.008085256,56972519.79,1.821952816
EOH1414_merged_30min.parquet,1C1R1P1S,2021-2022,13/12/2021 00:00,22/02/2022 23:30,07/12/2021 00:00,18/01/2022 23:30,"2021-12-13,2021-12-20,2021-12-21,2022-01-14,2022-01-19,2022-01-23,2022-01-26,2022-02-05,2022-02-17,2022-02-22","2021-12-07,2021-12-14,2021-12-15,2022-01-07,2022-01-18",0.356855961,0.334903618,0.345879789,10,5,0.008254961,21733260.43,1.553588705
EOH1415_merged_30min.parquet,1C1R1P1S,2021-2022,04/12/2021 00:00,13/02/2022 23:30,20/12/2021 00:00,24/02/2022 23:30,"2021-12-04,2021-12-05,2021-12-08,2021-12-11,2021-12-25,2022-01-10,2022-01-12,2022-01-13,2022-01-20,2022-02-13","2021-12-20,2022-01-02,2022-02-07,2022-02-09,2022-02-24",0.295646877,0.604475054,0.450060966,10,5,0.005661037,76232563.56,15.09979771
EOH1416_merged_30min.parquet,1C1R1P1S,2021-2022,01/12/2021 00:00,19/02/2022 23:30,08/01/2022 00:00,23/02/2022 23:30,"2021-12-01,2021-12-10,2021-12-14,2022-01-06,2022-01-17,2022-01-23,2022-01-24,2022-02-09,2022-02-11,2022-02-19","2022-01-08,2022-01-18,2022-02-06,2022-02-15,2022-02-23",0.32084346,0.343294125,0.332068793,10,5,0.002707637,83310535.54,9.155224529
EOH1423_merged_30min.parquet,1C1R1P1S,2021-2022,03/12/2021 00:00,26/01/2022 23:30,01/12/2021 00:00,27/01/2022 23:30,"2021-12-03,2021-12-06,2022-01-10,2022-01-11,2022-01-14,2022-01-16,2022-01-17,2022-01-22,2022-01-24,2022-01-26","2021-12-01,2022-01-09,2022-01-15,2022-01-23,2022-01-27",0.75909187,0.962856048,0.860973959,10,5,0.003677666,23423947.3,15.70300405
EOH1426_merged_30min.parquet,1C1R1P1S,2021-2022,05/12/2021 00:00,24/02/2022 23:30,14/12/2021 00:00,15/01/2022 23:30,"2021-12-05,2021-12-07,2021-12-11,2021-12-23,2022-01-08,2022-01-10,2022-02-01,2022-02-03,2022-02-13,2022-02-24","2021-12-14,2021-12-15,2021-12-19,2021-12-22,2022-01-15",0.35247007,0.217797579,0.285133825,10,5,0.003586726,299999998.8,1.00E-06
EOH1446_merged_30min.parquet,1C1R1P1S,2021-2022,16/12/2021 00:00,24/02/2022 23:30,20/12/2021 00:00,26/02/2022 23:30,"2021-12-16,2021-12-22,2022-01-01,2022-01-21,2022-01-22,2022-01-27,2022-01-29,2022-02-05,2022-02-08,2022-02-24","2021-12-20,2021-12-23,2022-01-14,2022-02-09,2022-02-26",0.42202002,0.565935121,0.49397757,10,5,0.004526585,66195014.99,1.00E-06
EOH1457_merged_30min.parquet,1C1R1P1S,2021-2022,03/12/2021 00:00,27/02/2022 23:30,01/12/2021 00:00,18/02/2022 23:30,"2021-12-03,2021-12-12,2021-12-18,2021-12-31,2022-01-01,2022-02-08,2022-02-09,2022-02-22,2022-02-25,2022-02-27","2021-12-01,2021-12-06,2022-01-24,2022-02-16,2022-02-18",0.62463414,0.543171372,0.583902756,10,5,0.006103393,51410857.39,3.188528996
EOH1459_merged_30min.parquet,1C1R1P1S,2021-2022,03/12/2021 00:00,23/02/2022 23:30,02/12/2021 00:00,19/02/2022 23:30,"2021-12-03,2021-12-10,2022-01-17,2022-02-01,2022-02-02,2022-02-08,2022-02-14,2022-02-18,2022-02-22,2022-02-23","2021-12-02,2022-01-08,2022-01-18,2022-01-21,2022-02-19",0.480655178,0.620904163,0.550779671,10,5,0.005533139,77143295.22,2.942881429
EOH1472_merged_30min.parquet,1C1R1P1S,2021-2022,06/01/2022 00:00,28/02/2022 23:30,01/12/2021 00:00,13/02/2022 23:30,"2022-01-06,2022-01-23,2022-01-28,2022-01-30,2022-02-04,2022-02-08,2022-02-11,2022-02-25,2022-02-27,2022-02-28","2021-12-01,2021-12-11,2021-12-19,2022-01-11,2022-02-13",0.944447101,0.66173294,0.803090021,10,5,0.004720974,43962733.35,5.476674156
EOH1478_merged_30min.parquet,1C1R1P1S,2021-2022,01/12/2021 00:00,17/02/2022 23:30,05/12/2021 00:00,12/01/2022 23:30,"2021-12-01,2021-12-06,2021-12-07,2021-12-25,2022-01-26,2022-01-29,2022-02-07,2022-02-09,2022-02-12,2022-02-17","2021-12-05,2021-12-13,2021-12-23,2021-12-29,2022-01-12",0.579097488,0.767009913,0.6730537,10,5,0.006478536,33321207.69,1.00E-06
EOH1484_merged_30min.parquet,1C1R1P1S,2021-2022,05/12/2021 00:00,22/02/2022 23:30,03/12/2021 00:00,16/02/2022 23:30,"2021-12-05,2021-12-06,2021-12-13,2021-12-22,2022-01-20,2022-02-01,2022-02-02,2022-02-07,2022-02-14,2022-02-22","2021-12-03,2021-12-20,2022-01-08,2022-01-21,2022-02-16",0.305554884,0.517410341,0.411482613,10,5,0.002821001,110321701.9,0.009985225
EOH1485_merged_30min.parquet,1C1R1P1S,2020-2021,01/12/2020 00:00,23/02/2021 23:30,04/01/2021 00:00,26/02/2021 23:30,"2020-12-01,2020-12-02,2020-12-10,2020-12-22,2020-12-24,2020-12-29,2021-01-25,2021-02-01,2021-02-11,2021-02-23","2021-01-04,2021-01-06,2021-01-17,2021-01-23,2021-02-26",0.563273085,0.791515622,0.677394353,10,5,0.004480074,43671332.36,5.663137571
EOH1502_merged_30min.parquet,1C1R1P1S,2021-2022,06/12/2021 00:00,19/02/2022 23:30,08/12/2021 00:00,17/02/2022 23:30,"2021-12-06,2021-12-18,2021-12-22,2021-12-28,2021-12-30,2022-01-05,2022-01-18,2022-02-05,2022-02-06,2022-02-19","2021-12-08,2021-12-19,2021-12-26,2022-01-14,2022-02-17",0.370517323,0.404801115,0.387659219,10,5,0.004324079,64198851.14,1.00E-06
EOH1512_merged_30min.parquet,1C1R1P1S,2021-2022,02/12/2021 00:00,20/01/2022 23:30,08/12/2021 00:00,08/02/2022 23:30,"2021-12-02,2021-12-03,2021-12-10,2021-12-13,2021-12-14,2021-12-18,2022-01-05,2022-01-14,2022-01-15,2022-01-20","2021-12-08,2021-12-24,2022-01-24,2022-02-01,2022-02-08",0.376411361,0.359101177,0.367756269,10,5,0.007219047,40487234.1,5.216187907
EOH1521_merged_30min.parquet,1C1R1P1S,2021-2022,01/12/2021 00:00,24/02/2022 23:30,11/12/2021 00:00,08/02/2022 23:30,"2021-12-01,2021-12-06,2021-12-14,2021-12-29,2022-01-01,2022-01-21,2022-02-01,2022-02-21,2022-02-22,2022-02-24","2021-12-11,2021-12-16,2022-01-19,2022-01-22,2022-02-08",0.400856312,0.411797793,0.406327053,10,5,0.008533607,14241034.56,2.156716777
EOH1530_merged_30min.parquet,1C1R1P1S,2021-2022,01/12/2021 00:00,25/02/2022 23:30,18/12/2021 00:00,16/02/2022 23:30,"2021-12-01,2021-12-03,2021-12-05,2021-12-08,2022-01-09,2022-01-21,2022-01-23,2022-02-05,2022-02-18,2022-02-25","2021-12-18,2021-12-28,2022-01-08,2022-02-01,2022-02-16",0.931254814,0.898174207,0.914714511,10,5,0.00559939,49996501.66,1.01E-06
EOH1543_merged_30min.parquet,1C1R1P1S,2021-2022,23/12/2021 00:00,18/02/2022 23:30,14/12/2021 00:00,27/02/2022 23:30,"2021-12-23,2021-12-25,2022-01-08,2022-01-13,2022-01-16,2022-01-18,2022-01-19,2022-02-14,2022-02-16,2022-02-18","2021-12-14,2021-12-24,2022-02-13,2022-02-25,2022-02-27",0.395370353,0.403688456,0.399529405,10,5,0.006252614,170977239.5,1.00E-06
EOH1544_merged_30min.parquet,1C1R1P1S,2021-2022,13/12/2021 00:00,19/02/2022 23:30,01/12/2021 00:00,13/02/2022 23:30,"2021-12-13,2021-12-17,2021-12-18,2022-01-02,2022-01-07,2022-01-12,2022-01-28,2022-02-01,2022-02-15,2022-02-19","2021-12-01,2021-12-12,2022-01-09,2022-01-15,2022-02-13",0.569718306,0.526868974,0.54829364,10,5,0.004944091,57994078.49,0.073347639
EOH1562_merged_30min.parquet,1C1R1P1S,2021-2022,06/12/2021 00:00,10/02/2022 23:30,18/12/2021 00:00,22/02/2022 23:30,"2021-12-06,2021-12-17,2021-12-21,2021-12-30,2022-01-01,2022-01-19,2022-01-29,2022-02-01,2022-02-03,2022-02-10","2021-12-18,2021-12-27,2022-02-07,2022-02-18,2022-02-22",0.358043456,0.363700138,0.360871797,10,5,0.005925667,116697389.2,1.00E-06
EOH1566_merged_30min.parquet,1C1R1P1S,2021-2022,21/01/2022 00:00,26/02/2022 23:30,09/02/2022 00:00,28/02/2022 23:30,"2022-01-21,2022-01-31,2022-02-06,2022-02-07,2022-02-15,2022-02-16,2022-02-18,2022-02-22,2022-02-24,2022-02-26","2022-02-09,2022-02-11,2022-02-12,2022-02-14,2022-02-28",0.69100492,0.713825093,0.702415007,10,5,0.005152851,39967014.52,5.875020965
EOH1578_merged_30min.parquet,1C1R1P1S,2021-2022,03/12/2021 00:00,24/02/2022 23:30,01/12/2021 00:00,18/02/2022 23:30,"2021-12-03,2021-12-07,2021-12-10,2022-01-02,2022-01-04,2022-01-10,2022-01-18,2022-01-31,2022-02-11,2022-02-24","2021-12-01,2021-12-18,2022-02-15,2022-02-17,2022-02-18",0.541553783,0.556596428,0.549075105,10,5,0.006532432,21722073.15,2.967896425
EOH1585_merged_30min.parquet,1C1R1P1S,2021-2022,08/12/2021 00:00,18/02/2022 23:30,05/12/2021 00:00,13/02/2022 23:30,"2021-12-08,2021-12-14,2021-12-18,2021-12-23,2022-01-03,2022-02-01,2022-02-02,2022-02-04,2022-02-07,2022-02-18","2021-12-05,2022-01-28,2022-02-03,2022-02-12,2022-02-13",0.233653691,0.385629133,0.309641412,10,5,0.019900986,48446842.05,1.00E-06
EOH1588_merged_30min.parquet,1C1R1P1S,2021-2022,03/12/2021 00:00,19/02/2022 23:30,14/12/2021 00:00,23/02/2022 23:30,"2021-12-03,2021-12-08,2021-12-10,2021-12-23,2022-01-02,2022-01-11,2022-02-03,2022-02-11,2022-02-14,2022-02-19","2021-12-14,2022-01-17,2022-01-20,2022-02-18,2022-02-23",0.284186745,0.320573089,0.302379917,10,5,0.00378502,130527321.3,1.00E-06
EOH1602_merged_30min.parquet,1C1R1P1S,2020-2021,01/12/2020 00:00,08/02/2021 23:30,02/12/2020 00:00,29/01/2021 23:30,"2020-12-01,2020-12-09,2020-12-18,2020-12-22,2020-12-23,2021-01-14,2021-01-15,2021-01-23,2021-01-27,2021-02-08","2020-12-02,2020-12-13,2020-12-16,2020-12-26,2021-01-29",0.784204718,0.514389746,0.649297232,10,5,0.006418219,63761943.4,2.606135481
EOH1614_merged_30min.parquet,1C1R1P1S,2021-2022,03/12/2021 00:00,25/02/2022 23:30,12/12/2021 00:00,13/02/2022 23:30,"2021-12-03,2021-12-08,2021-12-18,2021-12-22,2021-12-27,2022-01-07,2022-01-12,2022-01-29,2022-02-22,2022-02-25","2021-12-12,2021-12-17,2021-12-23,2022-01-06,2022-02-13",0.579763801,0.924800164,0.752281983,10,5,0.008101172,27943301.83,5.508740117
EOH1628_merged_30min.parquet,1C1R1P1S,2021-2022,17/12/2021 00:00,26/02/2022 23:30,18/12/2021 00:00,13/02/2022 23:30,"2021-12-17,2021-12-19,2021-12-31,2022-01-04,2022-01-17,2022-01-20,2022-01-24,2022-01-25,2022-02-23,2022-02-26","2021-12-18,2022-01-19,2022-01-27,2022-02-08,2022-02-13",0.656464008,0.582427553,0.619445781,10,5,0.006223731,96229533.95,1.00E-06
EOH1637_merged_30min.parquet,1C1R1P1S,2020-2021,06/12/2020 00:00,05/02/2021 23:30,02/12/2020 00:00,16/02/2021 23:30,"2020-12-06,2020-12-11,2020-12-17,2020-12-31,2021-01-06,2021-01-07,2021-01-10,2021-01-24,2021-02-03,2021-02-05","2020-12-02,2021-01-22,2021-01-23,2021-01-29,2021-02-16",0.5687656,0.660663666,0.614714633,10,5,0.004444594,22292095.93,1.00E-06
EOH1646_merged_30min.parquet,1C1R1P1S,2021-2022,09/12/2021 00:00,21/02/2022 23:30,12/12/2021 00:00,18/02/2022 23:30,"2021-12-09,2021-12-26,2021-12-31,2022-01-09,2022-01-30,2022-02-06,2022-02-07,2022-02-10,2022-02-14,2022-02-21","2021-12-12,2021-12-24,2022-01-31,2022-02-03,2022-02-18",0.751255802,0.690033025,0.720644413,10,5,0.006238772,23725124.08,6.157613804
EOH1660_merged_30min.parquet,1C1R1P1S,2021-2022,07/01/2022 00:00,23/02/2022 23:30,01/12/2021 00:00,31/01/2022 23:30,"2022-01-07,2022-01-14,2022-01-18,2022-01-23,2022-01-26,2022-02-02,2022-02-11,2022-02-17,2022-02-21,2022-02-23","2021-12-01,2021-12-06,2022-01-12,2022-01-27,2022-01-31",0.477778422,0.480960631,0.479369526,10,5,0.004351118,60361841.29,1.00E-06
EOH1662_merged_30min.parquet,1C1R1P1S,2021-2022,11/12/2021 00:00,23/02/2022 23:30,03/12/2021 00:00,11/02/2022 23:30,"2021-12-11,2021-12-20,2022-01-05,2022-01-09,2022-01-16,2022-01-18,2022-02-08,2022-02-16,2022-02-21,2022-02-23","2021-12-03,2021-12-19,2021-12-22,2022-01-23,2022-02-11",0.333664096,0.613883101,0.473773599,10,5,0.004903501,28678127.65,1.066101951
EOH1663_merged_30min.parquet,1C1R1P1S,2021-2022,02/12/2021 00:00,06/02/2022 23:30,03/12/2021 00:00,15/01/2022 23:30,"2021-12-02,2021-12-05,2021-12-13,2021-12-17,2021-12-23,2022-01-05,2022-01-08,2022-01-09,2022-01-17,2022-02-06","2021-12-03,2021-12-28,2022-01-01,2022-01-12,2022-01-15",0.957897024,0.902091948,0.929994486,10,5,0.004413873,50355111.3,20.91325672
EOH1664_merged_30min.parquet,1C1R1P1S,2021-2022,09/12/2021 00:00,27/02/2022 23:30,08/12/2021 00:00,03/02/2022 23:30,"2021-12-09,2021-12-28,2022-01-01,2022-01-17,2022-01-22,2022-02-04,2022-02-15,2022-02-16,2022-02-21,2022-02-27","2021-12-08,2021-12-12,2022-01-05,2022-01-21,2022-02-03",0.443095073,0.770232305,0.606663689,10,5,0.008285959,25625162.13,4.248223988
EOH1666_merged_30min.parquet,1C1R1P1S,2021-2022,05/12/2021 00:00,20/02/2022 23:30,13/01/2022 00:00,06/02/2022 23:30,"2021-12-05,2021-12-06,2021-12-10,2021-12-18,2022-01-16,2022-01-20,2022-02-01,2022-02-07,2022-02-11,2022-02-20","2022-01-13,2022-01-15,2022-01-31,2022-02-03,2022-02-06",0.60985466,0.665972525,0.637913592,10,5,0.003847348,72502954.64,19.96286762
EOH1671_merged_30min.parquet,1C1R1P1S,2021-2022,11/12/2021 00:00,25/02/2022 23:30,25/12/2021 00:00,26/02/2022 23:30,"2021-12-11,2021-12-27,2021-12-31,2022-01-21,2022-02-07,2022-02-12,2022-02-15,2022-02-16,2022-02-21,2022-02-25","2021-12-25,2022-01-08,2022-01-19,2022-02-18,2022-02-26",0.627327091,0.805172089,0.71624959,10,5,0.016966547,9447074.53,3.017515339
EOH1675_merged_30min.parquet,1C1R1P1S,2021-2022,01/12/2021 00:00,09/12/2021 23:30,04/12/2021 00:00,04/12/2021 23:30,"2021-12-01,2021-12-02,2021-12-03,2021-12-05,2021-12-06,2021-12-07,2021-12-08,2021-12-09",04/12/2021,0.6339896,0.672582612,0.653286106,8,1,0.000700644,51396847.08,30
EOH1684_merged_30min.parquet,1C1R1P1S,2021-2022,20/12/2021 00:00,13/02/2022 23:30,03/12/2021 00:00,24/01/2022 23:30,"2021-12-20,2021-12-26,2021-12-28,2022-01-08,2022-01-14,2022-01-15,2022-01-29,2022-01-30,2022-01-31,2022-02-13","2021-12-03,2021-12-19,2021-12-31,2022-01-20,2022-01-24",0.38988997,0.415133008,0.402511489,10,5,0.010622761,45526291.87,10.90182696
EOH1685_merged_30min.parquet,1C1R1P1S,2021-2022,17/12/2021 00:00,26/02/2022 23:30,29/12/2021 00:00,28/02/2022 23:30,"2021-12-17,2021-12-21,2021-12-25,2022-01-04,2022-01-08,2022-01-26,2022-02-09,2022-02-10,2022-02-23,2022-02-26","2021-12-29,2022-01-28,2022-02-07,2022-02-18,2022-02-28",0.22529826,0.212233079,0.218765669,10,5,0.006270603,151308402.3,3.596535464
