Property_ID,Delivery_Contractor,Postcode_1,Participant_Age,EmployStatus,EmployType,HouseIncome,Date_Contact,Tenure,Tenure_Length,Social_Group,HP_Awareness,Reason_Sustainability,Sustainability_exp,Reason_Future,Future_exp,Reason_Upgrade,Upgrade_exp,Reason_Building,Building_exp,Reason_Financial,Financial_exp,Reason_Technology,Technology_exp,Reason_Research,Research_exp,Reason_Planned,Planned_exp,Reason_Replacement,Replacement_exp,Reason_Other,Other_exp,Date_Survey,Name_Survey,House_Type,House_Form,House_Env,House_Age,House_SAP,No_Adults,No_Child,No_Storeys,Total_Floor_Area,Habitable_Rooms,Bedrooms,Heated_rooms,Floor_Height,Wall_Type,Floor_Type,Roof_Type,Glazed_Type,Mains_Gas_Flag,Main_Fuel,Heat_Primary_Source,Heat_Secondary_Source,TS_Existing,TS_Existing_Size,No_Underfloor,Existing_Fires,Existing_Cooking,Outside_Space,Outside_Access,Elec_currentuse,Gas_currentuse,MCS_SHLoad,MCS_Hloss,MCS_SHAnnual,MCS_DHWAnnual,MCS_Immersion,MCS_Flow_Temp,MCS_SCOP,Suit_ASHP,Suit_GSHP,Suit_HTASHP,Suit_Hybrid,HP_Recommend,HP_NoRec_R1,HP_NoRec_R2,Measures_Recommend,EstCost_System,EstCost_Ancillary,EstCost_Running,EstCost_Etariff,EstCost_Gtariff,Part_Install_Decision,Part_No_Reason1,Part_No_Reason2,Date_Installation,Name_Install,HP_Installed,HP_Installed_Detail,HP_Brand,HP_Model,HP_Size_kW,HP_Refrigerant,GSHP_Space,TS_Type,TS_Water_Size,TS_PCM_Size,HP_Control_Zones,Measures_emitters_LT,Measures_emitters_Std,Measures_Fanassist,HP_Aesthetic,HP_Noise,Cooling,Cooling_Rooms,Fires_replaced,Cook_Replaced,Gas_disconnect,Measures_Loft,Measures_Windows,Measures_Doors,Measures_WI,Measures_DP,Cost_HP,Cost_TS,Cost_Install,Cost_Emitters,Cost_Cooling,Cost_LI,Cost_WI,Cost_Window,Cost_Door,Cost_DP,Install_time_HP,Install_time_measures,Comment,model,winter_season,train_start,train_end,val_start,val_end,train_days,test_days,rmse_train,rmse_val,rmse_average,train_day_count,test_day_count,R1,C1,g,No_occupants
EOH0014,E.ON,NE6,63,Working Full time (>30hrs),Skilled Manual Worker,"30,001 - 40,000",2021-04-08T00:00:00.000Z,Owner-Occupied,0.9,C2,2,YES,,NO,,YES,,NO,,NO,,YES,,NO,,NO,,NO,,NO,,12/04/2021,Phoenix,House,Semi-Detached,Urban,1950 - 1966,D,1,0,1,85,4,2,7,2.6,Cavity_Insulated,Suspended,Pitched,Double,Yes,Gas,Gas Boiler - Combi,Fire - Gas,,,0,1,1,No,No,1976,14600,5.637,66.32,11297.8,2674,0,49,3.03,No,No,No,Yes,Hybrid,,,Loft insulation,10232.46,500,637,14.3,3.8,Yes,,,22/06/2021,Phoenix,Hybrid,Separate_New Boiler,Daikin,EHY2KOMB32AA,4,R32,,,,,1,7,0,0,none,none,No,0,0,0,No,Yes,0,0,,no,5912.2,,,2685,0,500,0,0,0,0,3,0.5,,1C1R1P1S,2021-2022,23/12/2021 00:00,19/02/2022 23:30,25/12/2021 00:00,28/02/2022 23:30,"2021-12-23,2021-12-24,2021-12-29,2022-01-01,2022-01-18,2022-01-21,2022-01-24,2022-02-09,2022-02-12,2022-02-19","2021-12-25,2022-01-17,2022-01-20,2022-02-07,2022-02-28",0.7093579043939614,0.9358076731021958,0.8225827887480786,10,5,0.006439442,18186501.93069228,0.249881313,1
EOH0026,E.ON,NE3,49,Working Full time (>30hrs),Professional,"40,001 - 50,000",2021-03-17T00:00:00.000Z,Owner-Occupied,0.9,C1,2,YES,,NO,,NO,,NO,,YES,Government grant / free,YES,,NO,,NO,,NO,,NO,,17/03/2021,Phoenix,House,Detached,Urban,1983 - 1990,C,1,1,2,87,4,3,9,2.3,Cavity_Insulated,Suspended,Pitched,Double,Yes,Gas,Gas Boiler - Standard,Fire - Electric,Water,110,0,0,0,No,No,,,5.49,63.09,10989.3,4122,607,53,3.22,Yes with additional measures,No,Yes,No,ASHP,,,Loft Insulation,12232.98,500,807,14.3,3.8,Yes,,,07/05/2021,Aaron Services,ASHP,,Daikin,EDLQ07CAV8,7,R410A,,Water_new,200,,1,9,0,0,none,none,No,0,0,0,No,Yes,0,0,,no,5648.01,1752,,3055.06,0,500,0,0,0,0,4,0.5,,1C1R1P1S,2021-2022,13/12/2021 00:00,24/02/2022 23:30,20/12/2021 00:00,26/02/2022 23:30,"2021-12-13,2021-12-18,2021-12-21,2021-12-24,2021-12-30,2022-01-22,2022-02-05,2022-02-18,2022-02-23,2022-02-24","2021-12-20,2021-12-22,2021-12-23,2022-01-12,2022-02-26",0.4009088379748266,0.3222057712095647,0.3615573045921956,10,5,0.00507101,47646063.00480843,1.0021775626582872e-06,2
EOH0027,E.ON,NE5,26,Working Full time (>30hrs),Professional,"40,001 - 50,000",2021-07-01T00:00:00.000Z,Owner-Occupied,0.9,C1,2,NO,,NO,,YES,broken boiler,NO,,NO,,YES,,NO,,NO,,NO,,NO,,30/06/2021,Energist,House,Semi-Detached,Urban,1930 - 1949,D,2,0,2,90,4,2,7,2.5,Cavity_Insulated,Solid,Pitched,Double,Yes,Gas,Gas Boiler - Combi,,,,0,0,1,No,No,,,5.709,63.43,16576,2098,0,45,3.77,Yes,No,Yes,Yes,ASHP,,,None Required,12817.07,,793,12.9,3.4,Yes,,,23/07/2021,Energist,HT_ASHP,,Vaillant,VWL 55/6 A 230V S2,5,R290,,Water_new,150,,1,7,0,0,none,none,No,0,0,0,No,No,0,0,,no,5335,1701.71,,2315,0,0,0,0,0,0,3,0,,1C1R1P1S,2021-2022,02/12/2021 00:00,27/02/2022 23:30,13/12/2021 00:00,22/02/2022 23:30,"2021-12-02,2021-12-19,2021-12-20,2021-12-25,2021-12-31,2022-01-20,2022-02-05,2022-02-13,2022-02-23,2022-02-27","2021-12-13,2022-01-03,2022-02-12,2022-02-20,2022-02-22",0.6221747621853557,0.793277054,0.7077259078685878,10,5,0.006010373,41120466.07,1.000011903023971e-06,2
EOH0063,E.ON,NE13,31,Unemployed,Unemployed/Benefits,"0 - 12,500",2020-11-23T00:00:00.000Z,Owner-Occupied,1,DE,1,YES,,NO,,YES,,NO,,NO,,NO,,NO,,NO,,NO,,NO,,07/12/2020,Phoenix,House,Semi-Detached,Urban,1967 - 1975,E,1,0,1,58,3,2,5,2.3,Cavity_Insulated,Suspended,Pitched,Double,Yes,Gas,Gas Boiler - Combi,Fire - Gas,,,0,1,1,No,No,,,4.654,80.24,11272,2019,109,46,3.52,Yes,No,Yes,Yes,ASHP,,,None Required,12199,,554,14.3,3.8,Yes,,,25/03/2021,Aaron Services,ASHP,,Daikin,EDLQ07CAV3,7,R410A,,Water_new,150,,1,6,0,1,none,none,No,0,0,0,No,No,0,0,,no,5648,1701,,3071,0,0,0,0,0,0,3,0,,1C1R1P1S,2021-2022,17/12/2021 00:00,20/02/2022 23:30,07/12/2021 00:00,22/02/2022 23:30,"2021-12-17,2021-12-22,2021-12-23,2021-12-24,2022-01-06,2022-01-09,2022-01-14,2022-01-19,2022-01-23,2022-02-20","2021-12-07,2021-12-11,2022-01-28,2022-02-06,2022-02-22",0.6191971800020801,0.6935985482904815,0.6563978641462809,10,5,0.009769971,33475641.67061139,1.0041739498291418e-06,1
EOH0069,E.ON,NE3,40,Working Full time (>30hrs),Manager,"50,001+",2021-01-28T00:00:00.000Z,Owner-Occupied,10,C1,3,NO,,,,NO,,NO,,YES,,YES,,NO,,NO,,NO,,NO,,11/02/2021,Phoenix,House,Semi-Detached,Urban,1967 - 1975,D,2,2,2,99,4,3,7,2.4,Cavity_No_insulation,Solid,Pitched,Double,Yes,Gas,Gas Boiler - Combi,Fire - Gas,,,0,1,1,No,No,4934,14901,6.648,71.31,13322.1,3566,0,55,2.96,No,No,No,Yes with additional measures,Hybrid,,,loft Insulation cavity insulation,10430.83,1200,651,14.3,3.8,Yes,,,26/03/2021,Phoenix,Hybrid,Separate_New Boiler,Daikin,EHY2KOMB28AA,4,R32,,,,,1,11,0,0,none,none,No,0,0,0,No,Yes,0,0,Cavity,no,5739.82,,,3424,0,500,1000,0,0,0,3.5,2,,1C1R1P1S,2021-2022,05/12/2021 00:00,25/02/2022 23:30,13/12/2021 00:00,27/02/2022 23:30,"2021-12-05,2022-01-06,2022-01-25,2022-01-29,2022-02-05,2022-02-19,2022-02-20,2022-02-21,2022-02-22,2022-02-25","2021-12-13,2021-12-28,2022-01-18,2022-02-04,2022-02-27",0.4916788934681817,0.3552231713981416,0.4234510324331617,10,5,0.004919877,100691010.9,1.1989577171652064,4
EOH0075,E.ON,NE6,,Working Full time (>30hrs),Clerical,"40,001 - 50,000",2021-02-03T00:00:00.000Z,Owner-Occupied,20,C1,1,NO,,NO,,YES,,NO,,NO,,NO,,NO,,NO,,NO,,NO,,16/02/2021,Phoenix,House,Mid-Terrace,Urban,1930 - 1949,,2,1,2,72,3,2,7,2.5,Cavity_Insulated,Suspended,Pitched,Double,Yes,Gas,Gas Boiler - Standard,,Water,110,0,0,1,No,No,,,4.83,67.08,9678.3,2865,0,,,No,No,No,Yes,Hybrid,,,None Required,9875.86,,645,14.3,3.8,Yes,,,22/04/2021,Phoenix,Hybrid,Separate_New Boiler,Daikin,EHY2KOMB28AA,4,R32,,,,,1,8,0,0,none,none,No,0,0,0,No,No,0,0,,no,5739.82,,,2500.9,0,0,0,0,0,0,2.5,0,,1C1R1P1S,2021-2022,01/12/2021 00:00,24/02/2022 23:30,27/12/2021 00:00,29/01/2022 23:30,"2021-12-01,2021-12-05,2021-12-06,2021-12-15,2022-01-03,2022-01-09,2022-01-11,2022-02-08,2022-02-21,2022-02-24","2021-12-27,2021-12-29,2022-01-04,2022-01-06,2022-01-29",0.448804932,0.5853544212394906,0.5170796767510057,10,5,0.010004092,24035870.17020053,1.0001001299660414e-06,3
EOH0126,E.ON,NE27,50,Working Full time (>30hrs),Manager,"50,001+",2021-02-19T00:00:00.000Z,Owner-Occupied,20,AB,2,NO,,NO,,NO,,NO,,YES,potential for bill savings,YES,,NO,,NO,,NO,,NO,,24/02/2021,Phoenix,House,Detached,Urban,1996 - 2002,,2,1,2,90,5,3,12,2.2,Cavity_Insulated,Suspended,Pitched,Double,Yes,Gas,Gas Boiler - Standard,,Water,110,0,0,0,No,No,,,5.05,56.12,10121.7,4122,607,45,3.57,Yes,No,Yes,No,ASHP,,,None Required,12788.71,,710,14,4,Yes,,,27/04/2021,Aaron Services,ASHP,,Daikin,EDLQ07CAV9,7,R410A,,Water_new,200,,1,14,0,0,none,none,No,0,0,0,No,Yes,0,0,,no,5648.01,1752.34,,3610.8,0,0,0,0,0,0,3,0,,1C1R1P1S,2021-2022,08/12/2021 00:00,09/02/2022 23:30,02/12/2021 00:00,05/02/2022 23:30,"2021-12-08,2021-12-27,2022-01-02,2022-01-06,2022-01-11,2022-01-12,2022-01-23,2022-01-24,2022-01-29,2022-02-09","2021-12-02,2021-12-06,2022-01-15,2022-01-22,2022-02-05",0.6825856468366304,0.6047462296335536,0.643665938,10,5,0.006663244,20650169.81163496,6.776990288555568,3
EOH0185,E.ON,NE6,57,Working Full time (>30hrs),Professional,"25,001 - 30,000",2020-11-04T00:00:00.000Z,Owner-Occupied,6,C1,2,YES,,NO,,NO,,,,NO,,YES,,NO,,NO,,NO,,NO,,18/11/2020,Phoenix,House,End-Terrace,Urban,1967 - 1975,,2,0,2,80,5,3,8,2.3,Cavity_No_insulation,Solid,Pitched,Double,Yes,Gas,Gas Boiler - Combi,,,,0,0,1,No,No,2808,,6.487,88.52,12994,3566,0,55,2.96,No,No,No,Yes with additional measures,Hybrid,,,Wall insulation,10233.23,500,646,14.3,3.8,Yes,,,26/01/2021,Phoenix,Hybrid,Separate_New Boiler,Daikin,EHY2KOMB28AA,4,R32,,,,,1,9,0,0,none,none,No,0,0,0,No,No,0,0,,no,5912.2,,,2685.85,0,0,0,0,0,0,2,0,,1C1R1P1S,2021-2022,02/12/2021 00:00,20/02/2022 23:30,17/01/2022 00:00,22/02/2022 23:30,"2021-12-02,2021-12-03,2021-12-07,2022-01-03,2022-01-08,2022-01-27,2022-01-31,2022-02-11,2022-02-13,2022-02-20","2022-01-17,2022-01-28,2022-01-30,2022-02-15,2022-02-22",0.5352572124826019,0.4416041991783125,0.4884307058304572,10,5,0.008402999,27205725.61055793,1.0010798170641676e-06,2
EOH0201,E.ON,NE5,36,Unemployed,Unemployed/Benefits,"0 - 12,500",2021-01-11T00:00:00.000Z,Owner-Occupied,5,DE,2,YES,,NO,,YES,,NO,,NO,,NO,,NO,,NO,,NO,,NO,,27/01/2021,Phoenix,House,Semi-Detached,Urban,1950 - 1966,D,1,0,2,74,4,3,8,2.6,Cavity_Insulated,Suspended,Pitched,Double,Yes,Gas,Gas Boiler - Combi,,,,0,0,1,No,No,,,6.14,82.97,14871.7,3311,0,55,2.96,No,No,No,Yes,Hybrid,,,None Required,9875.86,,707,14.3,3.8,Yes,,,10/03/2021,Phoenix,Hybrid,Separate_New Boiler,Daikin,EHY2KOMB28AA,4,R32,,,,,1,8,0,0,none,none,No,0,0,0,No,No,0,0,,no,5739.82,,,2500.86,0,0,0,0,0,0,3,0,,1C1R1P1S,2021-2022,18/12/2021 00:00,27/02/2022 23:30,02/12/2021 00:00,26/02/2022 23:30,"2021-12-18,2021-12-19,2022-01-08,2022-01-13,2022-01-23,2022-01-26,2022-01-30,2022-02-09,2022-02-10,2022-02-27","2021-12-02,2021-12-10,2021-12-17,2022-01-17,2022-02-26",0.9470887487516464,0.743261532,0.8451751401500982,10,5,0.007404831,17798594.142502557,3.5426866978316816,1
EOH0204,E.ON,NE3,41,Working Full time (>30hrs),Skilled Manual Worker,"16,201 - 20,000",2020-12-08T00:00:00.000Z,Owner-Occupied,9,C2,3,YES,,NO,,NO,,NO,,YES,bill savings,YES,has solar panels too,NO,,NO,,NO,,NO,,15/03/2021,Phoenix,House,Semi-Detached,Urban,1967 - 1975,B,2,3,2,109,8,4,12,2.4,Cavity_Insulated,Suspended,Pitched,Double,Yes,Gas,Gas Boiler - Combi,,,,0,0,1,No,No,,,9.66,88.62,29510.7,3566,0,55,2.96,No,No,No,Yes,Hybrid,,,None Required,13342.14,,1692,14.3,3.8,Yes,,,15/06/2021,Phoenix,Hybrid,Separate_New Boiler,Daikin,EHY2KOMB28AA,4,R32,,,,,1,13,0,0,none,none,No,0,0,0,No,No,0,0,,no,5739.82,,,4164.23,0,0,0,0,0,0,2,0,,1C1R1P1S,2021-2022,23/12/2021 00:00,24/02/2022 23:30,12/01/2022 00:00,26/01/2022 23:30,"2021-12-23,2021-12-25,2021-12-26,2022-01-01,2022-01-11,2022-01-13,2022-01-17,2022-01-31,2022-02-17,2022-02-24","2022-01-12,2022-01-15,2022-01-16,2022-01-20,2022-01-26",0.5406247937753064,0.8448452526739013,0.6927350232246039,10,5,0.004912303,46237590.11008706,11.652490241576867,5
EOH0226,E.ON,NE5,25,Working Part time,Skilled Manual Worker,"30,001 - 40,000",2021-01-06T00:00:00.000Z,Owner-Occupied,4,C2,1,NO,,NO,,YES,,NO,,YES,,YES,,NO,,NO,,NO,,NO,,21/01/2021,Phoenix,House,Semi-Detached,Urban,1967 - 1975,D,2,1,2,90,5,3,7,2.4,Cavity_Insulated,Suspended,Pitched,Double,Yes,Gas,Gas Boiler - Combi,Fire - Wood,,,0,0,0,No,No,,,6.375,89.61,12811.5,4475,655,48,3.44,Yes,No,Yes,Yes,ASHP,,,None Required,12602.18,,853,14.3,3.8,Yes,,,14/04/2021,Aaron Services,ASHP,,Daikin,EDLQ07CAV7,7,R410A,,Water_new,200,,1,8,0,0,none,none,No,0,0,0,No,No,0,0,,no,5648,1752,,2870,0,0,0,0,0,0,3,0,,1C1R1P1S,2021-2022,09/12/2021 00:00,26/02/2022 23:30,06/12/2021 00:00,12/02/2022 23:30,"2021-12-09,2021-12-15,2021-12-27,2022-01-28,2022-01-29,2022-02-04,2022-02-14,2022-02-15,2022-02-21,2022-02-26","2021-12-06,2022-01-13,2022-01-19,2022-02-11,2022-02-12",0.912373042,0.6559635120049646,0.7841682770578717,10,5,0.006788365,35985950.76324489,3.415279530230162,3
EOH0244,E.ON,NE3,45,Working Full time (>30hrs),Skilled Manual Worker,"50,001+",2021-02-22T00:00:00.000Z,Owner-Occupied,10,C2,2,YES,,NO,,NO,,NO,,YES,Government grant / free,YES,,NO,,NO,,NO,,NO,,01/03/2021,Phoenix,House,Semi-Detached,Urban,1967 - 1975,C,2,2,2,80,5,3,8,2.3,Cavity_Insulated,Solid,Pitched,Double,Yes,Gas,Gas Boiler - Combi,,,,0,0,1,No,No,,,3.93,71.6,9535.3,3820,0,54,2.97,No,No,No,Yes,Hybrid,,,None Required,9690.87,,351,14.3,3.8,Yes,,,30/08/2021,Phoenix,Hybrid,Separate_New Boiler,Daikin,EJHA04AAV3,4,R32,,,,,1,7,0,0,,,No,0,1,0,No,No,0,0,,no,5739.82,,,2315.87,,0,0,0,0,0,2,,,1C1R1P1S,2021-2022,02/12/2021 00:00,26/02/2022 23:30,24/12/2021 00:00,19/02/2022 23:30,"2021-12-02,2021-12-10,2021-12-12,2021-12-22,2021-12-28,2022-01-10,2022-01-19,2022-01-26,2022-02-14,2022-02-26","2021-12-24,2021-12-30,2022-01-16,2022-01-17,2022-02-19",0.4398520362458498,0.6609740846318045,0.5504130604388271,10,5,0.004970394,46212493.250532046,1.0491066118562815,4
EOH0245,E.ON,NE5,38,Working Full time (>30hrs),Professional,"50,001+",2021-05-19T00:00:00.000Z,Owner-Occupied,48,DE,5,YES,,NO,,NO,,NO,,NO,,YES,,NO,,NO,,NO,,NO,,27/05/2021,Phoenix,House,Detached,Urban,1967 - 1975,D,2,0,2,86,5,3,9,2.3,Cavity_Insulated,Suspended,Pitched,Double,Yes,Gas,Gas Boiler - Combi,,,,0,0,0,No,No,,,5.416,62.25,4431.1,2636,0,,,No,No,No,Yes,Hybrid,,,Barrier,9875.86,300,282,14.3,3.8,Yes,,,30/06/2021,Phoenix,Hybrid,Separate_New Boiler,Daikin,EHY2KOMB32AA,4,R32,,,,,1,9,0,0,none,none,No,0,0,0,No,No,0,0,,no,5912.2,,,2685,0,0,0,0,0,0,2,0,,1C1R1P1S,2021-2022,19/12/2021 00:00,17/02/2022 23:30,01/01/2022 00:00,28/02/2022 23:30,"2021-12-19,2021-12-24,2021-12-28,2021-12-31,2022-01-07,2022-01-21,2022-01-27,2022-02-11,2022-02-14,2022-02-17","2022-01-01,2022-01-25,2022-02-05,2022-02-16,2022-02-28",0.4172437138378154,0.567826021,0.4925348675070051,10,5,0.007385775,21826327.196307626,5.227947736,2
EOH0276,E.ON,NE4,59,Working Full time (>30hrs),Skilled Manual Worker,"40,001 - 50,000",2021-01-22T00:00:00.000Z,Owner-Occupied,25,C2,1,YES,,NO,,NO,,NO,,NO,,YES,,NO,,NO,,NO,,NO,,12/02/2021,Phoenix,House,End-Terrace,Urban,1950 - 1966,,3,0,2,85,5,3,8,2.3,Cavity_Insulated,Solid,Pitched,Double,Yes,Gas,Gas Boiler - Combi,,,,0,0,0,No,No,,,5.25,61.72,10554,4062,598,53,3.22,Yes with additional measures,No,Yes,No,ASHP,,,Loft Insulation,12602.18,500,771,14,4,Yes,,,23/04/2021,Aaron Services,ASHP,,Daikin,EDLQ07CAV7,7,R410A,,Water_new,200,,1,9,0,0,none,none,No,0,0,0,No,Yes,0,0,,no,5648,1752,,3053,0,500,0,0,0,0,3,0.5,,1C1R1P1S,2021-2022,14/12/2021 00:00,27/02/2022 23:30,01/12/2021 00:00,20/02/2022 23:30,"2021-12-14,2021-12-30,2022-01-01,2022-01-10,2022-01-13,2022-01-17,2022-01-25,2022-02-05,2022-02-16,2022-02-27","2021-12-01,2021-12-18,2022-01-03,2022-02-19,2022-02-20",0.5253566371290939,0.8446478043296508,0.6850022207293723,10,5,0.00703339,39443740.19648615,3.1413623808895834,3
EOH0295,E.ON,NE3,68,Retired,Pensioner,"20,001 - 25,000",2021-01-04T00:00:00.000Z,Owner-Occupied,12,DE,2,YES,,NO,,NO,,NO,,NO,,YES,,NO,,NO,,NO,,NO,,21/01/2021,Phoenix,House,Semi-Detached,Urban,1967 - 1975,,2,0,2,76,4,2,5,2.3,Cavity_Insulated,Solid,Pitched,Double,Yes,Gas,Gas Boiler - Combi,,,,0,0,1,No,No,2200,11000,6.717,88.38,16278.2,1732,0,,,No,No,No,Yes,Hybrid,,,None Required,10429.29,,1043,14.3,3.8,Yes,,,03/06/2021,Phoenix,Hybrid,Separate_New Boiler,Daikin,EHY2KOMB28AA,4,R32,,,,,1,7,0,0,none,none,No,0,0,1,No,No,0,0,,no,5739.82,,,3035.29,0,0,0,0,0,0,2,0,,1C1R1P1S,2021-2022,05/12/2021 00:00,27/02/2022 23:30,27/12/2021 00:00,10/02/2022 23:30,"2021-12-05,2021-12-09,2021-12-10,2021-12-12,2021-12-18,2022-01-19,2022-02-06,2022-02-09,2022-02-16,2022-02-27","2021-12-27,2022-01-15,2022-02-04,2022-02-07,2022-02-10",0.8705135389237204,0.7671423449338086,0.8188279419287645,10,5,0.010156682,13039035.064543366,4.961109817036505,2
EOH0311,E.ON,NE5,,Working Full time (>30hrs),Skilled Manual Worker,"50,001+",2020-11-18T00:00:00.000Z,Owner-Occupied,14,C2,5,YES,,NO,,YES,,NO,,NO,,YES,,NO,,NO,,NO,,NO,,09/12/2020,Phoenix,House,Semi-Detached,Urban,1950 - 1966,,2,1,2,120,5,3,6,2.4,Cavity_Insulated,Suspended,Pitched,Double,Yes,Gas,Gas Boiler - Combi,Fire - Gas,,,0,1,1,No,No,,,7.274,78.09,17518,4002,181,45,3.42,Yes,No,Yes,Yes,ASHP,,,None Required,13134.93,,932,14.3,3.8,Yes,,,04/06/2021,Aaron services,ASHP,,Daikin,EDLQ011CAV3,11,R410A,,Water_new,250,,1,12,0,0,none,none,No,0,0,0,No,No,0,0,,no,6364.21,1752,,3240.82,0,0,0,0,0,0,4,0,,1C1R1P1S,2021-2022,04/12/2021 00:00,17/02/2022 23:30,03/12/2021 00:00,23/02/2022 23:30,"2021-12-04,2021-12-08,2021-12-09,2021-12-13,2021-12-23,2021-12-30,2022-01-09,2022-01-16,2022-02-14,2022-02-17","2021-12-03,2022-01-19,2022-02-05,2022-02-12,2022-02-23",0.4647458064048373,0.8040241775837619,0.6343849919942997,10,5,0.004907054,24218450.45538129,1.0005968192193095e-06,3
EOH0315,E.ON,NE5,29,Unemployed,Unemployed/Benefits,Prefer not to say,2021-05-21T00:00:00.000Z,Owner-Occupied,2,DE,3,NO,,NO,,YES,,NO,,YES,Potential for bill savings,NO,,NO,,NO,,NO,,NO,,28/05/2021,Phoenix,House,Mid-Terrace,Urban,1950 - 1966,D,1,1,2,99,4,3,6,2.3,Cavity_Insulated,Solid,Pitched,Double,No,Electricity,Electric - Storage,,Water,110,0,0,0,No,No,,,4.29,43.33,9662.8,4002,181,50,3.4,Yes,No,Yes,Yes,ASHP,,,"Loft insulation, Barrier",10996.03,800,607,14.3,3.8,Yes,,,18/06/2021,Aaron services,ASHP,,Daikin,EDLQ05CAV3,5,R410A,,Water_new,250,,1,8,0,0,none,barrier,No,0,0,0,No,Yes,0,0,,no,5335.24,1752,,2501,0,500,0,0,0,0,3,0.5,,1C1R1P1S,2021-2022,10/12/2021 00:00,16/02/2022 23:30,17/12/2021 00:00,06/02/2022 23:30,"2021-12-10,2021-12-20,2021-12-25,2021-12-26,2022-01-09,2022-01-16,2022-01-29,2022-01-30,2022-02-09,2022-02-16","2021-12-17,2021-12-21,2022-01-03,2022-01-23,2022-02-06",0.6005128884198863,0.5917697064104771,0.5961412974151816,10,5,0.010707888,17917374.467504706,1.0609063787725233,2
EOH0335,E.ON,NE6,48,Working Full time (>30hrs),Professional,"25,001 - 30,000",2021-06-30T00:00:00.000Z,Owner-Occupied,12,C1,3,YES,,NO,,YES,,NO,,NO,,YES,,NO,,NO,,NO,,NO,,23/07/2021,Energist,House,Semi-Detached,Urban,1950 - 1966,E,2,0,1,73,5,3,7,2.4,Cavity_Insulated,Solid,Pitched,Double,Yes,Gas,Gas Boiler - Standard,,Water,150,0,0,1,No,No,,,5.03,60.5,14614,3566,0,45,3.77,Yes,No,Yes,Yes,ASHP,,,None Required,13147.7,,783,12.5,3.5,Yes,,,30/07/2021,Energist,HT_ASHP,,Vaillant,VWL 55/6 A 230V S2,5,R290,,Water_new,200,,1,5,0,0,none,none,No,0,0,0,No,No,0,0,,no,5335,1752.34,,1945,0,0,0,0,0,0,2,0,,1C1R1P1S,2021-2022,07/12/2021 00:00,25/02/2022 23:30,05/12/2021 00:00,24/02/2022 23:30,"2021-12-07,2021-12-14,2021-12-30,2022-01-05,2022-01-06,2022-01-19,2022-01-27,2022-02-18,2022-02-21,2022-02-25","2021-12-05,2021-12-16,2021-12-26,2022-02-09,2022-02-24",0.593863664,0.8879863123726051,0.740924988,10,5,0.005257232,79664541.80345312,10.519022665451748,2
EOH0358,E.ON,NE15,55,Working Full time (>30hrs),Skilled Manual Worker,Prefer not to say,2020-12-08T00:00:00.000Z,Owner-Occupied,23,C2,5,YES,,NO,,NO,,NO,,NO,,YES,already looking into heat pumps,NO,,NO,,NO,,NO,,10/02/2021,Phoenix,House,Semi-Detached,Urban,1967 - 1975,,2,2,2,135,6,2,12,2.5,Cavity_Insulated,Solid,Pitched,Double,Yes,Gas,Gas Boiler - Combi,,,,0,0,0,No,No,,,7.49,65.16,15052.7,4152,637,50,3.2,Yes,No,Yes,Yes,ASHP,,,Loft Insulation and Barrier,11644.21,750,1039,14.3,3.8,Yes,,,13/09/2021,Phoenix,ASHP,,Daikin,EDLQ011CAV3,11,R410A,,Water_new,300,,1,6,0,0,,,No,0,0,0,Yes,Yes,0,0,,no,6364.21,1752.34,,2500.09,,500,0,0,0,0,2,,,1C1R1P1S,2021-2022,01/12/2021 00:00,27/02/2022 23:30,02/01/2022 00:00,26/02/2022 23:30,"2021-12-01,2021-12-03,2021-12-05,2022-01-01,2022-01-07,2022-01-08,2022-01-24,2022-02-13,2022-02-22,2022-02-27","2022-01-02,2022-02-04,2022-02-14,2022-02-20,2022-02-26",0.5035542789389243,0.3567791504936057,0.430166715,10,5,0.008349304,101579891.15713304,1.0000446380706704e-06,4
EOH0388,E.ON,NE3,47,Working Full time (>30hrs),Supervisor,"40,001 - 50,000",2020-12-04T00:00:00.000Z,Owner-Occupied,14,C1,5,YES,,NO,,NO,,NO,,YES,potential for bill savings,NO,,NO,,NO,,NO,,NO,,13/01/2021,Phoenix,House,Semi-Detached,Urban,1967 - 1975,E,4,1,2,83,5,3,8,2.4,Cavity_Insulated,Suspended,Pitched,Double,Yes,Gas,Gas Boiler - Combi,,,,0,0,0,No,No,,,6.359,76.61,15409.5,4994,0,60,3.22,No,No,Yes,No,HT_ASHP,,,None Required,17195.66,,939,14.3,3.8,Yes,,,21/06/2021,Phoenix,HT_ASHP,,Daikin,EPRA14DAV3,14,R32,,PCM_NEW,,9,1,8,0,0,none,none,No,0,0,0,No,No,0,0,,no,9047,3500.65,,2871,0,0,0,0,0,0,4,0,,1C1R1P1S,2021-2022,01/12/2021 00:00,16/02/2022 23:30,02/01/2022 00:00,25/02/2022 23:30,"2021-12-01,2022-01-11,2022-01-13,2022-01-14,2022-01-25,2022-01-31,2022-02-04,2022-02-08,2022-02-12,2022-02-16","2022-01-02,2022-01-22,2022-01-24,2022-02-15,2022-02-25",0.6596434349345247,0.9869585858704076,0.8233010104024662,10,5,0.007800751,89090725.47492751,1.0024285991886404e-06,5
EOH0450,E.ON,NE7,76,Retired,Pensioner,"16,201 - 20,000",2020-10-30T00:00:00.000Z,Owner-Occupied,25,DE,1,YES,,NO,,YES,,NO,,NO,,NO,,NO,,NO,,NO,,NO,,11/11/2020,Phoenix,House,Semi-Detached,Urban,1930 - 1949,,2,0,2,105,5,3,7,2.6,Cavity_Insulated,Suspended,Pitched,Double,Yes,Gas,Gas Boiler - Combi,Fire - Gas,,,0,1,1,No,No,2562,16582,7.092,67,17043,3566,0,55,2.96,Yes,No,Yes,Yes,Hybrid,,,None Required,10060.08,,787,14.3,3.8,Yes,,,20/01/2021,Phoenix,Hybrid,Separate_New Boiler,Daikin,EHY2KOMB28AA,4,R32,,,,,4,8,0,0,none,none,No,0,0,0,No,No,0,0,,no,5739.82,,,3239.28,0,0,0,0,0,0,2,,,1C1R1P1S,2020-2021,06/02/2021 00:00,25/02/2021 23:30,07/02/2021 00:00,28/02/2021 23:30,"2021-02-06,2021-02-08,2021-02-09,2021-02-10,2021-02-11,2021-02-16,2021-02-18,2021-02-20,2021-02-21,2021-02-25","2021-02-07,2021-02-13,2021-02-23,2021-02-27,2021-02-28",0.8201333933905061,0.904150651,0.8621420223964645,10,5,0.006479572,38316895.88,1.0034955216918148e-06,2
EOH0494,E.ON,NE3,53,Working Full time (>30hrs),Supervisor,"50,001+",2020-12-08T00:00:00.000Z,Owner-Occupied,19,C1,5,YES,,NO,,NO,,NO,,NO,,YES,,NO,,NO,,NO,,NO,,23/12/2020,Phoenix,House,Semi-Detached,Urban,1967 - 1975,,2,2,2,80,5,3,7,2.3,Cavity_Insulated,Solid,Pitched,Double,Yes,Gas,Gas Boiler - Combi,,,,0,0,0,No,No,5936,9369,4.7,58.71,11376.1,4122,607,45,3.57,Yes with additional measures,No,Yes,No,ASHP,,,Loft Insulation,12047.98,500,760,14,4,Yes,,,27/04/2021,Aaron Services,ASHP,,Daikin,EDLQ07CAV8,7,R410A,,Water_new,200,,1,8,0,0,none,none,No,0,0,0,No,Yes,0,0,,no,5648.01,1752,,2870.07,0,500,0,0,0,0,3,0,,1C1R1P1S,2021-2022,03/12/2021 00:00,28/02/2022 23:30,25/12/2021 00:00,25/02/2022 23:30,"2021-12-03,2021-12-20,2022-01-10,2022-01-15,2022-01-28,2022-01-30,2022-02-10,2022-02-11,2022-02-23,2022-02-28","2021-12-25,2022-01-21,2022-02-17,2022-02-19,2022-02-25",0.6596013263323955,0.6810611039367296,0.6703312151345626,10,5,0.016267506,62675028.92636734,4.607384163578934,4
EOH0539,E.ON,NE34,,Working Full time (>30hrs),Professional,"50,001+",2021-05-24T00:00:00.000Z,Owner-Occupied,2,C1,5,YES,,NO,,NO,,NO,,NO,,YES,,NO,,NO,,NO,,NO,,28/05/2021,Phoenix,House,Detached,Urban,1983 - 1990,,2,0,1,64,4,2,9,2.3,Cavity_Insulated,Suspended,Pitched,Double,Yes,Gas,Gas Boiler - Combi,,,,0,1,1,No,No,,,5.15,74.63,14938,2972,0,45,3.77,Yes,No,Yes,Yes,ASHP,,,None Required,13675.03,,725.1,15,3.8,Yes,,,11/06/2021,Energist,HT_ASHP,,Vaillant,VWL 75/6 A 230V S2,7,R290,,Water_new,150,,1,7,0,0,none,none,No,0,0,0,No,No,0,0,,no,5889,1702,,2315,0,0,0,0,0,0,4,0,,1C1R1P1S,2021-2022,03/12/2021 00:00,07/02/2022 23:30,17/12/2021 00:00,18/02/2022 23:30,"2021-12-03,2021-12-09,2021-12-10,2021-12-18,2021-12-20,2021-12-26,2022-01-02,2022-01-05,2022-01-17,2022-02-07","2021-12-17,2021-12-23,2022-02-11,2022-02-12,2022-02-18",0.529581643,0.4896834478563296,0.5096325451999093,10,5,0.00803207,69272814.15347712,6.989622243373481,2
EOH0565,E.ON,NE5,57,Working Full time (>30hrs),Manager,"30,001 - 40,000",2020-11-09T00:00:00.000Z,Owner-Occupied,14,AB,3,YES,,NO,,NO,,NO,,YES,Potential for bill savings,NO,,NO,,NO,,NO,,NO,,25/11/2020,Phoenix,House,Semi-Detached,Urban,1930 - 1949,,1,0,2,87,5,3,7,2.4,Cavity_Insulated,Suspended,Pitched,Double,Yes,Gas,Gas Boiler - Combi,Fire - Electric,,,0,0,1,No,No,,,6.174,70.97,12414,3820,0,55,2.96,No,No,No,Yes with additional measures,Hybrid,,,Wall insulation,10430,1000,640,14.3,3.8,Yes,,,08/02/2021,Phoenix,Hybrid,Separate_New Boiler,Daikin,EHY2KOMB28AA,4,R32,,,,,1,9,0,0,none,none,No,0,0,0,No,No,0,0,Cavity,no,5739.82,,,3055.06,0,0,750,0,0,0,3,1,,1C1R1P1S,2021-2022,20/12/2021 00:00,21/02/2022 23:30,22/12/2021 00:00,10/02/2022 23:30,"2021-12-20,2022-01-01,2022-01-19,2022-01-21,2022-02-01,2022-02-09,2022-02-13,2022-02-14,2022-02-18,2022-02-21","2021-12-22,2022-01-02,2022-01-04,2022-01-12,2022-02-10",0.496166497,0.6879460821339406,0.5920562894652558,10,5,0.003992922,81609442.84,3.045903514613705,1
EOH0567,E.ON,NE7,42,Working Full time (>30hrs),Professional,"50,001+",2020-12-09T00:00:00.000Z,Owner-Occupied,10,AB,5,YES,,NO,,NO,,NO,,NO,,NO,,NO,,NO,,NO,,NO,,05/02/2021,Phoenix,House,Semi-Detached,Urban,1950 - 1966,D,2,3,2,91,5,3,8,2.4,Cavity_Insulated,Solid,Pitched,Double,Yes,Gas,Gas Boiler - Combi,,,,0,0,1,No,No,4000,10000,5.172,68,10353.1,4002,181,48,3.44,Yes,No,Yes,Yes,ASHP,,,None Required,12602.18,,630,14.3,3.8,Yes,,,21/04/2021,Aaron Services,ASHP,,Daikin,EDLQ07CAV7,7,R410A,,Water_new,250,,1,9,0,0,none,none,No,0,1,0,No,No,0,0,,no,5648,1752.34,,3424,0,0,0,0,0,0,3,0.5,,1C1R1P1S,2021-2022,08/12/2021 00:00,23/02/2022 23:30,03/12/2021 00:00,08/02/2022 23:30,"2021-12-08,2021-12-16,2022-01-03,2022-01-11,2022-01-31,2022-02-03,2022-02-04,2022-02-06,2022-02-19,2022-02-23","2021-12-03,2021-12-05,2021-12-21,2022-01-25,2022-02-08",0.2670435369885098,0.3211569130963904,0.2941002250424501,10,5,0.004946027,94753235.1,2.866226059913584,5
EOH0570,E.ON,NE3,32,Working Full time (>30hrs),Manager,"30,001 - 40,000",2021-01-18T00:00:00.000Z,Owner-Occupied,6,C1,4,YES,,NO,,NO,,NO,,NO,,NO,,NO,,NO,,NO,,NO,,03/02/2021,Phoenix,House,Semi-Detached,Urban,1967 - 1975,C,2,1,2,95,6,3,7,2.4,Cavity_Insulated,Solid,Pitched,Double,Yes,Gas,Gas Boiler - Combi,,,,0,0,0,No,No,4384,10910,6.046,76.4,14644.2,3820,0,,,No,No,No,Yes,Hybrid,,,Barrier,9690.87,300,733,14.3,3.8,Yes,,,18/03/2021,Phoenix,Hybrid,Separate_New Boiler,Daikin,EHY2KOMB28AA,4,R32,,,,,1,7,0,0,none,none,No,0,0,0,No,Yes,0,0,,no,5739.82,,,2315.87,0,500,0,0,0,0,4,0,,1C1R1P1S,2021-2022,19/12/2021 00:00,17/02/2022 23:30,03/12/2021 00:00,24/02/2022 23:30,"2021-12-19,2021-12-27,2022-01-05,2022-01-15,2022-01-17,2022-02-04,2022-02-08,2022-02-10,2022-02-13,2022-02-17","2021-12-03,2022-02-01,2022-02-12,2022-02-23,2022-02-24",0.6864511608973388,0.7547769817981713,0.7206140713477551,10,5,0.008926667,32169475.677869845,1.0001987725106831e-06,3
EOH0577,E.ON,NE5,65,Working Part time,Clerical,"12,501 - 16,200",2020-11-12T00:00:00.000Z,Owner-Occupied,31,C1,2,YES,,NO,,NO,,NO,,NO,,YES,has solar panels,NO,,NO,,NO,,NO,,02/12/2020,Phoenix,House,Semi-Detached,Urban,1950 - 1966,,1,0,2,90,5,3,8,2.4,Cavity_Insulated,Suspended,Pitched,Double,Yes,Gas,Gas Boiler - Standard,Fire - Electric,Water,110,0,0,0,No,No,,,6.203,83.82,15037,3820,0,55,2.96,No,No,No,Yes,Hybrid,,,sound barrier,10430.06,300,762,14.3,3.8,Yes,,,11/02/2021,Phoenix,Hybrid,Separate_New Boiler,Daikin,EHY2KOMB28AA,4,R32,,,,,1,8,0,0,none,enclosure,No,0,0,0,No,Yes,0,0,,no,5739.82,,,2870.07,0,500,0,0,0,0,2.5,0.5,,1C1R1P1S,2021-2022,02/12/2021 00:00,15/02/2022 23:30,18/12/2021 00:00,23/02/2022 23:30,"2021-12-02,2021-12-10,2021-12-14,2021-12-25,2021-12-27,2022-01-11,2022-01-21,2022-02-09,2022-02-11,2022-02-15","2021-12-18,2022-01-02,2022-02-14,2022-02-17,2022-02-23",0.5688112689160101,0.8052589589555927,0.6870351139358014,10,5,0.005811449,30885297.340018656,9.635982154329698,1
EOH0578,E.ON,NE3,43,Working Full time (>30hrs),Professional,"50,001+",2020-12-16T00:00:00.000Z,Owner-Occupied,14,AB,2,YES,,NO,,NO,,NO,,NO,,NO,,NO,,NO,,NO,,NO,,15/01/2021,Phoenix,House,Semi-Detached,Urban,1930 - 1949,,2,2,2,124,8,5,11,2.4,Cavity_Insulated,Solid,Pitched,Double,Yes,Gas,Gas Boiler - Combi,,,,0,0,0,No,No,,,6.77,67.4,7798.1,5774.7,0,55,2.96,No,No,No,Yes,Hybrid,,,Loft Insulation,9918.22,500,967,14.3,3.8,Yes,,,05/05/2021,Phoenix,Hybrid,Separate_New Boiler,Daikin,EHY2KOMB28AA,4,R32,,,,,1,10,0,0,none,none,No,0,0,0,No,Yes,0,0,,no,5912.2,,,2870.84,0,500,0,0,0,0,3,0.5,,1C1R1P1S,2021-2022,01/12/2021 00:00,16/02/2022 23:30,03/12/2021 00:00,10/02/2022 23:30,"2021-12-01,2021-12-10,2021-12-15,2021-12-29,2022-01-05,2022-01-06,2022-01-07,2022-01-29,2022-02-08,2022-02-16","2021-12-03,2021-12-21,2021-12-24,2022-02-09,2022-02-10",0.5611881576826735,0.6551999037358042,0.6081940307092388,10,5,0.007743347,38038058.05197397,1.0016138762019185e-06,4
EOH0645,E.ON,NE4,47,Working Part time,Skilled Manual Worker,"30,001 - 40,000",2021-02-12T00:00:00.000Z,Owner-Occupied,5,C2,1,YES,,NO,,NO,,NO,,YES,grant/free,NO,,NO,,NO,,NO,,NO,,19/02/2021,Phoenix,House,Semi-Detached,Urban,1967 - 1975,D,2,0,2,112,5,3,10,2.7,Cavity_Insulated,Solid,Pitched,Double,Yes,Gas,Gas Boiler - Combi,Fire - Electric,,,0,0,1,No,No,,,7.236,65.41,14540.2,3464,0,,,No,No,No,Yes,Hybrid,,,None Required,10615.05,,969,14.3,3.8,Yes,,,14/04/2021,Phoenix,Hybrid,Separate_New Boiler,Daikin,EHY2KOMB28AA,4,R32,,,,,1,10,0,0,none,none,No,0,0,0,No,No,0,0,,no,5739.82,,,3239,0,0,0,0,0,0,3,0,,1C1R1P1S,2021-2022,17/12/2021 00:00,28/02/2022 23:30,08/12/2021 00:00,30/01/2022 23:30,"2021-12-17,2022-01-03,2022-01-05,2022-01-21,2022-01-22,2022-01-26,2022-02-16,2022-02-18,2022-02-27,2022-02-28","2021-12-08,2021-12-11,2021-12-15,2022-01-24,2022-01-30",0.4702708011753733,0.4185269058231179,0.4443988534992456,10,5,0.005992646,68410730.56762114,9.932297155193083,2
EOH0651,E.ON,NE3,,Working Full time (>30hrs),Professional,"50,001+",2020-11-12T00:00:00.000Z,Owner-Occupied,3,AB,5,YES,,NO,,NO,,NO,,YES,Potential for bill savings,YES,,NO,,NO,,NO,,NO,,03/12/2020,Phoenix,House,Semi-Detached,Urban,1930 - 1949,D,2,2,2,133,6,4,9,2.4,Cavity_Insulated,Suspended,Pitched,Double,Yes,Gas,Gas Boiler - Combi,,,,0,0,0,No,No,6584,16000,7.56,56.85,8837.4,4457,0,49,3.03,No,No,No,Yes,Hybrid,,,Barrier,10800.04,300,741,14.3,3.8,Yes,,,16/08/2021,Phoenix,Hybrid,Separate_New Boiler,Daikin,EJHA04AAV3,4,R32,,,,,1,8,0,0,,,No,0,0,0,No,No,0,0,,no,5739.82,,,2251.5,,0,0,0,0,0,3,,,1C1R1P1S,2021-2022,07/12/2021 00:00,14/01/2022 23:30,08/12/2021 00:00,17/12/2021 23:30,"2021-12-07,2021-12-12,2021-12-16,2021-12-19,2021-12-20,2022-01-09,2022-01-10,2022-01-12,2022-01-13,2022-01-14","2021-12-08,2021-12-09,2021-12-10,2021-12-11,2021-12-17",0.6031574342268715,0.7484070530850432,0.6757822436559573,10,5,0.003797673,53631532.48872591,29.999999895561512,4
EOH0669,E.ON,NE23,48,Working Full time (>30hrs),Manager,"50,001+",2021-06-10T00:00:00.000Z,Owner-Occupied,10,AB,3,YES,,NO,,NO,,NO,,YES,Potential for bill savings,YES,,NO,,NO,,NO,,NO,,04/07/2021,E.ON,House,Detached,Urban,1983 - 1990,,2,2,2,129,7,4,11,2.4,Cavity_Insulated,Suspended,Pitched,Double,Yes,Gas,Gas Boiler - Combi,,,,0,0,1,No,No,,,7.32,60,17743.5,5594,818,49,3.24,Yes,No,Yes,Yes,ASHP,,,None Required,14244.11,,1183,14.3,3.8,Yes,,,06/09/2021,Phoenix,ASHP,,Daikin,EDLQ011CAV3,11,R410A,,Water_new,250,,1,16,0,0,,,No,0,1,0,Yes,Yes,0,0,,no,6364.21,1752.34,,4349.99,,500,0,0,0,0,3,,,1C1R1P1S,2021-2022,02/12/2021 00:00,15/12/2021 23:30,01/12/2021 00:00,11/12/2021 23:30,"2021-12-02,2021-12-03,2021-12-05,2021-12-07,2021-12-09,2021-12-10,2021-12-12,2021-12-13,2021-12-14,2021-12-15","2021-12-01,2021-12-04,2021-12-06,2021-12-08,2021-12-11",0.8135132868101334,0.8479304739122233,0.8307218803611783,10,5,0.005017169,28192342.590722032,0.2895276339022765,4
EOH0683,E.ON,NE2,59,Working Full time (>30hrs),Professional,"40,001 - 50,000",2020-11-10T00:00:00.000Z,Owner-Occupied,24,AB,3,NO,,NO,,YES,,NO,,YES,Potential for bill savings,YES,,NO,,NO,,NO,,NO,,20/11/2020,Phoenix,House,Semi-Detached,Urban,1930 - 1949,,5,0,3,180,8,5,14,2.7,Cavity_Insulated,Suspended,Pitched,Double,Yes,Gas,Gas Boiler - Combi,,,,0,0,1,No,No,6895,42186,13.639,75.77,11135.9,5731,0,55,2.96,No,No,No,Yes with additional measures,Hybrid,,,Loft Insulation,12450,500,1331,14.3,3.8,Yes,,,03/02/2021,Phoenix,Hybrid,Separate_New Boiler,Daikin,EHY2KOMB28AA,4,R32,,,,,1,15,0,0,none,none,No,0,0,0,No,Yes,0,0,,no,5912.2,,,4903.42,0,500,0,0,0,0,4,0.5,,1C1R1P1S,2021-2022,24/12/2021 00:00,24/02/2022 23:30,06/12/2021 00:00,27/02/2022 23:30,"2021-12-24,2021-12-31,2022-01-03,2022-01-08,2022-01-18,2022-01-20,2022-02-14,2022-02-17,2022-02-22,2022-02-24","2021-12-06,2022-01-12,2022-01-19,2022-02-19,2022-02-27",0.6066716374908292,0.7359013021751738,0.6712864698330014,10,5,0.002885378,50425877.50689952,8.895736468565667,5
EOH0699,E.ON,NE5,74,Retired,Pensioner,"12,501 - 16,200",2020-11-11T00:00:00.000Z,Owner-Occupied,22,DE,5,YES,,NO,,NO,,NO,,NO,,NO,,NO,,NO,,NO,,NO,,01/12/2020,Phoenix,House,Semi-Detached,Urban,1983 - 1990,,1,0,1,56,4,2,6,2.4,Cavity_Insulated,Solid,Pitched,Double,Yes,Gas,Gas Boiler - Combi,,,,0,0,0,No,No,4000,17000,6.016,83.79,14582,1910,0,55,2.96,No,No,No,Yes,Hybrid,,,None Required,9875.86,,641,14.3,3.8,Yes,,,25/02/2021,Phoenix,Hybrid,Separate_New Boiler,Daikin,EHY2KOMB28AA,4,R32,,,,,1,8,0,0,none,none,No,0,0,0,No,Yes,0,0,,no,5789.82,,,2500.86,0,500,0,0,0,0,2.5,0.5,,1C1R1P1S,2021-2022,04/12/2021 00:00,24/02/2022 23:30,06/12/2021 00:00,22/02/2022 23:30,"2021-12-04,2021-12-05,2021-12-18,2021-12-21,2021-12-27,2022-01-14,2022-01-15,2022-01-16,2022-01-22,2022-02-24","2021-12-06,2021-12-31,2022-01-13,2022-01-25,2022-02-22",0.6650444531391503,0.8592341694454353,0.7621393112922927,10,5,0.00670118,11627786.186552132,2.783307332946187,1
EOH0749,E.ON,NE3,57,Working Full time (>30hrs),Professional,"50,001+",2021-01-07T00:00:00.000Z,Owner-Occupied,19,AB,5,YES,,NO,,NO,,NO,,NO,,YES,,NO,,NO,,NO,,NO,,27/01/2021,Phoenix,House,Detached,Urban,1991 - 1995,,2,0,2,152,8,4,13,2.3,Cavity_Insulated,Suspended,Pitched,Double,Yes,Gas,Gas Boiler - Combi,Fire - Gas,,,0,1,1,No,No,5000,19000,9.17,60.32,8899.9,4139,0,55,2.96,No,No,No,Yes,Hybrid,,,None Required,10800.81,,866,14.3,3.8,Yes,,,17/06/2021,Phoenix,Hybrid,Separate_New Boiler,Daikin,EHY2KOMB28AA,4,R32,,,,,1,13,0,0,none,none,No,0,0,0,No,No,0,0,,no,5739,,,3425,0,0,0,0,0,0,2.5,0,,1C1R1P1S,2021-2022,11/12/2021 00:00,24/02/2022 23:30,09/12/2021 00:00,14/01/2022 23:30,"2021-12-11,2021-12-14,2021-12-20,2021-12-26,2022-01-03,2022-02-02,2022-02-07,2022-02-10,2022-02-16,2022-02-24","2021-12-09,2021-12-10,2021-12-12,2021-12-22,2022-01-14",0.2578397155548589,0.3626057173810215,0.3102227164679402,10,5,0.004432221,203988700.1069644,1.0005142296170754e-06,2
EOH0791,E.ON,NE7,38,Working Full time (>30hrs),Manager,"50,001+",2020-10-29T00:00:00.000Z,Owner-Occupied,4,AB,1,YES,,NO,,YES,,NO,,YES,Potential for bill savings,NO,,NO,,NO,,NO,,NO,,10/11/2020,Phoenix,House,Semi-Detached,Urban,1950 - 1966,C,2,2,2,112,6,4,9,2.5,Cavity_Insulated,Solid,Pitched,Double,Yes,Gas,Gas Boiler - Standard,Fire - Wood,Water,110,0,0,1,No,No,4491,13084,8.53,86.25,17081,4457,0,55,2.96,Yes,No,No,Yes with additional measures,Hybrid,,,Loft Insulation,10245,700,827,14.3,3.8,Yes,,,10/12/2020,Phoenix,Hybrid,Separate_New Boiler,Daikin,EHY2KOMB28AA,4,R32,,,,,1,10,0,0,none,none,No,0,0,0,No,Yes,0,0,,no,5739.82,,,2870.84,0,0,0,0,0,0,2,,,1C1R1P1S,2021-2022,25/02/2022 00:00,27/02/2022 23:30,28/02/2022 00:00,28/02/2022 23:30,"2022-02-25,2022-02-26,2022-02-27",28/02/2022,0.7299039018535359,0.5294903014222365,0.6296971016378863,3,1,0.005061952,127684049.17077102,0.1073969831412292,4
EOH0808,E.ON,NE3,49,Working Full time (>30hrs),Professional,"30,001 - 40,000",2021-02-25T00:00:00.000Z,Owner-Occupied,17,C1,1,YES,,NO,,NO,,NO,,NO,,YES,,NO,,NO,,NO,,NO,,08/03/2021,Phoenix,House,Semi-Detached,Urban,1983 - 1990,,1,0,2,68,4,3,6,2.4,Cavity_Insulated,Suspended,Pitched,Single,Yes,Gas,Gas Boiler - Combi,,,,0,0,1,No,No,3050,9176,5.014,73.74,10044.6,3566,0,49,3.03,No,No,No,Yes,Hybrid,,,None Required,10799.27,,596,14.3,3.8,Yes,,,27/05/2021,Phoenix,Hybrid,Separate_New Boiler,Daikin,EHY2KOMB28AA,4,R32,,,,,1,9,0,0,none,none,No,0,0,0,No,No,0,0,,no,5739.8,,,3424.27,0,0,0,0,0,0,2.5,0,,1C1R1P1S,2021-2022,08/12/2021 00:00,30/01/2022 23:30,01/12/2021 00:00,22/02/2022 23:30,"2021-12-08,2021-12-10,2021-12-11,2021-12-17,2021-12-23,2022-01-07,2022-01-22,2022-01-25,2022-01-28,2022-01-30","2021-12-01,2022-01-24,2022-02-04,2022-02-11,2022-02-22",0.6146048087232946,0.6674504505172348,0.6410276296202647,10,5,0.008215189,14959720.30672107,4.536721996027406,1
EOH0810,E.ON,NE11,69,Retired,Pensioner,"50,001+",2021-02-22T00:00:00.000Z,Owner-Occupied,4,DE,2,YES,,NO,,YES,,NO,,NO,,YES,,NO,,NO,,NO,,NO,,24/02/2021,Phoenix,House,Detached,Urban,1950 - 1966,C,2,0,2,92,5,3,8,2.4,Cavity_Insulated,Mix,Pitched,Double,Yes,Gas,Gas Boiler - Combi,Fire - Gas,,,1,1,1,No,No,4500,14000,8.24,89.52,16550.2,4122,607,50,3.2,Yes,No,Yes,No,ASHP,,,None Required,14241.8,,1044,14.3,3.8,Yes,,,19/05/2021,Aaron Services,ASHP,,Daikin,EDLQ011CAV3,11,R410A,,Water_new,200,,1,12,0,0,none,none,No,0,0,0,No,No,0,0,,no,6364.2,1752,,5087,0,0,0,0,0,0,3,0,,1C1R1P1S,2021-2022,08/12/2021 00:00,27/02/2022 23:30,03/12/2021 00:00,19/02/2022 23:30,"2021-12-08,2022-01-09,2022-01-17,2022-01-19,2022-01-22,2022-02-12,2022-02-16,2022-02-18,2022-02-25,2022-02-27","2021-12-03,2021-12-09,2022-01-04,2022-02-01,2022-02-19",0.2569231515934113,0.4355209841728969,0.3462220678831541,10,5,0.003909374,41442735.93478372,11.386320762610552,2
EOH0822,E.ON,NE3,44,Working Full time (>30hrs),Professional,"40,001 - 50,000",2021-01-12T00:00:00.000Z,Owner-Occupied,0.9,AB,2,NO,,NO,,YES,,NO,,NO,,YES,,NO,,NO,,NO,,NO,,28/01/2021,Phoenix,House,Semi-Detached,Urban,1950 - 1966,D,2,0,1,70,4,2,6,2.4,Cavity_Insulated,Solid,Pitched,Double,Yes,Gas,Gas Boiler - Combi,Fire - Electric,,,0,0,0,No,No,,,4.841,69.16,11727.8,3356,491,49,3.39,Yes with additional measures,No,Yes,Yes,ASHP,,,Barrier,11628.14,300,728,14.3,3.8,Yes,,,23/04/2021,Aaron Services,ASHP,,Daikin,EDLQ07CAV7,7,R410A,,Water_new,150,,1,7,0,0,none,enclosure,No,0,0,0,No,No,0,0,,no,5648,1701,,2315.87,0,0,0,0,0,0,3,0,,1C1R1P1S,2021-2022,13/12/2021 00:00,28/02/2022 23:30,09/12/2021 00:00,24/02/2022 23:30,"2021-12-13,2021-12-23,2022-01-04,2022-01-06,2022-02-11,2022-02-12,2022-02-21,2022-02-22,2022-02-25,2022-02-28","2021-12-09,2021-12-19,2021-12-26,2022-02-08,2022-02-24",0.4885577459117858,0.7214557134452496,0.6050067296785178,10,5,0.006750474,42776656.73,3.392596212304283,2
EOH0837,E.ON,NE3,33,Working Full time (>30hrs),Professional,"50,001+",2021-01-25T00:00:00.000Z,Owner-Occupied,5,AB,4,YES,,NO,,YES,,NO,,NO,,YES,,NO,,NO,,NO,,NO,,08/02/2021,Phoenix,House,Semi-Detached,Urban,1950 - 1966,C,2,2,2,99,5,3,8,2.6,Cavity_Insulated,Suspended,Pitched,Double,Yes,Gas,Gas Boiler - Combi,Fire - Gas,,,0,1,0,No,No,4760,17000,7.18,72.54,14382.5,5153,759,50,3.2,Yes with additional measures,No,No,Yes,ASHP,,,Loft Insulation,13134.93,500,1023,14.3,3.8,Yes,,,14/05/2021,Aaron Services,ASHP,,Daikin,EDLQ011CAV3,11,R410A,,Water_new,250,,1,12,0,0,none,none,No,0,1,0,No,Yes,0,0,,no,6364.21,1752,,3240.82,0,500,0,0,0,0,2,0.5,,1C1R1P1S,2021-2022,02/12/2021 00:00,24/02/2022 23:30,07/01/2022 00:00,27/02/2022 23:30,"2021-12-02,2021-12-13,2021-12-19,2022-01-17,2022-01-25,2022-01-26,2022-01-29,2022-02-16,2022-02-21,2022-02-24","2022-01-07,2022-02-01,2022-02-13,2022-02-25,2022-02-27",0.3381892490409534,0.3485101952372497,0.3433497221391015,10,5,0.00501444,66290287.52399858,5.302315852569045,4
EOH0894,E.ON,NE3,45,Working Full time (>30hrs),Professional,"50,001+",2020-12-11T00:00:00.000Z,Owner-Occupied,3,AB,3,YES,,NO,,NO,,NO,,NO,,NO,,NO,,NO,,NO,,NO,,12/01/2021,Phoenix,House,Semi-Detached,Urban,1930 - 1949,,2,0,2,160,8,4,11,2.4,Cavity_Insulated,Suspended,Pitched,Double,Yes,Gas,Gas Boiler - Combi,Fire - Wood,,,1,0,1,No,No,,,9.629,60.18,19298.8,4994,0,55,3.46,No,No,Yes with additional measures,No,HT_ASHP,,,Cavity insulation,18347.44,700,1044,14.3,3.8,Yes,,,13/09/2021,Phoenix,HT_ASHP,,Daikin,EPRA14DAV3,14,R32,,PCM_New,,9,1,13,0,0,,,No,0,0,0,Yes,No,0,0,Cavity,no,9047.38,3500.65,,4164.23,,0,750,0,0,0,3,,,1C1R1P1S,2021-2022,26/12/2021 00:00,25/02/2022 23:30,15/01/2022 00:00,23/02/2022 23:30,"2021-12-26,2021-12-31,2022-01-02,2022-01-05,2022-01-17,2022-01-20,2022-01-21,2022-01-31,2022-02-03,2022-02-25","2022-01-15,2022-01-24,2022-02-01,2022-02-05,2022-02-23",0.5792616353695815,0.7492713760681601,0.6642665057188708,10,5,0.004723714,43034539.06792752,8.465355329887554,2
EOH0901,E.ON,NE3,62,Working Full time (>30hrs),Professional,"40,001 - 50,000",2021-01-08T00:00:00.000Z,Owner-Occupied,16,AB,5,NO,,NO,,YES,,NO,,NO,,YES,,NO,,NO,,NO,,NO,,26/01/2021,Phoenix,House,Detached,Urban,1983 - 1990,,2,0,2,151,7,4,12,2.4,Cavity_Insulated,Solid,Pitched,Double,Yes,Gas,Gas Boiler - Combi,Fire - Gas,,,0,1,1,No,No,,,13.01,86.73,9396,3496,0,45,3.91,Yes,No,Yes,Yes,HT_ASHP,,,,12662.98,0,740,12.9,4,Yes,,,20/09/2021,Energist,HT_ASHP,,Vaillant,VWL 75/6 A 230V S2,7,R290,,Water_new,200,,1,7,0,0,,,No,0,0,0,No,No,0,0,,no,5789,1752.34,,1945.89,0,0,0,0,0,0,3,,,1C1R1P1S,2021-2022,15/12/2021 00:00,24/02/2022 23:30,26/12/2021 00:00,08/02/2022 23:30,"2021-12-15,2021-12-23,2021-12-27,2022-01-04,2022-01-05,2022-01-09,2022-01-25,2022-02-14,2022-02-20,2022-02-24","2021-12-26,2021-12-31,2022-01-22,2022-02-04,2022-02-08",0.5444641401760407,0.9631873124518842,0.7538257263139625,10,5,0.005871677,36935148.31765024,1.0004775399034648e-06,2
EOH0918,E.ON,NE3,25,Working Full time (>30hrs),Professional,"50,001+",2021-04-22T00:00:00.000Z,Owner-Occupied,18,AB,4,YES,,NO,,NO,,NO,,NO,,YES,,NO,,NO,,NO,,NO,,26/04/2021,Energist,House,Detached,Urban,2012 onwards,,2,2,2,145,9,4,8,2.4,Cavity_Insulated,Suspended,Pitched,Double,Yes,Gas,Gas Boiler - Combi,,,,0,0,0,No,No,,,4.407,29.98,11674,3496,0,45,3.77,Yes,No,Yes,Yes,ASHP,,,None Required,13451.83,,816,15,5,Yes,,,01/07/2021,Energist,HT_ASHP,,Vaillant,VWL 55/6 A 230V S2,5,R290,,Water_new,200,,1,12,0,0,none,none,No,0,0,0,No,No,0,0,,no,5335.2,1752,,3240,0,0,0,0,0,0,6,0,,1C1R1P1S,2021-2022,22/12/2021 00:00,22/02/2022 23:30,15/12/2021 00:00,04/02/2022 23:30,"2021-12-22,2022-01-02,2022-01-14,2022-01-23,2022-01-29,2022-02-06,2022-02-09,2022-02-14,2022-02-15,2022-02-22","2021-12-15,2021-12-25,2021-12-30,2022-01-06,2022-02-04",0.5026998733698365,0.6605706919102886,0.5816352826400626,10,5,0.00674387,37102663.768778674,0.151840174,4
EOH0923,E.ON,NE4,,Working Part time,Clerical,"12,501 - 16,200",2021-01-28T00:00:00.000Z,Owner-Occupied,20,C1,2,NO,,,,YES,,NO,,YES,,NO,,NO,,NO,,NO,,NO,,11/02/2021,Phoenix,House,End-Terrace,Urban,1900 - 1929,,2,0,3,112,7,4,10,3,Solid_No_insulation,Suspended,Pitched,Double,Yes,Gas,Gas Boiler - Combi,Fire - Wood,,,0,0,1,No,No,3300,,11.478,86.12,23063,4457,0,,,No,No,No,Yes with additional measures,Hybrid,,,Loft Insulation,10973.19,500,1070,14.3,3.8,Yes,,,05/05/2021,Phoenix,Hybrid,Separate_New Boiler,Daikin,EHY2KOMB32AA,4,R32,,,,,1,13,0,0,none,none,No,0,0,0,No,Yes,0,0,,no,5912.2,,,3795.02,0,500,0,0,0,0,3,0,,1C1R1P1S,2021-2022,19/01/2022 00:00,27/02/2022 23:30,07/12/2021 00:00,04/02/2022 23:30,"2022-01-19,2022-01-22,2022-01-26,2022-01-27,2022-01-30,2022-02-07,2022-02-18,2022-02-20,2022-02-23,2022-02-27","2021-12-07,2021-12-17,2021-12-21,2022-01-18,2022-02-04",0.4432961204607525,0.7629156350786416,0.603105878,10,5,0.00239896,93180511.56380372,5.623572912570257,2
EOH0930,E.ON,NE20,59,Working Full time (>30hrs),Manager,"50,001+",2021-01-04T00:00:00.000Z,Owner-Occupied,3,AB,5,NO,,NO,,NO,,NO,,YES,,YES,,NO,,NO,,NO,,NO,,20/01/2021,Phoenix,House,Detached,Urban,1967 - 1975,,2,1,2,120,6,4,8,2.4,Cavity_Insulated,Suspended,Pitched,Double,Yes,Gas,Gas Boiler - Combi,,,,0,0,1,No,No,,,8.992,74.93,28647.2,3515,0,55,2.96,No,No,No,Yes,Hybrid,,,None Required,10602.44,,1949,14.3,3.8,Yes,,,27/05/2021,Phoenix,Hybrid,Separate_New Boiler,Daikin,EHY2KOMB32AA,4,R32,,,,,1,9,0,0,none,none,No,0,0,0,No,No,0,0,,no,5912.2,,,3055.06,0,0,0,0,0,0,2.5,0,,1C1R1P1S,2021-2022,24/12/2021 00:00,26/02/2022 23:30,23/12/2021 00:00,19/02/2022 23:30,"2021-12-24,2021-12-28,2021-12-31,2022-01-02,2022-01-14,2022-02-01,2022-02-02,2022-02-20,2022-02-21,2022-02-26","2021-12-23,2022-01-05,2022-01-30,2022-02-08,2022-02-19",0.3612958790957867,0.3787093001118546,0.3700025896038207,10,5,0.004541346,42399505.71126524,1.0003089567534456e-06,3
EOH0957,E.ON,NE13,53,Working Full time (>30hrs),Skilled Manual Worker,"20,001 - 25,000",2020-11-24T00:00:00.000Z,Owner-Occupied,23,C2,3,YES,,NO,,YES,,NO,,NO,,NO,,NO,,NO,,NO,,NO,,14/12/2020,Phoenix,House,Semi-Detached,Urban,1950 - 1966,,2,0,2,84,5,4,7,2.3,Cavity_Insulated,Suspended,Pitched,Double,Yes,Gas,Gas Boiler - Combi,Fire - Gas,,,0,1,1,No,No,,,8.347,99.36,20192.9,5594,818,49,3.24,Yes,No,Yes,No,ASHP,,,Barrier,13688.36,300,1278,14.3,3.8,Yes,,,05/08/2021,Aaron Services,ASHP,,Daikin,EDLQ011CAV3,11,R410A,,Water_new,250,,1,12,0,0,none,barrier,No,0,0,0,No,No,0,0,,no,6364,1752,,4347,0,0,0,0,0,0,4,0,,1C1R1P1S,2021-2022,17/12/2021 00:00,28/02/2022 23:30,08/12/2021 00:00,11/01/2022 23:30,"2021-12-17,2022-01-02,2022-01-03,2022-01-04,2022-01-19,2022-01-24,2022-01-28,2022-01-30,2022-02-06,2022-02-28","2021-12-08,2021-12-19,2021-12-26,2021-12-31,2022-01-11",0.5810431231884974,0.4487821472868346,0.5149126352376661,10,5,0.002692747,74343604.92922807,1.0017738904875511e-06,2
EOH1000,E.ON,NE3,47,Working Full time (>30hrs),Manager,"40,001 - 50,000",2020-12-04T00:00:00.000Z,Owner-Occupied,5,C1,3,YES,,NO,,NO,,NO,,NO,,YES,,NO,,NO,,NO,,NO,,18/01/2021,Phoenix,House,Semi-Detached,Urban,1983 - 1990,D,2,2,2,78,4,3,7,2.4,Cavity_Insulated,Solid,Pitched,Double,Yes,Gas,Gas Boiler - Combi,,,,0,0,1,No,No,,,5.023,64.4,7266.6,3311,0,55,2.96,No,No,No,Yes,Hybrid,,,None Required,10245.07,,614,14.3,3.8,Yes,,,23/04/2021,Phoenix,Hybrid,Separate_New Boiler,Daikin,EHY2KOMB28AA,4,R32,,,,,1,8,0,0,none,none,No,0,0,0,No,No,0,0,,no,5739.82,,,2870.1,0,0,0,0,0,0,2.5,0,,1C1R1P1S,2021-2022,02/12/2021 00:00,21/02/2022 23:30,07/12/2021 00:00,08/02/2022 23:30,"2021-12-02,2021-12-03,2021-12-04,2021-12-14,2021-12-19,2021-12-27,2022-01-07,2022-02-13,2022-02-14,2022-02-21","2021-12-07,2021-12-15,2021-12-20,2022-01-02,2022-02-08",0.7848953493135418,0.6736695439833444,0.7292824466484431,10,5,0.007932866,19563210.592590854,3.2603100039894573,4
EOH1019,E.ON,NE3,58,Unemployed,Professional,"20,001 - 25,000",2020-08-17T00:00:00.000Z,Owner-Occupied,25,DE,1,YES,,NO,,YES,,NO,,NO,,NO,,NO,,NO,,NO,,NO,,29/09/2020,Phoenix,House,Semi-Detached,Urban,1950 - 1966,,2,0,2,105,4,3,12,2.6,Cavity_No_insulation,Mix,Pitched,Double,Yes,Gas,Gas Boiler - Combi,,,,0,0,1,No,No,1891,10973,10.272,97.83,9508.9,3820,0,55,2.96,No,No,No,Yes,Hybrid,,,Barrier,10615.82,300,944,14.3,3.8,Yes,,,10/06/2021,Phoenix,Hybrid,Separate_New Boiler,Daikin,EHY2KOMB28AA,4,R32,,,,,1,12,0,0,none,barrier,No,0,0,0,No,No,0,0,,no,5739.82,,,3240.82,0,0,0,0,0,0,2.5,0,,1C1R1P1S,2021-2022,01/12/2021 00:00,24/02/2022 23:30,23/12/2021 00:00,09/01/2022 23:30,"2021-12-01,2021-12-08,2021-12-28,2022-01-13,2022-01-31,2022-02-01,2022-02-11,2022-02-18,2022-02-19,2022-02-24","2021-12-23,2021-12-25,2021-12-29,2022-01-05,2022-01-09",0.4453169672851029,0.4788837405769771,0.462100354,10,5,0.006619488,39651079.18845556,1.0080660976442527e-06,2
EOH1041,E.ON,NE15,57,Working Full time (>30hrs),Skilled Manual Worker,"50,001+",2021-03-11T00:00:00.000Z,Owner-Occupied,30,C2,2,NO,,NO,,NO,,NO,,YES,Government grant / free,NO,,NO,,NO,,NO,,NO,,11/03/2021,Phoenix,House,Detached,Urban,1967 - 1975,,2,0,2,80,4,3,8,2.4,Cavity_Insulated,Suspended,Pitched,Double,Yes,Gas,Gas Boiler - Combi,,,,0,0,1,No,No,3058,10144,5.51,68.81,13339.1,4475,655,49,3.39,Yes,No,Yes,No,ASHP,,,None Required,11678.78,,883,14.3,3.8,Yes,,,09/06/2021,Aaron services,ASHP,,Daikin,EDLQ07CAV3,7,R410A,,Water_new,200,,1,8,0,0,none,none,No,0,0,0,No,No,0,0,,no,5648.01,1752,,2501,0,0,0,0,0,0,3,0,,1C1R1P1S,2021-2022,06/12/2021 00:00,20/02/2022 23:30,30/12/2021 00:00,24/02/2022 23:30,"2021-12-06,2021-12-12,2021-12-16,2021-12-22,2022-01-07,2022-01-08,2022-01-19,2022-01-21,2022-02-19,2022-02-20","2021-12-30,2022-01-05,2022-01-12,2022-02-04,2022-02-24",0.4673753486871251,0.6683558413350024,0.5678655950110637,10,5,0.006069537,25305111.49125204,7.233564752000948,2
EOH1070,E.ON,NE3,43,Working Full time (>30hrs),Professional,"40,001 - 50,000",2021-01-13T00:00:00.000Z,Owner-Occupied,8,AB,3,NO,,NO,,YES,,NO,,NO,,YES,,NO,,NO,,NO,,NO,,01/02/2021,Phoenix,House,Semi-Detached,Urban,1967 - 1975,D,2,3,2,86,6,4,10,2.3,Cavity_Insulated,Solid,Pitched,Double,Yes,Gas,Gas Boiler - Combi,,,,0,0,1,No,No,,,5.8,67.44,20113,4394,0,50,3.02,No,No,No,Yes,Hybrid,,,None Required,10787.43,,919,14.3,3.8,Yes,,,01/04/2021,Phoenix,Hybrid,Separate_New Boiler,Daikin,EHY2KOMB32AA,4,R32,,,,,1,10,0,0,none,none,No,0,0,0,No,No,0,0,,no,5912.2,,,3240.05,0,0,0,0,0,0,3,0,,1C1R1P1S,2021-2022,13/12/2021 00:00,25/01/2022 23:30,25/12/2021 00:00,23/02/2022 23:30,"2021-12-13,2021-12-18,2021-12-23,2021-12-30,2021-12-31,2022-01-02,2022-01-03,2022-01-11,2022-01-23,2022-01-25","2021-12-25,2022-01-22,2022-02-19,2022-02-21,2022-02-23",0.4299707175225617,0.5959295912477598,0.5129501543851608,10,5,0.009440334,26996250.531469647,1.2191497791633663,5
EOH1092,E.ON,NE15,32,Working Full time (>30hrs),Professional,"50,001+",2021-02-23T00:00:00.000Z,Owner-Occupied,0.9,AB,2,YES,,NO,,NO,,NO,,NO,,YES,,NO,,NO,,NO,,NO,,25/02/2021,Phoenix,House,Detached,Urban,1983 - 1990,,2,2,2,110,5,4,9,2.4,Cavity_Insulated,Solid,Pitched,Double,Yes,Gas,Gas Boiler - Combi,,,,0,0,0,No,No,,,6.909,64.57,16753.9,5153,759,47,3.33,Yes,No,No,Yes,ASHP,,,None Required,14980.98,,1100,14.3,3.8,Yes,,,19/05/2021,Aaron Services,ASHP,,Daikin,EDLQ011CAV3,11,R410A,,Water_new,250,,1,12,0,0,none,none,No,0,0,0,Yes,No,0,0,,no,6364.21,1752,,5086.87,0,0,0,0,0,0,3,0,,1C1R1P1S,2021-2022,17/12/2021 00:00,31/01/2022 23:30,02/12/2021 00:00,13/01/2022 23:30,"2021-12-17,2021-12-23,2021-12-29,2021-12-30,2022-01-05,2022-01-14,2022-01-22,2022-01-26,2022-01-27,2022-01-31","2021-12-02,2021-12-04,2021-12-13,2021-12-25,2022-01-13",0.4176121818043594,0.4313849270509885,0.4244985544276739,10,5,0.006089374,61954949.72785015,2.485182016325377,4
EOH1097,E.ON,NE40,,Working Part time,Professional,"30,001 - 40,000",2021-03-12T00:00:00.000Z,Owner-Occupied,5,AB,1,YES,,NO,,NO,,NO,,YES,Potential for bill savings,NO,,NO,,NO,,NO,,NO,,12/05/2021,Energist,House,Detached,Urban,1967 - 1975,,2,0,1,60,5,2,6,2.4,Cavity_Insulated,Suspended,Pitched,Double,Yes,Gas,Gas Boiler - Combi,,,,0,1,1,No,No,,,7.68,71.11,23839,3146,0,45,4.13,Yes,No,Yes,Yes,ASHP,,,None Required,14936,,837.95,12.49,3.5,Yes,,,27/06/2021,Energist,HT_ASHP,,Vaillant,VWL 105/6 A 230V S2,10,R290,,Water_new,200,,1,12,0,0,none,none,No,0,0,0,No,No,0,0,,no,6535,1752,,3240.82,0,0,0,0,0,0,6,0,,1C1R1P1S,2021-2022,21/12/2021 00:00,14/02/2022 23:30,08/12/2021 00:00,27/02/2022 23:30,"2021-12-21,2021-12-22,2022-01-06,2022-01-18,2022-01-23,2022-01-24,2022-02-02,2022-02-03,2022-02-13,2022-02-14","2021-12-08,2022-01-07,2022-02-11,2022-02-17,2022-02-27",0.5054300025867148,0.7120666786657487,0.6087483406262317,10,5,0.006865295,17338430.042506013,1.0005593993629706e-06,2
EOH1171,E.ON,NE28,57,Working Full time (>30hrs),Skilled Manual Worker,"25,001 - 30,000",2021-03-02T00:00:00.000Z,Owner-Occupied,21,DE,1,NO,,NO,,NO,,NO,,YES,potential for bill savings,YES,,NO,,NO,,NO,,NO,,12/03/2021,Phoenix,House,Semi-Detached,Urban,1950 - 1966,,3,0,2,77,5,3,7,2.5,Cavity_Insulated,Suspended,Pitched,Double,Yes,Gas,Gas Boiler - Combi,Fire - Gas,,,0,1,1,No,No,,,5.523,71.73,11066.4,3311,0,55,2.96,No,No,No,Yes with additional measures,Hybrid,,,Loft Insulation,10245.84,500,708,14.3,3.8,Yes,,,26/05/2021,Phoenix,Hybrid,Separate_New Boiler,Daikin,EHY2KOMB28AA,4,R32,,,,,1,10,0,0,none,none,No,0,0,0,No,Yes,0,0,,no,5739.8,,,2870.84,0,500,0,0,0,0,2,0.5,,1C1R1P1S,2021-2022,29/12/2021 00:00,25/02/2022 23:30,12/12/2021 00:00,18/02/2022 23:30,"2021-12-29,2022-01-05,2022-01-22,2022-01-26,2022-02-03,2022-02-09,2022-02-12,2022-02-14,2022-02-20,2022-02-25","2021-12-12,2022-01-01,2022-01-31,2022-02-05,2022-02-18",0.6087626266408445,0.717776354,0.6632694901775688,10,5,0.007035375,22398859.91213446,8.647032272203719,3
EOH1191,E.ON,NE5,69,Retired,Pensioner,"25,001 - 30,000",2021-05-18T00:00:00.000Z,Owner-Occupied,2,C1,1,NO,,NO,,NO,,NO,,NO,,YES,,NO,,NO,,NO,,NO,,07/06/2021,Phoenix,House,Mid-Terrace,Urban,1950 - 1966,D,2,0,2,87,3,2,7,2.4,Cavity_Insulated,Solid,Pitched,Double,Yes,Gas,Gas Boiler - Combi,Fire - Electric,,,0,0,1,No,No,,,5.416,62.25,7751.7,2636,0,50,3.02,No,No,No,Yes,Hybrid,,,Barrier,9875.86,300,508,14.3,3.8,Yes,,,08/07/2021,Phoenix,Hybrid,Separate_New Boiler,Daikin,EHY2KOMB28AA,4,R32,,,,,1,8,0,0,none,barrier,No,0,0,0,No,No,0,0,,no,5739,,,2501,0,0,0,0,0,0,2.5,0,,1C1R1P1S,2021-2022,11/12/2021 00:00,03/02/2022 23:30,10/12/2021 00:00,23/01/2022 23:30,"2021-12-11,2021-12-19,2021-12-22,2021-12-25,2021-12-26,2022-01-08,2022-01-10,2022-01-14,2022-02-02,2022-02-03","2021-12-10,2021-12-30,2022-01-06,2022-01-21,2022-01-23",0.5354704761321918,0.4060589032182112,0.4707646896752014,10,5,0.007976033,33453684.50517701,12.50535976809535,2
EOH1255,E.ON,NE3,64,Working Full time (>30hrs),Manager,"30,001 - 40,000",2021-04-29T00:00:00.000Z,Owner-Occupied,25,C1,4,YES,,NO,,NO,,NO,,YES,Potential for bill savings,NO,,NO,,NO,,NO,,NO,,10/05/2021,Phoenix,House,Mid-Terrace,Urban,1950 - 1966,,2,0,2,87,6,3,7,2.5,Cavity_Insulated,Suspended,Pitched,Double,Yes,Gas,Gas Boiler - Combi,,,,0,0,1,No,No,3600,24000,5.684,61.78,7990.4,3515,0,50,3.02,No,No,No,Yes,Hybrid,,,Loft insulation,10060.85,500,560,14.3,3.8,Yes,,,06/09/2021,Phoenix,Hybrid,Separate_New Boiler,Daikin,EJHA04AAV3,4,R32,,,,,1,9,0,0,,,No,0,0,0,No,Yes,0,0,,no,5739.82,,,2685.85,,500,0,0,0,0,3,,,1C1R1P1S,2021-2022,09/12/2021 00:00,27/02/2022 23:30,22/12/2021 00:00,24/02/2022 23:30,"2021-12-09,2021-12-14,2021-12-15,2021-12-27,2022-01-06,2022-01-23,2022-02-05,2022-02-06,2022-02-09,2022-02-27","2021-12-22,2022-01-01,2022-01-09,2022-01-29,2022-02-24",0.684935369,0.7978733547768847,0.7414043617170554,10,5,0.004421571,95660863.93427809,11.08982507960293,2
EOH1260,E.ON,NE5,34,Working Full time (>30hrs),Professional,"50,001+",2020-11-26T00:00:00.000Z,Owner-Occupied,0.9,AB,1,YES,,NO,,NO,,NO,,YES,potential for bill savings,YES,,NO,,NO,,NO,,NO,,15/12/2020,Phoenix,House,Semi-Detached,Urban,1930 - 1949,C,2,2,3,131,5,3,8,2.6,Cavity_Insulated,Suspended,Pitched,Double,Yes,Gas,Gas Boiler - Combi,,,,0,0,0,No,No,1860,13252,7.782,65.79,18863,3566,0,52,3,No,No,No,Yes,Hybrid,,,None Required,10060.85,,852,14.3,3.8,Yes,,,24/02/2021,Phoenix,Hybrid,Separate_New Boiler,Daikin,EHY2KOMB28AA,4,R32,,,,,1,9,0,0,none,none,No,0,0,0,No,No,0,0,,no,5789.82,,,2685.85,0,0,0,0,0,0,2.5,0,,1C1R1P1S,2021-2022,04/12/2021 00:00,28/02/2022 23:30,03/12/2021 00:00,14/02/2022 23:30,"2021-12-04,2021-12-06,2021-12-15,2021-12-20,2021-12-21,2022-01-05,2022-01-08,2022-02-19,2022-02-20,2022-02-28","2021-12-03,2021-12-11,2021-12-31,2022-01-28,2022-02-14",0.8918047267201133,0.8480814632682706,0.869943095,10,5,0.006273819,202409087.96232283,29.99999999,4
EOH1281,E.ON,NE5,51,Working Full time (>30hrs),Professional,"50,001+",2020-09-16T00:00:00.000Z,Owner-Occupied,23,AB,1,YES,,NO,,YES,change from warm air heating,NO,,YES,Potential for bill savings,NO,,NO,,NO,,NO,,NO,,29/09/2020,Phoenix,House,Semi-Detached,Urban,1950 - 1966,,3,0,2,76,4,3,10,2.3,Cavity_Insulated,Suspended,Pitched,Double,Yes,Gas,Gas - Warm Air,Fire - Gas,Water,90,0,1,1,No,No,,,5.883,77,11779,4182,616,45,3.57,Yes,No,No,No,ASHP,,,None Required,12048.76,,680,14.3,3.8,Yes,,,09/12/2020,Aaron Services,ASHP,,Daikin,EDLQ07CAV3,7,R410A,,Water_new,180,,1,10,0,0,none,none,No,0,0,0,Yes,No,0,0,,no,5648.01,1752.34,,2870.84,0,0,0,0,0,0,2,,,1C1R1P1S,2020-2021,22/12/2020 00:00,22/02/2021 23:30,16/01/2021 00:00,23/02/2021 23:30,"2020-12-22,2021-01-05,2021-01-10,2021-02-05,2021-02-06,2021-02-15,2021-02-16,2021-02-19,2021-02-21,2021-02-22","2021-01-16,2021-01-31,2021-02-01,2021-02-08,2021-02-23",0.91336099,0.8966184621413489,0.904989726,10,5,0.020911935,14683999.17753535,0.559758373,3
EOH1302,E.ON,NE15,50,Working Full time (>30hrs),Manager,"50,001+",2020-09-17T00:00:00.000Z,Owner-Occupied,25,AB,5,YES,,NO,,YES,,NO,,NO,,NO,,NO,,NO,,NO,,NO,,05/10/2020,Phoenix,House,Semi-Detached,Urban,1991 - 1995,,3,1,2,110,5,4,11,2.4,Cavity_Insulated,Solid,Pitched,Double,No,Electricity,Electric - Storage,,Water,110,0,0,0,No,No,17000,,6.342,57,15349,5225,768,45,3.57,Yes,No,No,No,ASHP,,,None Required,12972.93,,999,14.3,3.8,Yes,,,02/02/2021,Aaron Services,ASHP,,Daikin,EDLQ07CAV3,7,R410A,,Water_new,200,,1,13,0,0,none,none,No,0,0,0,No,No,0,0,,no,5648.01,1752.34,,3795.02,0,0,0,0,0,0,2.5,0,,1C1R1P1S,2021-2022,27/12/2021 00:00,28/02/2022 23:30,09/12/2021 00:00,20/02/2022 23:30,"2021-12-27,2022-01-07,2022-01-12,2022-01-15,2022-01-20,2022-01-23,2022-01-28,2022-02-09,2022-02-24,2022-02-28","2021-12-09,2021-12-26,2022-01-01,2022-02-17,2022-02-20",0.7958418748377797,0.8294147378189628,0.8126283063283712,10,5,0.00812922,59249899.09,1.018153955241593e-06,4
EOH1304,E.ON,NE3,67,Retired,Pensioner,Prefer not to say,2021-01-20T00:00:00.000Z,Owner-Occupied,25,DE,1,NO,,NO,,YES,,NO,,YES,gov grant/free,NO,,NO,,NO,,NO,,NO,,04/02/2021,Phoenix,House,Detached,Urban,1967 - 1975,D,2,0,2,100,6,4,8,2.3,Cavity_Insulated,Solid,Pitched,Double,Yes,Gas,Gas Boiler - Standard,Fire - Gas,Water,100,0,1,0,No,No,,,6.512,65.12,15739.9,4475,655,50,3.35,Yes,No,Yes,Yes,ASHP,,,Loft insulation,12233.74,500,992,14.3,3.8,Yes,,,16/06/2021,Aaron services,ASHP,,Daikin,EDLQ07CAV3,7,R410A,,Water_new,200,,1,11,0,0,none,none,No,0,0,0,No,Yes,0,0,,no,5648.01,1752,,3055.83,0,500,0,0,0,0,3,0.5,,1C1R1P1S,2021-2022,09/12/2021 00:00,28/02/2022 23:30,17/12/2021 00:00,26/02/2022 23:30,"2021-12-09,2021-12-20,2021-12-25,2022-01-04,2022-01-28,2022-01-31,2022-02-06,2022-02-10,2022-02-24,2022-02-28","2021-12-17,2022-02-11,2022-02-21,2022-02-22,2022-02-26",0.7029718973527549,0.6320172278129641,0.6674945625828594,10,5,0.007049143,23665571.98789078,1.0009141201230237e-06,2
EOH1349,E.ON,NE5,,Working Full time (>30hrs),Skilled Manual Worker,"25,001 - 30,000",2020-11-03T00:00:00.000Z,Owner-Occupied,0.9,C2,5,NO,,NO,,NO,,,,YES,Potential for bill savings,YES,,NO,,NO,,NO,,NO,,17/11/2020,Phoenix,House,Semi-Detached,Urban,1950 - 1966,D,2,0,2,93,5,3,6,2.4,Cavity_Insulated,Suspended,Pitched,Double,Yes,Gas,Gas Boiler - Combi,Fire - Gas,,,0,1,0,No,No,,,7.02,75.48,14122,3566,0,55,2.96,No,No,No,Yes,Hybrid,,,None Required,10245,,679,14.3,3.8,Yes,,,07/01/2021,Phoenix,Hybrid,Separate_New Boiler,Daikin,EHY2KOMB28AA,4,R32,,,,,1,10,0,0,none,none,No,0,0,0,No,No,0,0,,no,5739.82,,,2870.84,0,0,0,0,0,0,2.5,,,1C1R1P1S,2021-2022,04/12/2021 00:00,25/02/2022 23:30,09/01/2022 00:00,26/02/2022 23:30,"2021-12-04,2021-12-05,2021-12-07,2021-12-12,2021-12-25,2021-12-29,2022-01-03,2022-01-16,2022-01-23,2022-02-25","2022-01-09,2022-01-11,2022-02-06,2022-02-15,2022-02-26",0.8991667925602626,0.882512862,0.8908398272326632,10,5,0.007061267,72961140.29251853,1.002430025789487e-06,2
EOH1358,E.ON,NE5,29,Working Full time (>30hrs),Clerical,"40,001 - 50,000",2021-03-04T00:00:00.000Z,Owner-Occupied,0.9,C1,1,YES,,NO,,YES,,NO,,NO,,YES,,NO,,NO,,NO,,NO,,04/03/2021,Phoenix,House,Semi-Detached,Urban,1967 - 1975,D,2,1,2,80,5,3,7,2.4,Cavity_Insulated,Solid,Pitched,Double,Yes,Gas,Gas Boiler - Combi,Fire - Gas,,,0,1,0,No,No,,,4.73,52.53,11458.9,3566,0,53,2.99,No,No,No,Yes,Hybrid,,,Barrier,10245.07,300,751,14.3,3.8,Yes,,,19/05/2021,Phoenix,Hybrid,Separate_New Boiler,Daikin,EHY2KOMB28AA,4,R32,,,,,1,8,0,0,none,enclosure,No,0,0,0,No,No,0,0,,no,5739.8,,,2871,0,0,0,0,0,0,2,0.25,,1C1R1P1S,2021-2022,03/12/2021 00:00,07/02/2022 23:30,15/12/2021 00:00,09/02/2022 23:30,"2021-12-03,2021-12-04,2021-12-05,2021-12-06,2021-12-08,2021-12-09,2021-12-12,2021-12-14,2022-02-03,2022-02-07","2021-12-15,2022-01-31,2022-02-05,2022-02-06,2022-02-09",0.3524036821565288,0.4039280402282474,0.3781658611923881,10,5,0.007058185,48827091.901945904,13.111128132269004,3
EOH1414,E.ON,NE3,42,Working Full time (>30hrs),Professional,"50,001+",2020-11-25T00:00:00.000Z,Owner-Occupied,1,AB,5,YES,,NO,,NO,,NO,,NO,,YES,,NO,,NO,,NO,,NO,,14/12/2020,Phoenix,House,Semi-Detached,Urban,1930 - 1949,D,2,1,2,86,5,3,8,2.5,Cavity_Insulated,Suspended,Pitched,Double,Yes,Gas,Gas Boiler - Combi,Fire - Wood,,,0,0,1,No,No,2865,8413,6.106,71,12242.5,3820,0,,,No,No,No,Yes,Hybrid,,,None Required,10799.27,,645,14.3,3.8,Yes,,,11/03/2021,Phoenix,Hybrid,Separate_New Boiler,Daikin,EHY2KOMB28AA,4,R32,,,,,1,8,0,0,none,none,No,0,0,0,No,No,0,0,,no,5739.82,,,3424.27,0,0,0,0,0,0,3,0,,1C1R1P1S,2021-2022,13/12/2021 00:00,22/02/2022 23:30,07/12/2021 00:00,18/01/2022 23:30,"2021-12-13,2021-12-20,2021-12-21,2022-01-14,2022-01-19,2022-01-23,2022-01-26,2022-02-05,2022-02-17,2022-02-22","2021-12-07,2021-12-14,2021-12-15,2022-01-07,2022-01-18",0.3568559605751752,0.3349036182116423,0.3458797893934088,10,5,0.008254961,21733260.427359533,1.5535887046119876,3
EOH1415,E.ON,NE3,25,Working Full time (>30hrs),Manager,"30,001 - 40,000",2021-02-17T00:00:00.000Z,Owner-Occupied,3,AB,1,YES,,NO,,NO,,NO,,NO,,NO,,NO,,NO,,NO,,NO,,22/02/2021,Phoenix,House,Mid-Terrace,Urban,1930 - 1949,,1,0,2,90,3,2,6,2.5,Solid_No_insulation,Suspended,Pitched,Double,Yes,Gas,Gas Boiler - Combi,,,,0,0,1,No,No,,,5.925,65.83,11874.9,3372,506,55,3.13,Yes,No,Yes,Yes,ASHP,,,Loft insulation,12065.57,500,814,14.3,3.8,Yes,,,28/05/2021,Aaron Services,ASHP,,Daikin,EDLQ07CAV3,7,R410A,,Water_new,200,,1,6,0,1,none,none,No,0,0,0,No,Yes,0,0,,no,5648.01,1752,,2887.66,0,500,0,0,0,0,2.5,0.5,,1C1R1P1S,2021-2022,04/12/2021 00:00,13/02/2022 23:30,20/12/2021 00:00,24/02/2022 23:30,"2021-12-04,2021-12-05,2021-12-08,2021-12-11,2021-12-25,2022-01-10,2022-01-12,2022-01-13,2022-01-20,2022-02-13","2021-12-20,2022-01-02,2022-02-07,2022-02-09,2022-02-24",0.2956468774053504,0.6044750539063118,0.4500609656558311,10,5,0.005661037,76232563.56,15.09979770507482,1
EOH1423,E.ON,NE4,51,Working Part time,Clerical,"12,501 - 16,200",2021-02-04T00:00:00.000Z,Owner-Occupied,11,C1,3,YES,,NO,,NO,,NO,,NO,,NO,,NO,,NO,,NO,,NO,,17/02/2021,Phoenix,House,Semi-Detached,Urban,1967 - 1975,D,2,0,2,104,5,3,9,2.5,Cavity_Insulated,Suspended,Pitched,Double,Yes,Gas,Gas Boiler - Combi,,,,0,0,1,No,No,1700,11300,7.56,72.7,13966.5,3820,0,50,3.02,No,No,No,Yes,Hybrid,,,Barrier,10800.04,300,890,14,4,Yes,,,26/03/2021,Phoenix,Hybrid,Separate_New Boiler,Daikin,EHY2KOMB28AA,4,R32,,,,,1,11,0,0,none,enclosure,No,0,2,0,No,No,0,0,,no,5739.82,,,3424,0,0,0,0,0,0,3.5,0,,1C1R1P1S,2021-2022,03/12/2021 00:00,26/01/2022 23:30,01/12/2021 00:00,27/01/2022 23:30,"2021-12-03,2021-12-06,2022-01-10,2022-01-11,2022-01-14,2022-01-16,2022-01-17,2022-01-22,2022-01-24,2022-01-26","2021-12-01,2022-01-09,2022-01-15,2022-01-23,2022-01-27",0.7590918698513075,0.9628560479051584,0.8609739588782329,10,5,0.003677666,23423947.30433424,15.703004051231666,2
EOH1512,E.ON,NE3,68,Working Part time,Professional,"25,001 - 30,000",2020-10-19T00:00:00.000Z,Owner-Occupied,20,C1,1,NO,,NO,,YES,,NO,,NO,,NO,,NO,,NO,,NO,,NO,,11/11/2020,Phoenix,House,Detached,Urban,1983 - 1990,,3,0,2,103,6,4,9,2.3,Solid_No_insulation,Suspended,Pitched,Double,Yes,Gas,Gas Boiler - Combi,Fire - Gas,,,0,1,1,No,No,,,7.371,71.56,14768,4457,0,55,2.96,No,No,No,Yes,Hybrid,,,None Required,10603.21,,736,14.3,3.8,Yes,,,05/03/2021,Phoenix,Hybrid,Separate_New Boiler,Daikin,EHY2KOMB32AA,4,R32,,,,,1,11,0,0,none,none,No,0,0,0,No,No,0,0,,no,5912.2,,,3055.83,0,0,0,0,0,0,3,0,,1C1R1P1S,2021-2022,02/12/2021 00:00,20/01/2022 23:30,08/12/2021 00:00,08/02/2022 23:30,"2021-12-02,2021-12-03,2021-12-10,2021-12-13,2021-12-14,2021-12-18,2022-01-05,2022-01-14,2022-01-15,2022-01-20","2021-12-08,2021-12-24,2022-01-24,2022-02-01,2022-02-08",0.3764113609215395,0.3591011769658374,0.3677562689436884,10,5,0.007219047,40487234.10434465,5.216187907,3
EOH1521,E.ON,NE3,75,Retired,Pensioner,"12,501 - 16,200",2021-04-26T00:00:00.000Z,Owner-Occupied,8,DE,4,NO,,NO,,NO,,NO,,NO,,YES,,NO,,NO,,NO,,NO,,05/05/2021,Phoenix,House,Semi-Detached,Urban,1967 - 1975,D,1,0,1,57,3,2,6,2.3,Cavity_Insulated,Suspended,Pitched,Double,Yes,Gas,Gas Boiler - Combi,Fire - Gas,,,0,1,1,No,No,,,4.116,72.21,9960.2,3356,491,49,3.46,Yes,No,Yes,Yes,ASHP,,,None Required,10060.85,,575,14.3,3.8,Yes,,,29/06/2021,Aaron services,ASHP,,Daikin,EDLQ05CAV3,5,R410A,,Water_new,150,,1,5,0,0,none,barrier,No,0,0,0,No,No,0,0,,no,5335,1701,,1945,0,0,0,0,0,0,2,0,,1C1R1P1S,2021-2022,01/12/2021 00:00,24/02/2022 23:30,11/12/2021 00:00,08/02/2022 23:30,"2021-12-01,2021-12-06,2021-12-14,2021-12-29,2022-01-01,2022-01-21,2022-02-01,2022-02-21,2022-02-22,2022-02-24","2021-12-11,2021-12-16,2022-01-19,2022-01-22,2022-02-08",0.4008563122203957,0.4117977929860603,0.406327053,10,5,0.008533607,14241034.55595361,2.1567167768577806,1
EOH1566,E.ON,NE5,76,Retired,Pensioner,"30,001 - 40,000",2020-12-18T00:00:00.000Z,Owner-Occupied,37,DE,5,YES,,NO,,NO,,NO,,NO,,YES,,NO,,NO,,NO,,NO,,13/01/2021,Phoenix,House,Detached,Urban,1900 - 1929,,1,0,2,92,5,3,8,2.7,Solid_No_insulation,Mix,Pitched,Double,Yes,Gas,Gas Boiler - Combi,Fire - Gas,,,0,1,1,No,No,1279,16704,10.58,114.96,21259.8,3515,0,,,No,No,No,Yes,Hybrid,,,None Required,10430.06,,1453,14.3,3.8,Yes,,,13/05/2021,Phoenix,Hybrid,Separate_New Boiler,Daikin,EHY2KOMB28AA,4,R32,,,,,1,9,0,0,none,none,No,0,1,1,No,No,0,0,,no,5739.82,,,3055,0,0,0,0,0,0,2,0,,1C1R1P1S,2021-2022,21/01/2022 00:00,26/02/2022 23:30,09/02/2022 00:00,28/02/2022 23:30,"2022-01-21,2022-01-31,2022-02-06,2022-02-07,2022-02-15,2022-02-16,2022-02-18,2022-02-22,2022-02-24,2022-02-26","2022-02-09,2022-02-11,2022-02-12,2022-02-14,2022-02-28",0.6910049198038035,0.7138250933501712,0.7024150065769874,10,5,0.005152851,39967014.52492597,5.875020965464334,1
EOH1578,E.ON,NE12,,Working Full time (>30hrs),Skilled Manual Worker,"25,001 - 30,000",2021-07-27T00:00:00.000Z,Owner-Occupied,16,C2,1,YES,,NO,,NO,,NO,,YES,Potential for bill savings,NO,,NO,,NO,,NO,,NO,,29/07/2021,Phoenix,House,Detached,Urban,1950 - 1966,,2,0,1,72,3,2,6,2.4,Cavity_Insulated,Suspended,Pitched,Double,Yes,Gas,Gas Boiler - Combi,Fire - Electric,,,0,0,1,No,No,,,5.13,70.71,9446.9,2996,131,50,3.35,Yes,No,Yes,Yes,ASHP,,,None Required,11308.8,,552,14.3,3.8,Yes,,,20/09/2021,Phoenix,ASHP,,Daikin,EDLQ07CAV3,7,R410A,,Water_new,180,,1,6,0,0,,,No,0,0,0,No,No,0,0,,no,5648.01,1752.34,,2130.88,,0,0,0,0,0,2,,,1C1R1P1S,2021-2022,03/12/2021 00:00,24/02/2022 23:30,01/12/2021 00:00,18/02/2022 23:30,"2021-12-03,2021-12-07,2021-12-10,2022-01-02,2022-01-04,2022-01-10,2022-01-18,2022-01-31,2022-02-11,2022-02-24","2021-12-01,2021-12-18,2022-02-15,2022-02-17,2022-02-18",0.5415537828776416,0.5565964280347478,0.5490751054561946,10,5,0.006532432,21722073.151207216,2.9678964251157884,2
EOH1628,E.ON,NE7,32,Working Full time (>30hrs),Professional,"50,001+",2020-10-27T00:00:00.000Z,Owner-Occupied,1,AB,1,YES,,NO,,YES,,NO,,NO,,NO,,NO,,NO,,NO,,NO,,05/11/2020,Phoenix,House,Mid-Terrace,Urban,1900 - 1929,D,3,0,2,75.4,4,3,6,2.5,Cavity_Insulated,Solid,Pitched,Double,Yes,Gas,Gas Boiler - Combi,,,,0,0,1,No,No,1917,11402,4.62,70.52,9254,3820,0,45,3.07,No,No,No,Yes with additional measures,Hybrid,,,Loft Insulation,10060,500,487,14.3,3.8,Yes,,,13/01/2021,Phoenix,Hybrid,Separate_New Boiler,Daikin,EHY2KOMB28AA,4,R32,,,,,1,9,0,0,none,none,No,0,0,0,No,Yes,0,0,,no,5739.82,,,3240.05,0,500,0,0,0,0,2,0.5,,1C1R1P1S,2021-2022,17/12/2021 00:00,26/02/2022 23:30,18/12/2021 00:00,13/02/2022 23:30,"2021-12-17,2021-12-19,2021-12-31,2022-01-04,2022-01-17,2022-01-20,2022-01-24,2022-01-25,2022-02-23,2022-02-26","2021-12-18,2022-01-19,2022-01-27,2022-02-08,2022-02-13",0.6564640078191706,0.5824275533626726,0.6194457805909216,10,5,0.006223731,96229533.95,1.001278486350261e-06,3
EOH1662,E.ON,NE4,69,Unemployed,Pensioner,"12,501 - 16,200",2021-03-04T00:00:00.000Z,Owner-Occupied,12,DE,1,YES,,NO,,NO,,NO,,YES,potential for bill savings,NO,,NO,,NO,,NO,,NO,,04/03/2021,Phoenix,House,Semi-Detached,Urban,1930 - 1949,,1,0,2,90,5,3,10,2.4,Cavity_Insulated,Suspended,Pitched,Double,Yes,Gas,Gas Boiler - Combi,,,,0,0,1,No,No,,,6.733,74.81,13534.1,2547,0,45,3.07,No,No,No,Yes,Hybrid,,,None Required,11711.61,,746,14.3,3.8,Yes,,,21/04/2021,Phoenix,Hybrid,Separate_New Boiler,Daikin,EHY2KOMB32AA,4,R32,,,,,1,13,0,0,none,none,No,0,0,0,No,No,0,0,,no,5912.2,,,4164.23,0,0,0,0,0,0,3,0,,1C1R1P1S,2021-2022,11/12/2021 00:00,23/02/2022 23:30,03/12/2021 00:00,11/02/2022 23:30,"2021-12-11,2021-12-20,2022-01-05,2022-01-09,2022-01-16,2022-01-18,2022-02-08,2022-02-16,2022-02-21,2022-02-23","2021-12-03,2021-12-19,2021-12-22,2022-01-23,2022-02-11",0.3336640962881275,0.613883101,0.4737735987702672,10,5,0.004903501,28678127.64930965,1.0661019510447407,1
EOH1664,E.ON,NE3,58,Working Full time (>30hrs),Professional,"40,001 - 50,000",2020-11-11T00:00:00.000Z,Owner-Occupied,10,AB,4,NO,,NO,,NO,,NO,,YES,Potential for bill savings,YES,,NO,,NO,,NO,,NO,,01/12/2020,Phoenix,House,Semi-Detached,Urban,1930 - 1949,C,2,1,2,100,5,3,9,2.5,Cavity_Insulated,Solid,Pitched,Double,Yes,Gas,Gas Boiler - Combi,,,,0,0,1,No,No,3050,8760,7.921,79.21,15867,1910,0,55,2.96,No,No,No,Yes,Hybrid,,,None Required,10430,,678,14.3,3.8,Yes,,,03/02/2021,Phoenix,Hybrid,Separate_New Boiler,Daikin,EHY2KOMB28AA,4,R32,,,,,1,11,0,0,none,none,No,0,0,0,No,No,0,0,,no,5739.82,,,3425.04,0,0,0,0,0,0,2.5,0,,1C1R1P1S,2021-2022,09/12/2021 00:00,27/02/2022 23:30,08/12/2021 00:00,03/02/2022 23:30,"2021-12-09,2021-12-28,2022-01-01,2022-01-17,2022-01-22,2022-02-04,2022-02-15,2022-02-16,2022-02-21,2022-02-27","2021-12-08,2021-12-12,2022-01-05,2022-01-21,2022-02-03",0.4430950728760869,0.7702323047947365,0.6066636888354117,10,5,0.008285959,25625162.13,4.248223988439425,3
EOH1684,E.ON,NE5,47,Working Part time,Casual worker,"0 - 12,500",2020-10-07T00:00:00.000Z,Owner-Occupied,46,DE,3,NO,,NO,,NO,,NO,,NO,,YES,,NO,,NO,,NO,,NO,,19/10/2020,Phoenix,House,Semi-Detached,Urban,1950 - 1966,D,1,0,1,58,3,2,7,2.4,Cavity_Insulated,Suspended,Pitched,Double,Yes,Gas,Gas Boiler - Combi,Fire - Electric,,,0,0,0,No,No,,,4.45,76.72,10759,2996,131,45,3.67,Yes,No,No,Yes,ASHP,,,None Required,11493,,568,14.3,3.8,Yes,,,28/01/2021,Aaron Services,ASHP,,Daikin,EDLQ07CAV3,7,R410A,,Water_new,180,,1,7,0,0,none,enclosure,No,0,0,0,No,No,0,0,,no,5648.01,1752.34,,2315.87,0,0,0,0,0,0,2.5,0,,1C1R1P1S,2021-2022,20/12/2021 00:00,13/02/2022 23:30,03/12/2021 00:00,24/01/2022 23:30,"2021-12-20,2021-12-26,2021-12-28,2022-01-08,2022-01-14,2022-01-15,2022-01-29,2022-01-30,2022-01-31,2022-02-13","2021-12-03,2021-12-19,2021-12-31,2022-01-20,2022-01-24",0.3898899696618941,0.415133008,0.402511489,10,5,0.010622761,45526291.87,10.90182696193774,1
EOH1699,E.ON,NE5,71,Retired,Pensioner,"16,201 - 20,000",2021-01-27T00:00:00.000Z,Owner-Occupied,26,DE,1,NO,,,,YES,,NO,,NO,,NO,,NO,,NO,,NO,,NO,,11/02/2021,Phoenix,House,Semi-Detached,Urban,1930 - 1949,,2,0,2,83,5,3,7,2.4,Cavity_Insulated,Suspended,Pitched,Double,Yes,Gas,Gas Boiler - Combi,Fire - Gas,,,0,1,1,No,No,,,5.79565,73.76,11654.9,3566,0,,,No,No,No,Yes with additional measures,Hybrid,,,Loft Insulation,10245.07,500,614,14.3,3.8,Yes,,,07/04/2021,Phoenix,Hybrid,Separate_New Boiler,Daikin,EHY2KOMB28AA,4,R32,,,,,1,8,0,0,none,none,No,0,0,0,No,Yes,0,0,,no,5739.82,,,2870.07,0,500,0,0,0,0,4,0,,1C1R1P1S,2021-2022,01/12/2021 00:00,25/02/2022 23:30,03/12/2021 00:00,27/01/2022 23:30,"2021-12-01,2021-12-20,2021-12-21,2021-12-22,2021-12-30,2022-01-28,2022-02-05,2022-02-06,2022-02-09,2022-02-25","2021-12-03,2021-12-15,2021-12-29,2021-12-31,2022-01-27",0.4480722022996582,0.5769980343332699,0.512535118,10,5,0.006019677,159890028.2744268,7.461494104234823,2
EOH1703,E.ON,NE15,70,Retired,Pensioner,Prefer not to say,2020-07-11T00:00:00.000Z,Owner-Occupied,32,DE,4,YES,,NO,,NO,,NO,,YES,,YES,,NO,,NO,,NO,,NO,,29/07/2020,E.ON,House,Detached,Urban,1976 - 1982,,2,0,2,91,6,4,11,2.4,Cavity_Insulated,Suspended,Pitched,Double,Yes,Gas,Gas Boiler - Standard,,Water,117,0,0,0,No,No,4000,10000,5.744,64.057,12948.1,3734,551,45,3.57,Yes,No,No,No,ASHP,,,,10996.59,,703,14.37,3.8,Yes,,,30/09/2020,Aaron Services,ASHP,,Daikin,EDLQ07CAV3,7,R410A,,Water_new,180,,1,11,0,0,none,none,No,0,0,0,Yes,No,0,0,,no,5648.01,1752.34,,1583.17,0,0,0,0,0,0,3,,,1C1R1P1S,2020-2021,10/12/2020 00:00,27/02/2021 23:30,26/01/2021 00:00,21/02/2021 23:30,"2020-12-10,2020-12-12,2020-12-19,2021-01-02,2021-01-17,2021-01-21,2021-01-30,2021-02-07,2021-02-12,2021-02-27","2021-01-26,2021-02-06,2021-02-14,2021-02-18,2021-02-21",0.6475829910222288,0.855921757,0.751752374,10,5,0.006237406,27926572.06013603,4.271497625275603,2
EOH1708,E.ON,NE13,54,Working Full time (>30hrs),Skilled Manual Worker,"20,001 - 25,000",2020-11-12T00:00:00.000Z,Owner-Occupied,18,C2,2,NO,,NO,,NO,,NO,,NO,,YES,,NO,,NO,,NO,,NO,,11/01/2021,Phoenix,House,Semi-Detached,Urban,1950 - 1966,C,2,2,2,85,5,3,8,2.4,Cavity_Insulated,Solid,Pitched,Double,Yes,Gas,Gas Boiler - Combi,,,,0,0,1,No,No,3497,15521,4.404,51.81,10673,3311,0,55,2.96,No,No,No,Yes with additional measures,Hybrid,,,Loft Insulation,9875.86,300,559,14.3,3.8,Yes,,,19/02/2021,Phoenix,Hybrid,Separate_New Boiler,Daikin,EHY2KOMB28AA,4,R32,,,,,1,8,0,0,none,none,No,0,0,0,No,Yes,0,0,,no,5739.82,,,2500.86,0,500,0,0,0,0,2.5,0.5,,1C1R1P1S,2021-2022,11/12/2021 00:00,12/02/2022 23:30,14/12/2021 00:00,04/02/2022 23:30,"2021-12-11,2021-12-15,2022-01-11,2022-01-12,2022-01-20,2022-01-26,2022-01-27,2022-01-28,2022-02-06,2022-02-12","2021-12-14,2021-12-18,2021-12-30,2022-01-17,2022-02-04",0.4415387000519711,0.747279673,0.5944091864673307,10,5,0.007113573,33770103.55232829,1.2748346982879202,4
EOH1712,E.ON,NE5,44,Working Full time (>30hrs),Manager,"12,501 - 16,200",2020-11-12T00:00:00.000Z,Owner-Occupied,15,C1,1,YES,,NO,,NO,,NO,,YES,Potential for bill savings,YES,,NO,,NO,,NO,,NO,,03/12/2020,Phoenix,House,Semi-Detached,Urban,1950 - 1966,D,2,2,2,116,5,3,7,2.7,Cavity_Insulated,Suspended,Pitched,Double,Yes,Gas,Gas Boiler - Combi,Fire - Gas,,,0,2,1,No,No,,,8.232,73.65,16552,3820,0,55,2.96,No,No,Yes,Yes with additional measures,Hybrid,,,Loft Insulation,9875.86,200,806,14.3,3.8,Yes,,,24/02/2021,Phoenix,Hybrid,Separate_New Boiler,Daikin,EHY2KOMB28AA,4,R32,,,,,1,8,0,0,none,none,No,0,0,0,No,Yes,0,0,,no,5739.82,,,2500.86,0,500,0,0,0,0,2.5,0.5,,1C1R1P1S,2021-2022,05/12/2021 00:00,28/02/2022 23:30,26/12/2021 00:00,19/02/2022 23:30,"2021-12-05,2021-12-18,2021-12-20,2021-12-29,2022-01-01,2022-01-10,2022-01-20,2022-02-05,2022-02-20,2022-02-28","2021-12-26,2022-01-05,2022-01-13,2022-02-18,2022-02-19",0.8664094923379155,0.8049103944089339,0.8356599433734246,10,5,0.003999737,47820944.72625748,1.003704590951977e-06,4
EOH1769,E.ON,NE20,32,Working Full time (>30hrs),Professional,"50,001+",2021-04-29T00:00:00.000Z,Owner-Occupied,20,DE,1,NO,,NO,,NO,,NO,,YES,Government grant / free,YES,,NO,,NO,,NO,,NO,,27/05/2021,Phoenix,House,Detached,Urban,1983 - 1990,C,2,1,1,92,5,3,11,2.4,Cavity_Insulated,Suspended,Pitched,Double,Yes,Gas,Gas Boiler - Combi,,,,0,0,0,No,No,,,7.82,73.3,18946.4,4002,181,45,3.42,Yes,No,Yes,Yes,ASHP,,,None Required,12949.95,,1121,14.3,3.8,Yes,,,05/10/2021,Phoenix,ASHP,,Daikin,EDLQ011CAV3,11,R410A,,Water_new,250,,1,11,0,0,,,No,0,0,0,No,No,0,0,,no,6364.21,1752.34,,3055.83,,0,0,0,0,0,3,,,1C1R1P1S,2021-2022,01/02/2022 00:00,28/02/2022 23:30,31/01/2022 00:00,25/02/2022 23:30,"2022-02-01,2022-02-05,2022-02-08,2022-02-11,2022-02-12,2022-02-13,2022-02-17,2022-02-19,2022-02-27,2022-02-28","2022-01-31,2022-02-02,2022-02-04,2022-02-07,2022-02-25",0.6494129789741979,0.6923783812719294,0.6708956801230637,10,5,0.004403,31215680.034638096,5.295039816824239,3
EOH1775,E.ON,NE3,34,Working Full time (>30hrs),Manager,"50,001+",2021-01-18T00:00:00.000Z,Owner-Occupied,3,C1,1,NO,,NO,,YES,,NO,,YES,Potential for bill savings,NO,,NO,,NO,,NO,,NO,,02/03/2021,Phoenix,House,Semi-Detached,Urban,1983 - 1990,C,2,1,2,71,4,3,8,2.3,Cavity_Insulated,Solid,Pitched,Double,Yes,Gas,Gas Boiler - Combi,,,,0,0,1,No,No,,,4.64,65.39,13506.6,3820,0,45,3.07,No,No,No,Yes,Hybrid,,,Barrier,10632.64,300,806,14,4,Yes,,,29/04/2021,Phoenix,Hybrid,Separate_New Boiler,Daikin,EHY2KOMB32AA,4,R32,,,,,1,8,0,1,none,enclosure,No,0,1,0,No,No,0,0,,no,5739.82,,,3257.64,0,0,0,0,0,0,3,0,,1C1R1P1S,2021-2022,01/12/2021 00:00,21/12/2021 23:30,08/12/2021 00:00,22/12/2021 23:30,"2021-12-01,2021-12-03,2021-12-04,2021-12-05,2021-12-10,2021-12-11,2021-12-14,2021-12-15,2021-12-16,2021-12-21","2021-12-08,2021-12-13,2021-12-18,2021-12-20,2021-12-22",0.5558446673979757,0.7678025558689867,0.6618236116334812,10,5,0.007706935,12905368.709993651,6.0149621505022886,3
EOH1794,E.ON,NE3,56,Working Full time (>30hrs),Manager,"50,001+",2020-11-24T00:00:00.000Z,Owner-Occupied,18,C1,1,NO,,NO,,YES,,NO,,YES,grant,YES,,NO,,NO,,NO,,NO,,10/12/2020,Phoenix,House,Detached,Urban,1996 - 2002,E,4,1,3,178,8,5,12,2.4,Cavity_Insulated,Solid,Pitched,Double,Yes,Gas,Gas Boiler - Standard,Fire - Gas,Water,250,1,1,1,No,No,,,13.873,93.1,33611,5731,0,,,No,No,No,Yes,Hybrid,,,None Required,13103,,1626,14.3,3.8,Yes,,,24/01/2021,Phoenix,Hybrid,Separate_New Boiler,Daikin,EHY2KOMB28AA,4,R32,,,,,2,18,0,0,none,none,No,0,0,0,No,No,0,0,,no,5912.2,,,5740.91,0,0,0,0,0,0,4,,,1C1R1P1S,2020-2021,24/01/2021 00:00,24/02/2021 23:30,27/01/2021 00:00,23/02/2021 23:30,"2021-01-24,2021-01-25,2021-01-28,2021-02-12,2021-02-13,2021-02-14,2021-02-19,2021-02-20,2021-02-21,2021-02-24","2021-01-27,2021-02-15,2021-02-18,2021-02-22,2021-02-23",0.9437434073551536,0.5350021279720927,0.739372768,10,5,0.003141408,67911426.63,3.4598147761977742,5
EOH1837,E.ON,NE6,53,Working Full time (>30hrs),Skilled Manual Worker,"40,001 - 50,000",2021-04-06T00:00:00.000Z,Owner-Occupied,0.9,C2,1,NO,,NO,,YES,,NO,,YES,Potential for bill savings,YES,,NO,,NO,,NO,,NO,,16/04/2021,Phoenix,House,End-Terrace,Urban,1950 - 1966,E,2,0,2,70,4,3,7,2.7,Cavity_Insulated,Suspended,Pitched,Double,Yes,Gas,Gas Boiler - Combi,Fire - Gas,,,0,1,1,No,No,,,5.425,77.5,10873.6,3515,0,55,2.96,No,No,No,Yes,Hybrid,,,Loft insulation,9690.87,500,705,14.3,3.8,Yes,,,02/07/2021,Phoenix,Hybrid,Separate_New Boiler,Daikin,EHY2KOMB28AA,4,R32,,,,,1,7,0,0,none,none,No,0,1,0,No,Yes,0,0,,no,5739,,,2316,0,500,0,0,0,0,3,0.5,,1C1R1P1S,2021-2022,29/01/2022 00:00,28/02/2022 23:30,01/02/2022 00:00,22/02/2022 23:30,"2022-01-29,2022-02-08,2022-02-15,2022-02-16,2022-02-20,2022-02-21,2022-02-23,2022-02-25,2022-02-27,2022-02-28","2022-02-01,2022-02-04,2022-02-11,2022-02-13,2022-02-22",0.6235277634050044,0.7135172429640639,0.6685225031845341,10,5,0.006696523,22574031.11844369,2.0813113469759865,2
EOH1847,E.ON,NE3,26,Working Full time (>30hrs),Professional,"25,001 - 30,000",2020-12-11T00:00:00.000Z,Owner-Occupied,0.9,C1,5,NO,,NO,,NO,,NO,,YES,potential for bill savings,YES,,NO,,NO,,NO,,NO,,05/01/2021,Phoenix,House,Semi-Detached,Urban,1950 - 1966,E,2,0,2,84,4,3,8,2.3,Cavity_Insulated,Solid,Pitched,Double,Yes,Gas,Gas Boiler - Combi,,,,0,0,1,No,No,,,6.272,74.66,15202.7,3311,0,55,2.96,No,No,No,Yes with additional measures,Hybrid,,,Loft Insulation barrier,10060.85,800,1006,14.3,3.8,Yes,,,07/05/2021,Phoenix,Hybrid,Separate_New Boiler,Daikin,EHY2KOMB28AA,4,R32,,,,,1,9,0,0,none,none,No,0,0,0,No,Yes,0,0,,no,5739.82,,,2685.85,0,0,0,0,0,0,3,0,,1C1R1P1S,2021-2022,02/12/2021 00:00,24/02/2022 23:30,13/12/2021 00:00,10/01/2022 23:30,"2021-12-02,2021-12-05,2021-12-19,2021-12-25,2021-12-31,2022-01-11,2022-02-15,2022-02-17,2022-02-23,2022-02-24","2021-12-13,2021-12-16,2021-12-28,2022-01-01,2022-01-10",0.7329796156469546,0.3832153942145715,0.558097505,10,5,0.014197324,11866695.940893767,1.1985107595766844,2
EOH1876,E.ON,NE7,55,Working Full time (>30hrs),Professional,"40,001 - 50,000",2021-02-08T00:00:00.000Z,Owner-Occupied,20,C1,3,YES,,NO,,NO,,NO,,YES,potential for bill savings,YES,Has solar panels,NO,,NO,,NO,,NO,,19/02/2021,Phoenix,House,Semi-Detached,Urban,1950 - 1966,C,3,0,2,137,7,4,10,2.6,Cavity_Insulated,Solid,Pitched,Double,Yes,Gas,Gas Boiler - Combi,Fire - Gas,,,0,1,0,No,No,,,8.728,63.7,17486.5,4776,0,,,No,No,No,Yes,Hybrid,,,Loft insulation,10430.06,500,1250,14.3,3.8,Yes,,,04/06/2021,Phoenix,Hybrid,Separate_New Boiler,Daikin,EHY2KOMB28AA,4,R32,,,,,1,12,0,0,none,none,No,0,1,0,No,Yes,0,0,,no,5739.82,,,3979.24,0,500,0,0,0,0,3,0.5,,1C1R1P1S,2021-2022,02/12/2021 00:00,28/01/2022 23:30,04/12/2021 00:00,16/01/2022 23:30,"2021-12-02,2021-12-31,2022-01-05,2022-01-07,2022-01-20,2022-01-21,2022-01-22,2022-01-25,2022-01-26,2022-01-28","2021-12-04,2021-12-25,2022-01-11,2022-01-13,2022-01-16",0.3231949965708134,0.275885586,0.2995402912577987,10,5,0.003097552,108121855.17599162,29.999999992009805,3
EOH1940,E.ON,NE15,49,Working Full time (>30hrs),Professional,"20,001 - 25,000",2020-11-09T00:00:00.000Z,Owner-Occupied,22,C1,3,YES,,NO,,NO,,NO,,YES,Potential for bill savings,NO,,NO,,NO,,NO,,NO,,25/11/2020,Phoenix,House,Semi-Detached,Urban,1983 - 1990,,2,1,2,64,3,2,5,2.4,Cavity_Insulated,Suspended,Pitched,Double,Yes,Gas,Gas Boiler - Combi,,,,0,0,1,No,No,,,6.117,95.57,14830,3820,0,55,2.96,No,No,No,Yes,Hybrid,,,Barrier,10245,200,744,14.3,3.8,Yes,,,28/01/2021,Phoenix,Hybrid,Separate_New Boiler,Daikin,EHY2KOMB28AA,4,R32,,,,,1,10,0,0,none,none,No,0,0,0,No,No,0,0,,no,5739.82,,,2870.84,0,0,0,0,0,0,2,0,,1C1R1P1S,2021-2022,01/12/2021 00:00,25/02/2022 23:30,12/12/2021 00:00,18/02/2022 23:30,"2021-12-01,2021-12-06,2021-12-15,2021-12-18,2021-12-21,2021-12-30,2022-01-13,2022-01-16,2022-02-13,2022-02-25","2021-12-12,2021-12-16,2022-01-01,2022-01-11,2022-02-18",0.7543778161043093,0.666338359,0.7103580876162112,10,5,0.008616915,23617970.61175512,1.0011100033348277e-06,3
EOH1947,E.ON,NE29,53,Working Full time (>30hrs),Skilled Manual Worker,"30,001 - 40,000",2021-02-05T00:00:00.000Z,Owner-Occupied,20,C2,2,NO,,NO,,NO,,NO,,NO,,YES,,NO,,NO,,NO,,NO,,12/02/2021,Phoenix,House,End-Terrace,Urban,1950 - 1966,,3,0,2,65,4,2,5,2.4,Cavity_Insulated,Solid,Pitched,Double,Yes,Gas,Gas Boiler - Combi,Fire - Gas,,,0,1,0,No,No,,,4.32,66.46,8656.5,3092,455,55,3.13,Yes,No,Yes,Yes,ASHP,,,Loft insulation,11627.37,500,624,14.3,3.8,Yes,,,09/06/2021,Aaron services,ASHP,,Daikin,EDLQ07CAV3,7,R410A,,Water_new,150,,1,7,0,0,none,none,No,0,1,1,Yes,Yes,0,0,,no,5648.01,1701,,2500,0,0,0,0,0,0,2,0,,1C1R1P1S,2021-2022,21/12/2021 00:00,26/02/2022 23:30,06/12/2021 00:00,13/02/2022 23:30,"2021-12-21,2021-12-29,2021-12-30,2022-01-16,2022-01-18,2022-01-30,2022-02-12,2022-02-19,2022-02-25,2022-02-26","2021-12-06,2021-12-10,2021-12-18,2021-12-31,2022-02-13",0.5874093288739826,0.6388628705114375,0.6131361,10,5,0.008321764,28885994.05231548,1.0009545785410002e-06,3
EOH1965,E.ON,NE3,32,Working Full time (>30hrs),Professional,"40,001 - 50,000",2020-11-25T00:00:00.000Z,Owner-Occupied,0.9,AB,5,NO,,NO,,YES,,NO,,NO,,YES,,NO,,NO,,NO,,NO,,18/12/2020,Phoenix,House,Semi-Detached,Urban,1930 - 1949,D,2,0,2,142,8,5,10,2.6,Cavity_Insulated,Suspended,Pitched,Double,Yes,Gas,Gas Boiler - Combi,Fire - Gas,,,0,2,1,No,No,6247,18683,10.032,70.64,20108.5,6713,982,62,3.09,No,No,Yes,No,HT_ASHP,,,None Required,17805.4,,1433,14.3,3.8,Yes,,,20/09/2021,Phoenix,HT_ASHP,,Daikin,EPRA16DAV3,16,R32,,water_new,300,,1,10,0,0,,,No,0,0,0,No,No,0,0,,no,9687.81,1752.34,,3609.26,,0,0,0,0,0,3,,,1C1R1P1S,2021-2022,02/12/2021 00:00,31/12/2021 23:30,11/12/2021 00:00,03/01/2022 23:30,"2021-12-02,2021-12-03,2021-12-07,2021-12-08,2021-12-14,2021-12-16,2021-12-17,2021-12-20,2021-12-26,2021-12-31","2021-12-11,2021-12-21,2021-12-25,2022-01-02,2022-01-03",0.4137675785699446,0.4057408345262974,0.409754207,10,5,0.003830496,67850948.88992779,9.453819104368204,2
EOH1970,E.ON,NE5,41,Working Full time (>30hrs),Professional,"50,001+",2020-11-12T00:00:00.000Z,Owner-Occupied,3,AB,5,YES,,NO,,NO,,NO,,YES,Potential for bill savings,YES,,NO,,NO,,NO,,NO,,02/12/2020,Phoenix,House,Semi-Detached,Urban,1950 - 1966,D,2,2,2,90,5,3,7,2.5,Cavity_Insulated,Solid,Pitched,Double,Yes,Gas,Gas Boiler - Combi,Fire - Gas,,,0,1,1,No,No,3368,15907,5.48,60.88,7270.1,1910,0,55,2.96,No,No,No,Yes with additional measures,Hybrid,,,Loft Insulation,10060.85,500,586,14,4,Yes,,,30/04/2021,Phoenix,Hybrid,Separate_New Boiler,Daikin,EHY2KOMB28AA,4,R32,,,,,1,9,0,0,none,none,No,0,1,0,No,Yes,0,0,,no,5739.82,,,2685.85,0,500,0,0,0,0,3,0,,1C1R1P1S,2021-2022,06/12/2021 00:00,25/01/2022 23:30,08/12/2021 00:00,16/01/2022 23:30,"2021-12-06,2021-12-11,2021-12-12,2021-12-17,2021-12-20,2022-01-05,2022-01-07,2022-01-09,2022-01-23,2022-01-25","2021-12-08,2021-12-16,2021-12-31,2022-01-14,2022-01-16",0.5302433396011148,0.9824503579304016,0.7563468487657583,10,5,0.006301094,43481480.65449878,12.131772769588858,4
EOH1986,E.ON,NE7,48,Working Full time (>30hrs),Skilled Manual Worker,"50,001+",2021-01-27T00:00:00.000Z,Owner-Occupied,5,C2,5,YES,,,,NO,,NO,,YES,,NO,,NO,,NO,,NO,,NO,,10/02/2021,Phoenix,House,Semi-Detached,Urban,1967 - 1975,E,2,2,2,141,5,3,10,2.6,Cavity_No_insulation,Suspended,Pitched,Double,Yes,Gas,Gas Boiler - Combi,Fire - Gas,,,0,2,1,No,No,4908,21059,8.95,76.54,17949.2,4122,607,49,3.15,Yes,No,Yes,Yes,ASHP,,,,16904.12,0,1119,14.3,3.8,Yes,,,20/09/2021,Phoenix,ASHP,,Daikin,EDLQ014CAV3,14,R410A,,Water_new,200,,1,14,0,0,,,No,0,0,0,Yes,Yes,0,0,,no,7677.36,1752.34,,4718.43,,500,0,0,0,0,3,,,1C1R1P1S,2021-2022,02/12/2021 00:00,08/12/2021 23:30,01/12/2021 00:00,01/12/2021 23:30,"2021-12-02,2021-12-03,2021-12-04,2021-12-05,2021-12-06,2021-12-07,2021-12-08",01/12/2021,0.4841192980318637,0.3455905583159592,0.4148549281739114,7,1,0.003770753,72644704.84680638,12.497621005837342,4
EOH1988,E.ON,NE20,71,Retired,Pensioner,"0 - 12,500",2021-03-16T00:00:00.000Z,Owner-Occupied,10,DE,3,YES,Already has solar panels,NO,,NO,,NO,,YES,potential for bill savings,NO,,NO,,NO,,NO,,NO,,16/03/2021,Phoenix,House,Detached,Urban,1967 - 1975,C,2,0,1,128,6,3,10,2.4,Cavity_Insulated,Suspended,Pitched,Double,Yes,Gas,Gas Boiler - Combi,Fire - Gas,,,0,1,1,No,No,,,8.967,70.05,21738.8,4994,0,57,3.41,No,No,Yes,No,HT_ASHP,,,None Required,17977.46,,1174,14.3,3.8,Yes,,,27/09/2021,Phoenix,HT_ASHP,,Daikin,EPRA14DAV3,14,R32,,PCM_New,,9,1,11,0,0,,,No,0,0,0,No,No,0,0,,no,9047.38,3500.65,,3794.25,,0,0,0,0,0,3,,,1C1R1P1S,2021-2022,06/12/2021 00:00,28/02/2022 23:30,05/01/2022 00:00,17/02/2022 23:30,"2021-12-06,2022-01-06,2022-01-30,2022-02-03,2022-02-06,2022-02-08,2022-02-15,2022-02-16,2022-02-26,2022-02-28","2022-01-05,2022-01-07,2022-02-07,2022-02-13,2022-02-17",0.4432890148062327,0.4918024017506144,0.4675457082784235,10,5,0.005139524,39642382.043458894,1.0001594596125462e-06,2
EOH2012,E.ON,NE7,54,Working Full time (>30hrs),Manager,"50,001+",2020-11-07T00:00:00.000Z,Owner-Occupied,23,AB,3,YES,,NO,,NO,,,,NO,,YES,Have solar panels,NO,,NO,,NO,,NO,,24/11/2020,Phoenix,House,Semi-Detached,Urban,1930 - 1949,,2,0,2,94,5,3,7,2.4,Cavity_Insulated,Solid,Pitched,Double,Yes,Gas,Gas Boiler - Combi,Fire - Gas,,,1,1,1,No,No,2817,19572,6.916,72.8,16638,3820,0,,,No,No,No,Yes with additional measures,Hybrid,,,Loft Insulation,10430,500,796,14.3,3.8,Yes,,,21/01/2021,Phoenix,Hybrid,Separate_New Boiler,Daikin,EHY2KOMB28AA,4,R32,,,,,3,9,0,0,none,none,No,0,0,0,No,Yes,0,0,,no,5739.82,,,3055.06,0,500,0,0,0,0,2.5,0.5,,1C1R1P1S,2021-2022,07/12/2021 00:00,23/02/2022 23:30,24/12/2021 00:00,06/02/2022 23:30,"2021-12-07,2021-12-10,2021-12-11,2021-12-16,2021-12-31,2022-01-15,2022-02-02,2022-02-21,2022-02-22,2022-02-23","2021-12-24,2021-12-25,2021-12-30,2022-01-27,2022-02-06",0.4213097380142692,0.3274758548588073,0.3743927964365383,10,5,0.002661463,109874107.39270392,24.48309279138684,2
EOH2022,E.ON,NE5,30,Working Full time (>30hrs),Professional,"50,001+",2020-12-11T00:00:00.000Z,Owner-Occupied,4,C1,2,NO,,NO,,YES,,NO,,NO,,YES,,NO,,NO,,NO,,NO,,05/01/2021,Phoenix,House,Semi-Detached,Urban,1967 - 1975,D,2,0,2,88,4,3,6,2.4,Cavity_Insulated,Suspended,Pitched,Double,Yes,Gas,Gas Boiler - Combi,,,,0,0,0,No,No,3186,20404,5.749,65.33,16712.6,3311,0,55,2.96,No,No,No,Yes,Hybrid,,,None Required,10971.65,,771,14.3,3.8,Yes,,,10/03/2021,Phoenix,Hybrid,Separate_New Boiler,Daikin,EHY2KOMB32AA,4,R32,,,,,1,9,0,0,none,none,No,0,0,0,No,No,0,0,,no,5912.2,,,3424.27,0,0,0,0,0,0,3,0,,1C1R1P1S,2021-2022,14/12/2021 00:00,22/02/2022 23:30,01/12/2021 00:00,14/01/2022 23:30,"2021-12-14,2021-12-17,2022-01-01,2022-01-02,2022-01-05,2022-01-07,2022-02-01,2022-02-07,2022-02-12,2022-02-22","2021-12-01,2021-12-06,2021-12-10,2021-12-21,2022-01-14",0.5936315836134906,0.6125259866042855,0.603078785,10,5,0.00781894,39044316.21554638,9.615614821621586,2
EOH2036,E.ON,NE13,32,Working Full time (>30hrs),Professional,"30,001 - 40,000",2021-01-11T00:00:00.000Z,Owner-Occupied,2,C1,5,YES,,NO,,NO,,NO,,NO,,YES,,NO,,NO,,NO,,NO,,20/01/2021,Phoenix,House,Detached,Urban,2012 onwards,C,2,1,2,90,5,3,9,2.4,Cavity_Insulated,Solid,Pitched,Double,Yes,Gas,Gas Boiler - Combi,,,,0,0,1,No,No,1354,,6.47,71.91,15674.9,4994,181,45,3.91,No,No,Yes,No,HT_ASHP,,,None Required,16826.45,,940,14.3,3.8,Yes,,,20/09/2021,Energist,HT_ASHP,,Vaillant,VWL 75/6 A 230V S2,7,R290,,Water_new,150,,1,8,0,0,,,No,0,0,0,No,No,0,0,,no,5789,1701.71,,2500.86,0,0,0,0,0,0,4,,,1C1R1P1S,2021-2022,03/02/2022 00:00,27/02/2022 23:30,05/02/2022 00:00,24/02/2022 23:30,"2022-02-03,2022-02-06,2022-02-11,2022-02-13,2022-02-14,2022-02-16,2022-02-20,2022-02-23,2022-02-26,2022-02-27","2022-02-05,2022-02-10,2022-02-12,2022-02-22,2022-02-24",0.6114311660607823,0.6424354800865902,0.6269333230736862,10,5,0.01262703,45132558.15231712,0.7640448051078994,3
EOH2045,E.ON,NE5,44,Working Full time (>30hrs),Supervisor,"50,001+",2021-01-15T00:00:00.000Z,Owner-Occupied,9,C1,1,YES,,NO,,NO,,NO,,NO,,YES,,NO,,NO,,NO,,NO,,04/02/2021,Phoenix,House,Detached,Urban,1983 - 1990,C,2,2,2,110,5,3,9,2.4,Cavity_Insulated,Solid,Pitched,Double,Yes,Gas,Gas Boiler - Combi,,,,0,0,0,No,No,3100,12000,7.2489,65.89,17560.6,4002,0,,,No,No,No,Yes with additional measures,Hybrid,,,Loft Insulation,10615.05,500,840,14.3,3.8,Yes,,,31/03/2021,Phoenix,Hybrid,Separate_New Boiler,Daikin,EHY2KOMB28AA,4,R32,,,,,1,10,0,0,none,none,No,0,0,0,No,Yes,0,0,,no,5739.82,,,3240,0,500,0,0,0,0,3,0.5,,1C1R1P1S,2021-2022,05/12/2021 00:00,26/02/2022 23:30,09/01/2022 00:00,22/02/2022 23:30,"2021-12-05,2021-12-12,2021-12-20,2021-12-27,2021-12-28,2022-01-04,2022-01-07,2022-01-31,2022-02-09,2022-02-26","2022-01-09,2022-01-10,2022-02-16,2022-02-17,2022-02-22",0.4853777107394583,0.7633094005371515,0.6243435556383049,10,5,0.006488407,19389263.162355453,3.5524396475184985,4
EOH2049,E.ON,NE5,61,Retired,Pensioner,"30,001 - 40,000",2020-07-08T00:00:00.000Z,Owner-Occupied,34,DE,2,YES,,NO,,YES,,NO,,YES,,NO,,NO,,NO,,NO,,NO,,14/07/2020,Pacifica,House,Semi-Detached,Urban,1950 - 1966,,2,2,2,78.23,7,3,9,2.2,Cavity_No_insulation,Solid,Pitched,Double,Yes,Gas,Gas Boiler - Combi,,,,0,0,1,Yes - Ground Loop,No,,,7.527,96,18238,4122,607,46,3.38,Yes,No,Yes,Yes,ASHP,,,None Required,12270.81,,980,14.3,3.8,Yes,,,09/12/2020,Aaron Services,ASHP,,Daikin,EDLQ011CAV3,11,R410A,,Water_new,200,,1,7,3,1,none,none,No,0,0,0,Yes,No,0,0,,no,5972.51,1752.34,,1900,0,0,0,0,0,0,2.5,,,1C1R1P1S,2021-2022,09/12/2021 00:00,25/02/2022 23:30,13/12/2021 00:00,26/02/2022 23:30,"2021-12-09,2021-12-11,2022-01-01,2022-01-07,2022-01-13,2022-01-17,2022-02-08,2022-02-15,2022-02-22,2022-02-25","2021-12-13,2021-12-20,2022-01-30,2022-02-20,2022-02-26",0.6060841059369887,0.707406466,0.6567452857343268,10,5,0.004619603,42090591.81106349,11.894334920522985,4
EOH2058,E.ON,NE4,36,Working Part time,Skilled Manual Worker,"30,001 - 40,000",2020-12-17T00:00:00.000Z,Owner-Occupied,1,C2,5,YES,,NO,,YES,,NO,,NO,,YES,,NO,,NO,,NO,,NO,,12/01/2021,Phoenix,House,Semi-Detached,Urban,1930 - 1949,C,2,1,2,81,4,2,6,2.6,Cavity_Insulated,Suspended,Pitched,Double,Yes,Gas,Gas Boiler - Combi,Fire - Wood,,,0,0,0,No,No,,,6.671,82.35,8532.4,2674,0,45,3.07,Yes,No,Yes,Yes with additional measures,Hybrid,,,Loft Insulation,10787.43,500,572,14.3,3.8,Yes,,,26/02/2021,Phoenix,Hybrid,Separate_New Boiler,Daikin,EHY2KOMB32AA,4,R32,,,,,1,10,0,0,none,none,No,0,0,0,No,Yes,0,0,,no,5912.2,,,3240.68,0,500,0,0,0,0,3,0.5,,1C1R1P1S,2021-2022,19/12/2021 00:00,27/02/2022 23:30,15/01/2022 00:00,17/02/2022 23:30,"2021-12-19,2021-12-31,2022-01-12,2022-01-16,2022-01-17,2022-01-28,2022-02-04,2022-02-07,2022-02-23,2022-02-27","2022-01-15,2022-01-19,2022-01-27,2022-02-10,2022-02-17",0.648056704,0.8382066037448118,0.7431316538780889,10,5,0.005678799,84167211.94006258,6.891085199668704,3
EOH2070,E.ON,NE7,51,Working Full time (>30hrs),Professional,"50,001+",2020-10-30T00:00:00.000Z,Owner-Occupied,11,AB,1,YES,,NO,,NO,,NO,,YES,,YES,,NO,,NO,,NO,,NO,,12/11/2020,Phoenix,House,Semi-Detached,Urban,1950 - 1966,C,2,2,2,143,7,5,11,2.5,Cavity_Insulated,Solid,Pitched,Double,Yes,Gas,Gas Boiler - Combi,Fire - Gas,,,0,1,1,No,No,,,9.474,66.25,18990,5349,0,55,2.96,No,No,No,Yes,Hybrid,,,None Required,12179,,939,14.3,3.8,Yes,,,14/05/2021,Phoenix,Hybrid,Separate_New Boiler,Daikin,EHY2KOMB32AA,4,R32,,,,,1,14,0,0,none,none,No,0,0,0,No,No,0,0,,no,5912.2,,,4631.74,0,0,0,0,0,0,3.5,0,,1C1R1P1S,2021-2022,01/12/2021 00:00,09/02/2022 23:30,19/12/2021 00:00,25/02/2022 23:30,"2021-12-01,2021-12-02,2021-12-07,2021-12-08,2022-01-11,2022-01-17,2022-01-20,2022-01-21,2022-02-05,2022-02-09","2021-12-19,2022-01-13,2022-02-08,2022-02-14,2022-02-25",0.4368640400918407,0.3415463249191478,0.3892051825054943,10,5,0.002165504,112597241.10548273,29.99999999879286,4
EOH2088,E.ON,NE15,52,Working Full time (>30hrs),Skilled Manual Worker,"30,001 - 40,000",2021-04-06T00:00:00.000Z,Owner-Occupied,9,C2,2,YES,,NO,,NO,,NO,,YES,Potential for bill savings,NO,,NO,,NO,,NO,,NO,,20/04/2021,Phoenix,House,Detached,Urban,2003 - 2006,B,2,0,2,109,6,4,12,2.4,Cavity_Insulated,Solid,Pitched,Double,Yes,Gas,Gas Boiler - Standard,Fire - Gas,Water,110,1,1,1,No,No,,,4.791,43.95,9623.8,5255,768,47,3.48,Yes,No,Yes,Yes,ASHP,,,Loft insulation,12787.18,500,779,14.3,3.8,Yes,,,24/06/2021,Aaron services,ASHP,,Daikin,EDLQ07CAV3,7,R410A,,Water_new,250,,1,10,0,0,none,none,No,0,1,0,No,Yes,0,0,,no,5648.01,1752,,3609.27,0,500,0,0,0,0,3,0.5,,1C1R1P1S,2021-2022,05/12/2021 00:00,18/02/2022 23:30,01/12/2021 00:00,09/02/2022 23:30,"2021-12-05,2021-12-17,2021-12-30,2022-01-11,2022-01-20,2022-01-21,2022-02-01,2022-02-05,2022-02-07,2022-02-18","2021-12-01,2021-12-02,2021-12-08,2021-12-27,2022-02-09",0.6773544470354498,0.4024634026731726,0.5399089248543112,10,5,0.007746071,47529963.979601294,1.0022431157884095e-06,2
EOH2089,E.ON,NE5,35,Working Full time (>30hrs),Skilled Manual Worker,"50,001+",2021-03-10T00:00:00.000Z,Owner-Occupied,3,C2,5,YES,,NO,,NO,,NO,,YES,Government grant / free,YES,,NO,,NO,,NO,,NO,,11/03/2021,Phoenix,House,Detached,Urban,1983 - 1990,D,2,2,2,127,6,4,11,2.4,Cavity_Insulated,Solid,Pitched,Double,Yes,Gas,Gas Boiler - Standard,,Water,150,0,0,0,No,No,3300,24000,9.024,78.94,21862.9,3820,0,55,2.96,No,No,No,Yes,Hybrid,,,None Required,10973,,1527,14.3,3.8,Yes,,,05/05/2021,Phoenix,Hybrid,Separate_New Boiler,Daikin,EHY2KOMB32AA,4,R32,,,,,1,13,0,0,none,none,No,0,0,0,No,Yes,0,0,,no,5912.2,,,3425.81,0,0,0,0,0,0,3,0,,1C1R1P1S,2021-2022,20/12/2021 00:00,20/02/2022 23:30,27/12/2021 00:00,26/02/2022 23:30,"2021-12-20,2022-01-01,2022-01-10,2022-01-11,2022-01-12,2022-01-15,2022-01-19,2022-01-22,2022-01-26,2022-02-20","2021-12-27,2021-12-30,2022-01-09,2022-02-25,2022-02-26",0.3848740145579101,0.3794906180801889,0.3821823163190495,10,5,0.005260124,98424912.92855737,1.1488865899708307e-06,4
EOH2097,E.ON,NE3,59,Retired,Pensioner,"25,001 - 30,000",2020-11-27T00:00:00.000Z,Owner-Occupied,23,DE,5,YES,,NO,,NO,,NO,,NO,,YES,,NO,,NO,,NO,,NO,,14/12/2020,Phoenix,House,Semi-Detached,Urban,1950 - 1966,,3,0,2,128,7,4,10,2.5,Cavity_Insulated,Solid,Pitched,Double,Yes,Gas,Gas Boiler - Combi,Fire - Gas,,,0,1,0,No,No,,,9.318,77.83,18662,4993,218,49,3.15,Yes,No,Yes,No,ASHP,,,tank cupboard,16372.3,600,1241,14.3,3.8,Yes,,,16/06/2021,Aaron services,ASHP,,Daikin,EDLQ014CAV3,14,R410A,,Water_new,300,,1,13,0,0,none,none,No,0,0,0,No,No,0,0,,no,9047,1752,,3794.92,0,0,0,0,0,0,3,0,,1C1R1P1S,2021-2022,01/12/2021 00:00,16/02/2022 23:30,08/02/2022 00:00,27/02/2022 23:30,"2021-12-01,2021-12-03,2021-12-13,2022-01-07,2022-01-26,2022-02-01,2022-02-11,2022-02-12,2022-02-14,2022-02-16","2022-02-08,2022-02-13,2022-02-19,2022-02-21,2022-02-27",0.4256155727239554,0.3747023840792968,0.4001589784016262,10,5,0.004665647,53903744.18453817,6.947729827495531,3
EOH2122,E.ON,NE38,73,Retired,Pensioner,"25,001 - 30,000",2021-06-18T00:00:00.000Z,Owner-Occupied,30,DE,3,NO,,NO,,YES,,NO,,NO,,YES,,NO,,NO,,NO,,NO,,13/07/2021,E.ON,House,Detached,Urban,1967 - 1975,,2,0,2,80,7,4,12,2.4,Cavity_Insulated,Suspended,Pitched,Double,Yes,Gas,Gas Boiler - Combi,,,,0,0,1,No,No,,,6.17,59.35,14688,3496,0,50,3.65,Yes,No,Yes,Yes,ASHP,,,None Required,13472.96,,811,12.5,3.7,Yes,,,16/08/2021,Energist,HT_ASHP,,Vaillant,VWL 75/6 A 230V S2,7,R290,,Water_new,200,,1,9,0,0,,,No,0,0,0,No,No,0,0,,no,5789,1752.34,,2755.87,0,0,0,0,0,0,4,,,1C1R1P1S,2021-2022,16/12/2021 00:00,13/02/2022 23:30,05/12/2021 00:00,23/02/2022 23:30,"2021-12-16,2021-12-25,2022-01-02,2022-01-08,2022-01-15,2022-01-18,2022-01-22,2022-02-08,2022-02-10,2022-02-13","2021-12-05,2021-12-14,2022-01-17,2022-02-07,2022-02-23",0.7938911333681886,0.8911605977057927,0.8425258655369907,10,5,0.004159226,40401850.65407329,9.762046215,2
EOH2125,E.ON,NE5,26,Working Full time (>30hrs),Professional,"20,001 - 25,000",2021-02-09T00:00:00.000Z,Owner-Occupied,2,C1,2,YES,,NO,,NO,,NO,,NO,,YES,,NO,,NO,,NO,,NO,,22/02/2021,Phoenix,House,Semi-Detached,Urban,1950 - 1966,D,1,0,1,57,3,2,5,2.4,Cavity_Insulated,Suspended,Pitched,Double,Yes,Gas,Gas Boiler - Combi,,,,0,0,0,No,No,,,5.28,92.6,12782.6,3356,491,47,3.48,Yes with additional measures,No,Yes,No,ASHP,,,Barrier,11628.14,300,765,14,4,Yes,,,16/04/2021,Phoenix,ASHP,,Daikin,EDLQ07CAV7,7,R410A,,Water_new,150,,1,8,0,0,none,enclosure,No,0,0,0,No,No,0,0,,no,5648,1701,,2500.86,0,0,0,0,0,0,3,0,,1C1R1P1S,2021-2022,22/01/2022 00:00,25/02/2022 23:30,23/01/2022 00:00,16/02/2022 23:30,"2022-01-22,2022-01-24,2022-01-27,2022-01-30,2022-02-08,2022-02-11,2022-02-18,2022-02-19,2022-02-22,2022-02-25","2022-01-23,2022-01-31,2022-02-04,2022-02-06,2022-02-16",0.6089815349350474,0.5297889198322583,0.5693852273836528,10,5,0.006306864,14196030.119367996,2.303149072,1
EOH2128,E.ON,NE12,,Working Full time (>30hrs),Professional,"40,001 - 50,000",2020-12-11T00:00:00.000Z,Owner-Occupied,0.9,C1,1,YES,,NO,,YES,,NO,,NO,,NO,,NO,,NO,,NO,,NO,,06/01/2021,Phoenix,House,Semi-Detached,Urban,1950 - 1966,D,2,0,2,76,6,3,7,2.4,Cavity_Insulated,Suspended,Pitched,Double,Yes,Gas,Gas Boiler - Combi,Fire - Gas,,,0,1,1,No,No,,,6.393,84.11,12800.9,2105,322,49,3.39,Yes,No,No,Yes,ASHP,,,Barrier,11998.12,300,725,14.3,3.8,Yes,,,21/04/2021,Aaron Services,ASHP,,Daikin,EDLQ07CAV7,7,R410A,,Water_new,150,,1,10,0,0,none,none,No,0,1,0,No,No,0,0,,no,5648,1701,,2870.1,0,0,0,0,0,0,3,0,,1C1R1P1S,2021-2022,16/12/2021 00:00,21/02/2022 23:30,25/12/2021 00:00,27/02/2022 23:30,"2021-12-16,2021-12-18,2021-12-29,2022-01-15,2022-01-21,2022-01-29,2022-02-02,2022-02-09,2022-02-16,2022-02-21","2021-12-25,2022-01-11,2022-01-14,2022-02-24,2022-02-27",0.762167871,0.9751957701544328,0.8686818207015425,10,5,0.006678674,21155814.85790011,3.886072878665162,2
EOH2155,E.ON,NE15,33,Working Full time (>30hrs),Professional,"50,001+",2021-01-13T00:00:00.000Z,Owner-Occupied,3,AB,5,YES,,NO,,NO,,NO,,NO,,NO,,NO,,NO,,NO,,NO,,19/02/2021,Phoenix,House,Semi-Detached,Urban,1930 - 1949,,2,0,2,93,5,3,8,2.7,Solid_No_insulation,Solid,Pitched,Double,Yes,Gas,Gas Boiler - Combi,,,,0,0,1,No,No,1750,16000,6.57,70.65,13211.4,3566,0,53,2.99,No,No,No,Yes,Hybrid,,,None Required,10048.24,,838,14.3,3.8,Yes,,,06/07/2021,Phoenix,Hybrid,Separate_New Boiler,Daikin,EHY2KOMB32AA,4,R32,,,,,1,8,0,0,none,none,No,0,0,0,No,No,0,0,,no,5912,,,2501,0,0,0,0,0,0,2.5,0,,1C1R1P1S,2021-2022,07/01/2022 00:00,19/01/2022 23:30,09/01/2022 00:00,16/01/2022 23:30,"2022-01-07,2022-01-08,2022-01-10,2022-01-11,2022-01-13,2022-01-14,2022-01-15,2022-01-17,2022-01-18,2022-01-19","2022-01-09,2022-01-12,2022-01-16",0.4008779181801969,0.3841391499375057,0.3925085340588513,10,3,0.00588643,37044299.55504539,5.894628787118117,2
